{
  "address": "0x1d25Bbf952781e0c75d248904B5422FeE9FcA558",
  "abi": [
    {
      "anonymous": false,
      "inputs": [
        {
          "indexed": true,
          "internalType": "bytes32",
          "name": "channelId",
          "type": "bytes32"
        },
        {
          "indexed": false,
          "internalType": "uint48",
          "name": "newTurnNumRecord",
          "type": "uint48"
        }
      ],
      "name": "ChallengeCleared",
      "type": "event"
    },
    {
      "anonymous": false,
      "inputs": [
        {
          "indexed": true,
          "internalType": "bytes32",
          "name": "channelId",
          "type": "bytes32"
        },
        {
          "indexed": false,
          "internalType": "uint48",
          "name": "turnNumRecord",
          "type": "uint48"
        },
        {
          "indexed": false,
          "internalType": "uint48",
          "name": "finalizesAt",
          "type": "uint48"
        },
        {
          "indexed": false,
          "internalType": "address",
          "name": "challenger",
          "type": "address"
        },
        {
          "indexed": false,
          "internalType": "bool",
          "name": "isFinal",
          "type": "bool"
        },
        {
          "components": [
            {
              "internalType": "uint256",
              "name": "chainId",
              "type": "uint256"
            },
            {
              "internalType": "address[]",
              "name": "participants",
              "type": "address[]"
            },
            {
              "internalType": "uint48",
              "name": "channelNonce",
              "type": "uint48"
            },
            {
              "internalType": "address",
              "name": "appDefinition",
              "type": "address"
            },
            {
              "internalType": "uint48",
              "name": "challengeDuration",
              "type": "uint48"
            }
          ],
          "indexed": false,
          "internalType": "struct IForceMove.FixedPart",
          "name": "fixedPart",
          "type": "tuple"
        },
        {
          "components": [
            {
              "internalType": "bytes",
              "name": "outcome",
              "type": "bytes"
            },
            {
              "internalType": "bytes",
              "name": "appData",
              "type": "bytes"
            }
          ],
          "indexed": false,
          "internalType": "struct ForceMoveApp.VariablePart[]",
          "name": "variableParts",
          "type": "tuple[]"
        },
        {
          "components": [
            {
              "internalType": "uint8",
              "name": "v",
              "type": "uint8"
            },
            {
              "internalType": "bytes32",
              "name": "r",
              "type": "bytes32"
            },
            {
              "internalType": "bytes32",
              "name": "s",
              "type": "bytes32"
            }
          ],
          "indexed": false,
          "internalType": "struct IForceMove.Signature[]",
          "name": "sigs",
          "type": "tuple[]"
        },
        {
          "indexed": false,
          "internalType": "uint8[]",
          "name": "whoSignedWhat",
          "type": "uint8[]"
        }
      ],
      "name": "ChallengeRegistered",
      "type": "event"
    },
    {
      "anonymous": false,
      "inputs": [
        {
          "indexed": true,
          "internalType": "bytes32",
          "name": "channelId",
          "type": "bytes32"
        }
      ],
      "name": "Concluded",
      "type": "event"
    },
    {
      "inputs": [
        {
          "components": [
            {
              "internalType": "uint256",
              "name": "chainId",
              "type": "uint256"
            },
            {
              "internalType": "address[]",
              "name": "participants",
              "type": "address[]"
            },
            {
              "internalType": "uint48",
              "name": "channelNonce",
              "type": "uint48"
            },
            {
              "internalType": "address",
              "name": "appDefinition",
              "type": "address"
            },
            {
              "internalType": "uint48",
              "name": "challengeDuration",
              "type": "uint48"
            }
          ],
          "internalType": "struct IForceMove.FixedPart",
          "name": "fixedPart",
          "type": "tuple"
        },
        {
          "internalType": "uint48",
          "name": "largestTurnNum",
          "type": "uint48"
        },
        {
          "components": [
            {
              "internalType": "bytes",
              "name": "outcome",
              "type": "bytes"
            },
            {
              "internalType": "bytes",
              "name": "appData",
              "type": "bytes"
            }
          ],
          "internalType": "struct ForceMoveApp.VariablePart[]",
          "name": "variableParts",
          "type": "tuple[]"
        },
        {
          "internalType": "uint8",
          "name": "isFinalCount",
          "type": "uint8"
        },
        {
          "components": [
            {
              "internalType": "uint8",
              "name": "v",
              "type": "uint8"
            },
            {
              "internalType": "bytes32",
              "name": "r",
              "type": "bytes32"
            },
            {
              "internalType": "bytes32",
              "name": "s",
              "type": "bytes32"
            }
          ],
          "internalType": "struct IForceMove.Signature[]",
          "name": "sigs",
          "type": "tuple[]"
        },
        {
          "internalType": "uint8[]",
          "name": "whoSignedWhat",
          "type": "uint8[]"
        },
        {
          "components": [
            {
              "internalType": "uint8",
              "name": "v",
              "type": "uint8"
            },
            {
              "internalType": "bytes32",
              "name": "r",
              "type": "bytes32"
            },
            {
              "internalType": "bytes32",
              "name": "s",
              "type": "bytes32"
            }
          ],
          "internalType": "struct IForceMove.Signature",
          "name": "challengerSig",
          "type": "tuple"
        }
      ],
      "name": "challenge",
      "outputs": [],
      "stateMutability": "nonpayable",
      "type": "function"
    },
    {
      "inputs": [
        {
          "internalType": "bytes32",
          "name": "",
          "type": "bytes32"
        }
      ],
      "name": "channelStorageHashes",
      "outputs": [
        {
          "internalType": "bytes32",
          "name": "",
          "type": "bytes32"
        }
      ],
      "stateMutability": "view",
      "type": "function"
    },
    {
      "inputs": [
        {
          "components": [
            {
              "internalType": "uint256",
              "name": "chainId",
              "type": "uint256"
            },
            {
              "internalType": "address[]",
              "name": "participants",
              "type": "address[]"
            },
            {
              "internalType": "uint48",
              "name": "channelNonce",
              "type": "uint48"
            },
            {
              "internalType": "address",
              "name": "appDefinition",
              "type": "address"
            },
            {
              "internalType": "uint48",
              "name": "challengeDuration",
              "type": "uint48"
            }
          ],
          "internalType": "struct IForceMove.FixedPart",
          "name": "fixedPart",
          "type": "tuple"
        },
        {
          "internalType": "uint48",
          "name": "largestTurnNum",
          "type": "uint48"
        },
        {
          "components": [
            {
              "internalType": "bytes",
              "name": "outcome",
              "type": "bytes"
            },
            {
              "internalType": "bytes",
              "name": "appData",
              "type": "bytes"
            }
          ],
          "internalType": "struct ForceMoveApp.VariablePart[]",
          "name": "variableParts",
          "type": "tuple[]"
        },
        {
          "internalType": "uint8",
          "name": "isFinalCount",
          "type": "uint8"
        },
        {
          "components": [
            {
              "internalType": "uint8",
              "name": "v",
              "type": "uint8"
            },
            {
              "internalType": "bytes32",
              "name": "r",
              "type": "bytes32"
            },
            {
              "internalType": "bytes32",
              "name": "s",
              "type": "bytes32"
            }
          ],
          "internalType": "struct IForceMove.Signature[]",
          "name": "sigs",
          "type": "tuple[]"
        },
        {
          "internalType": "uint8[]",
          "name": "whoSignedWhat",
          "type": "uint8[]"
        }
      ],
      "name": "checkpoint",
      "outputs": [],
      "stateMutability": "nonpayable",
      "type": "function"
    },
    {
      "inputs": [
        {
          "internalType": "uint48",
          "name": "largestTurnNum",
          "type": "uint48"
        },
        {
          "components": [
            {
              "internalType": "uint256",
              "name": "chainId",
              "type": "uint256"
            },
            {
              "internalType": "address[]",
              "name": "participants",
              "type": "address[]"
            },
            {
              "internalType": "uint48",
              "name": "channelNonce",
              "type": "uint48"
            },
            {
              "internalType": "address",
              "name": "appDefinition",
              "type": "address"
            },
            {
              "internalType": "uint48",
              "name": "challengeDuration",
              "type": "uint48"
            }
          ],
          "internalType": "struct IForceMove.FixedPart",
          "name": "fixedPart",
          "type": "tuple"
        },
        {
          "internalType": "bytes32",
          "name": "appPartHash",
          "type": "bytes32"
        },
        {
          "internalType": "bytes32",
          "name": "outcomeHash",
          "type": "bytes32"
        },
        {
          "internalType": "uint8",
          "name": "numStates",
          "type": "uint8"
        },
        {
          "internalType": "uint8[]",
          "name": "whoSignedWhat",
          "type": "uint8[]"
        },
        {
          "components": [
            {
              "internalType": "uint8",
              "name": "v",
              "type": "uint8"
            },
            {
              "internalType": "bytes32",
              "name": "r",
              "type": "bytes32"
            },
            {
              "internalType": "bytes32",
              "name": "s",
              "type": "bytes32"
            }
          ],
          "internalType": "struct IForceMove.Signature[]",
          "name": "sigs",
          "type": "tuple[]"
        }
      ],
      "name": "conclude",
      "outputs": [],
      "stateMutability": "nonpayable",
      "type": "function"
    },
    {
      "inputs": [
        {
          "internalType": "uint48",
          "name": "largestTurnNum",
          "type": "uint48"
        },
        {
          "components": [
            {
              "internalType": "uint256",
              "name": "chainId",
              "type": "uint256"
            },
            {
              "internalType": "address[]",
              "name": "participants",
              "type": "address[]"
            },
            {
              "internalType": "uint48",
              "name": "channelNonce",
              "type": "uint48"
            },
            {
              "internalType": "address",
              "name": "appDefinition",
              "type": "address"
            },
            {
              "internalType": "uint48",
              "name": "challengeDuration",
              "type": "uint48"
            }
          ],
          "internalType": "struct IForceMove.FixedPart",
          "name": "fixedPart",
          "type": "tuple"
        },
        {
          "internalType": "bytes32",
          "name": "appPartHash",
          "type": "bytes32"
        },
        {
          "internalType": "bytes",
          "name": "outcomeBytes",
          "type": "bytes"
        },
        {
          "internalType": "uint8",
          "name": "numStates",
          "type": "uint8"
        },
        {
          "internalType": "uint8[]",
          "name": "whoSignedWhat",
          "type": "uint8[]"
        },
        {
          "components": [
            {
              "internalType": "uint8",
              "name": "v",
              "type": "uint8"
            },
            {
              "internalType": "bytes32",
              "name": "r",
              "type": "bytes32"
            },
            {
              "internalType": "bytes32",
              "name": "s",
              "type": "bytes32"
            }
          ],
          "internalType": "struct IForceMove.Signature[]",
          "name": "sigs",
          "type": "tuple[]"
        }
      ],
      "name": "concludePushOutcomeAndTransferAll",
      "outputs": [],
      "stateMutability": "nonpayable",
      "type": "function"
    },
    {
      "inputs": [
        {
          "internalType": "bytes32",
          "name": "channelId",
          "type": "bytes32"
        }
      ],
      "name": "getChannelStorage",
      "outputs": [
        {
          "internalType": "uint48",
          "name": "turnNumRecord",
          "type": "uint48"
        },
        {
          "internalType": "uint48",
          "name": "finalizesAt",
          "type": "uint48"
        },
        {
          "internalType": "uint160",
          "name": "fingerprint",
          "type": "uint160"
        }
      ],
      "stateMutability": "view",
      "type": "function"
    },
    {
      "inputs": [
        {
          "internalType": "bytes32",
          "name": "channelId",
          "type": "bytes32"
        },
        {
          "internalType": "uint48",
          "name": "turnNumRecord",
          "type": "uint48"
        },
        {
          "internalType": "uint48",
          "name": "finalizesAt",
          "type": "uint48"
        },
        {
          "internalType": "bytes32",
          "name": "stateHash",
          "type": "bytes32"
        },
        {
          "internalType": "address",
          "name": "challengerAddress",
          "type": "address"
        },
        {
          "internalType": "bytes",
          "name": "outcomeBytes",
          "type": "bytes"
        }
      ],
      "name": "pushOutcome",
      "outputs": [],
      "stateMutability": "nonpayable",
      "type": "function"
    },
    {
      "inputs": [
        {
          "internalType": "bytes32",
          "name": "channelId",
          "type": "bytes32"
        },
        {
          "internalType": "uint48",
          "name": "turnNumRecord",
          "type": "uint48"
        },
        {
          "internalType": "uint48",
          "name": "finalizesAt",
          "type": "uint48"
        },
        {
          "internalType": "bytes32",
          "name": "stateHash",
          "type": "bytes32"
        },
        {
          "internalType": "address",
          "name": "challengerAddress",
          "type": "address"
        },
        {
          "internalType": "bytes",
          "name": "outcomeBytes",
          "type": "bytes"
        }
      ],
      "name": "pushOutcomeAndTransferAll",
      "outputs": [],
      "stateMutability": "nonpayable",
      "type": "function"
    },
    {
      "inputs": [
        {
          "internalType": "address",
          "name": "challenger",
          "type": "address"
        },
        {
          "internalType": "bool[2]",
          "name": "isFinalAB",
          "type": "bool[2]"
        },
        {
          "components": [
            {
              "internalType": "uint256",
              "name": "chainId",
              "type": "uint256"
            },
            {
              "internalType": "address[]",
              "name": "participants",
              "type": "address[]"
            },
            {
              "internalType": "uint48",
              "name": "channelNonce",
              "type": "uint48"
            },
            {
              "internalType": "address",
              "name": "appDefinition",
              "type": "address"
            },
            {
              "internalType": "uint48",
              "name": "challengeDuration",
              "type": "uint48"
            }
          ],
          "internalType": "struct IForceMove.FixedPart",
          "name": "fixedPart",
          "type": "tuple"
        },
        {
          "components": [
            {
              "internalType": "bytes",
              "name": "outcome",
              "type": "bytes"
            },
            {
              "internalType": "bytes",
              "name": "appData",
              "type": "bytes"
            }
          ],
          "internalType": "struct ForceMoveApp.VariablePart[2]",
          "name": "variablePartAB",
          "type": "tuple[2]"
        },
        {
          "components": [
            {
              "internalType": "uint8",
              "name": "v",
              "type": "uint8"
            },
            {
              "internalType": "bytes32",
              "name": "r",
              "type": "bytes32"
            },
            {
              "internalType": "bytes32",
              "name": "s",
              "type": "bytes32"
            }
          ],
          "internalType": "struct IForceMove.Signature",
          "name": "sig",
          "type": "tuple"
        }
      ],
      "name": "respond",
      "outputs": [],
      "stateMutability": "nonpayable",
      "type": "function"
    },
    {
      "inputs": [
        {
          "internalType": "uint256",
          "name": "nParticipants",
          "type": "uint256"
        },
        {
          "internalType": "bool[2]",
          "name": "isFinalAB",
          "type": "bool[2]"
        },
        {
          "components": [
            {
              "internalType": "bytes",
              "name": "outcome",
              "type": "bytes"
            },
            {
              "internalType": "bytes",
              "name": "appData",
              "type": "bytes"
            }
          ],
          "internalType": "struct ForceMoveApp.VariablePart[2]",
          "name": "ab",
          "type": "tuple[2]"
        },
        {
          "internalType": "uint48",
          "name": "turnNumB",
          "type": "uint48"
        },
        {
          "internalType": "address",
          "name": "appDefinition",
          "type": "address"
        }
      ],
      "name": "validTransition",
      "outputs": [
        {
          "internalType": "bool",
          "name": "",
          "type": "bool"
        }
      ],
      "stateMutability": "pure",
      "type": "function"
    }
  ],
  "transactionHash": "0xe6088135a8b028687229d09e6550b29b8c91ae40ea2ecf4e22e45af89d30c66a",
  "receipt": {
    "to": "0x4e59b44847b379578588920cA78FbF26c0B4956C",
    "from": "0x87612aAD373586A38062c29F833A2AbC72038591",
    "contractAddress": null,
    "transactionIndex": 14,
    "gasUsed": "3649906",
    "logsBloom": "0x00000000000000000000000000000000000000000000000000000000000000000000000000000000000000000000000000000000000000000000000000000000000000000000000000000000000000000000000000000000000000000000000000000000000000000000000000000000000000000000000000000000000000000000000000000000000000000000000000000000000000000000000000000000000000000000000000000000000000000000000000000000000000000000000000000000000000000000000000000000000000000000000000000000000000000000000000000000000000000000000000000000000000000000000000000000",
    "blockHash": "0xf08695669c958f7248a9719d5c08ae9cc2b0ae613ad030a917916718c0b35266",
    "transactionHash": "0xe6088135a8b028687229d09e6550b29b8c91ae40ea2ecf4e22e45af89d30c66a",
    "logs": [],
    "blockNumber": 7543510,
    "cumulativeGasUsed": "6697225",
    "status": 1,
    "byzantium": true
  },
  "args": [],
  "solcInputHash": "07c8efabe936280cd467aa2047e8befa",
  "metadata": "{\"compiler\":{\"version\":\"0.6.12+commit.27d51765\"},\"language\":\"Solidity\",\"output\":{\"abi\":[{\"anonymous\":false,\"inputs\":[{\"indexed\":true,\"internalType\":\"bytes32\",\"name\":\"channelId\",\"type\":\"bytes32\"},{\"indexed\":false,\"internalType\":\"uint48\",\"name\":\"newTurnNumRecord\",\"type\":\"uint48\"}],\"name\":\"ChallengeCleared\",\"type\":\"event\"},{\"anonymous\":false,\"inputs\":[{\"indexed\":true,\"internalType\":\"bytes32\",\"name\":\"channelId\",\"type\":\"bytes32\"},{\"indexed\":false,\"internalType\":\"uint48\",\"name\":\"turnNumRecord\",\"type\":\"uint48\"},{\"indexed\":false,\"internalType\":\"uint48\",\"name\":\"finalizesAt\",\"type\":\"uint48\"},{\"indexed\":false,\"internalType\":\"address\",\"name\":\"challenger\",\"type\":\"address\"},{\"indexed\":false,\"internalType\":\"bool\",\"name\":\"isFinal\",\"type\":\"bool\"},{\"components\":[{\"internalType\":\"uint256\",\"name\":\"chainId\",\"type\":\"uint256\"},{\"internalType\":\"address[]\",\"name\":\"participants\",\"type\":\"address[]\"},{\"internalType\":\"uint48\",\"name\":\"channelNonce\",\"type\":\"uint48\"},{\"internalType\":\"address\",\"name\":\"appDefinition\",\"type\":\"address\"},{\"internalType\":\"uint48\",\"name\":\"challengeDuration\",\"type\":\"uint48\"}],\"indexed\":false,\"internalType\":\"struct IForceMove.FixedPart\",\"name\":\"fixedPart\",\"type\":\"tuple\"},{\"components\":[{\"internalType\":\"bytes\",\"name\":\"outcome\",\"type\":\"bytes\"},{\"internalType\":\"bytes\",\"name\":\"appData\",\"type\":\"bytes\"}],\"indexed\":false,\"internalType\":\"struct ForceMoveApp.VariablePart[]\",\"name\":\"variableParts\",\"type\":\"tuple[]\"},{\"components\":[{\"internalType\":\"uint8\",\"name\":\"v\",\"type\":\"uint8\"},{\"internalType\":\"bytes32\",\"name\":\"r\",\"type\":\"bytes32\"},{\"internalType\":\"bytes32\",\"name\":\"s\",\"type\":\"bytes32\"}],\"indexed\":false,\"internalType\":\"struct IForceMove.Signature[]\",\"name\":\"sigs\",\"type\":\"tuple[]\"},{\"indexed\":false,\"internalType\":\"uint8[]\",\"name\":\"whoSignedWhat\",\"type\":\"uint8[]\"}],\"name\":\"ChallengeRegistered\",\"type\":\"event\"},{\"anonymous\":false,\"inputs\":[{\"indexed\":true,\"internalType\":\"bytes32\",\"name\":\"channelId\",\"type\":\"bytes32\"}],\"name\":\"Concluded\",\"type\":\"event\"},{\"inputs\":[{\"components\":[{\"internalType\":\"uint256\",\"name\":\"chainId\",\"type\":\"uint256\"},{\"internalType\":\"address[]\",\"name\":\"participants\",\"type\":\"address[]\"},{\"internalType\":\"uint48\",\"name\":\"channelNonce\",\"type\":\"uint48\"},{\"internalType\":\"address\",\"name\":\"appDefinition\",\"type\":\"address\"},{\"internalType\":\"uint48\",\"name\":\"challengeDuration\",\"type\":\"uint48\"}],\"internalType\":\"struct IForceMove.FixedPart\",\"name\":\"fixedPart\",\"type\":\"tuple\"},{\"internalType\":\"uint48\",\"name\":\"largestTurnNum\",\"type\":\"uint48\"},{\"components\":[{\"internalType\":\"bytes\",\"name\":\"outcome\",\"type\":\"bytes\"},{\"internalType\":\"bytes\",\"name\":\"appData\",\"type\":\"bytes\"}],\"internalType\":\"struct ForceMoveApp.VariablePart[]\",\"name\":\"variableParts\",\"type\":\"tuple[]\"},{\"internalType\":\"uint8\",\"name\":\"isFinalCount\",\"type\":\"uint8\"},{\"components\":[{\"internalType\":\"uint8\",\"name\":\"v\",\"type\":\"uint8\"},{\"internalType\":\"bytes32\",\"name\":\"r\",\"type\":\"bytes32\"},{\"internalType\":\"bytes32\",\"name\":\"s\",\"type\":\"bytes32\"}],\"internalType\":\"struct IForceMove.Signature[]\",\"name\":\"sigs\",\"type\":\"tuple[]\"},{\"internalType\":\"uint8[]\",\"name\":\"whoSignedWhat\",\"type\":\"uint8[]\"},{\"components\":[{\"internalType\":\"uint8\",\"name\":\"v\",\"type\":\"uint8\"},{\"internalType\":\"bytes32\",\"name\":\"r\",\"type\":\"bytes32\"},{\"internalType\":\"bytes32\",\"name\":\"s\",\"type\":\"bytes32\"}],\"internalType\":\"struct IForceMove.Signature\",\"name\":\"challengerSig\",\"type\":\"tuple\"}],\"name\":\"challenge\",\"outputs\":[],\"stateMutability\":\"nonpayable\",\"type\":\"function\"},{\"inputs\":[{\"internalType\":\"bytes32\",\"name\":\"\",\"type\":\"bytes32\"}],\"name\":\"channelStorageHashes\",\"outputs\":[{\"internalType\":\"bytes32\",\"name\":\"\",\"type\":\"bytes32\"}],\"stateMutability\":\"view\",\"type\":\"function\"},{\"inputs\":[{\"components\":[{\"internalType\":\"uint256\",\"name\":\"chainId\",\"type\":\"uint256\"},{\"internalType\":\"address[]\",\"name\":\"participants\",\"type\":\"address[]\"},{\"internalType\":\"uint48\",\"name\":\"channelNonce\",\"type\":\"uint48\"},{\"internalType\":\"address\",\"name\":\"appDefinition\",\"type\":\"address\"},{\"internalType\":\"uint48\",\"name\":\"challengeDuration\",\"type\":\"uint48\"}],\"internalType\":\"struct IForceMove.FixedPart\",\"name\":\"fixedPart\",\"type\":\"tuple\"},{\"internalType\":\"uint48\",\"name\":\"largestTurnNum\",\"type\":\"uint48\"},{\"components\":[{\"internalType\":\"bytes\",\"name\":\"outcome\",\"type\":\"bytes\"},{\"internalType\":\"bytes\",\"name\":\"appData\",\"type\":\"bytes\"}],\"internalType\":\"struct ForceMoveApp.VariablePart[]\",\"name\":\"variableParts\",\"type\":\"tuple[]\"},{\"internalType\":\"uint8\",\"name\":\"isFinalCount\",\"type\":\"uint8\"},{\"components\":[{\"internalType\":\"uint8\",\"name\":\"v\",\"type\":\"uint8\"},{\"internalType\":\"bytes32\",\"name\":\"r\",\"type\":\"bytes32\"},{\"internalType\":\"bytes32\",\"name\":\"s\",\"type\":\"bytes32\"}],\"internalType\":\"struct IForceMove.Signature[]\",\"name\":\"sigs\",\"type\":\"tuple[]\"},{\"internalType\":\"uint8[]\",\"name\":\"whoSignedWhat\",\"type\":\"uint8[]\"}],\"name\":\"checkpoint\",\"outputs\":[],\"stateMutability\":\"nonpayable\",\"type\":\"function\"},{\"inputs\":[{\"internalType\":\"uint48\",\"name\":\"largestTurnNum\",\"type\":\"uint48\"},{\"components\":[{\"internalType\":\"uint256\",\"name\":\"chainId\",\"type\":\"uint256\"},{\"internalType\":\"address[]\",\"name\":\"participants\",\"type\":\"address[]\"},{\"internalType\":\"uint48\",\"name\":\"channelNonce\",\"type\":\"uint48\"},{\"internalType\":\"address\",\"name\":\"appDefinition\",\"type\":\"address\"},{\"internalType\":\"uint48\",\"name\":\"challengeDuration\",\"type\":\"uint48\"}],\"internalType\":\"struct IForceMove.FixedPart\",\"name\":\"fixedPart\",\"type\":\"tuple\"},{\"internalType\":\"bytes32\",\"name\":\"appPartHash\",\"type\":\"bytes32\"},{\"internalType\":\"bytes32\",\"name\":\"outcomeHash\",\"type\":\"bytes32\"},{\"internalType\":\"uint8\",\"name\":\"numStates\",\"type\":\"uint8\"},{\"internalType\":\"uint8[]\",\"name\":\"whoSignedWhat\",\"type\":\"uint8[]\"},{\"components\":[{\"internalType\":\"uint8\",\"name\":\"v\",\"type\":\"uint8\"},{\"internalType\":\"bytes32\",\"name\":\"r\",\"type\":\"bytes32\"},{\"internalType\":\"bytes32\",\"name\":\"s\",\"type\":\"bytes32\"}],\"internalType\":\"struct IForceMove.Signature[]\",\"name\":\"sigs\",\"type\":\"tuple[]\"}],\"name\":\"conclude\",\"outputs\":[],\"stateMutability\":\"nonpayable\",\"type\":\"function\"},{\"inputs\":[{\"internalType\":\"uint48\",\"name\":\"largestTurnNum\",\"type\":\"uint48\"},{\"components\":[{\"internalType\":\"uint256\",\"name\":\"chainId\",\"type\":\"uint256\"},{\"internalType\":\"address[]\",\"name\":\"participants\",\"type\":\"address[]\"},{\"internalType\":\"uint48\",\"name\":\"channelNonce\",\"type\":\"uint48\"},{\"internalType\":\"address\",\"name\":\"appDefinition\",\"type\":\"address\"},{\"internalType\":\"uint48\",\"name\":\"challengeDuration\",\"type\":\"uint48\"}],\"internalType\":\"struct IForceMove.FixedPart\",\"name\":\"fixedPart\",\"type\":\"tuple\"},{\"internalType\":\"bytes32\",\"name\":\"appPartHash\",\"type\":\"bytes32\"},{\"internalType\":\"bytes\",\"name\":\"outcomeBytes\",\"type\":\"bytes\"},{\"internalType\":\"uint8\",\"name\":\"numStates\",\"type\":\"uint8\"},{\"internalType\":\"uint8[]\",\"name\":\"whoSignedWhat\",\"type\":\"uint8[]\"},{\"components\":[{\"internalType\":\"uint8\",\"name\":\"v\",\"type\":\"uint8\"},{\"internalType\":\"bytes32\",\"name\":\"r\",\"type\":\"bytes32\"},{\"internalType\":\"bytes32\",\"name\":\"s\",\"type\":\"bytes32\"}],\"internalType\":\"struct IForceMove.Signature[]\",\"name\":\"sigs\",\"type\":\"tuple[]\"}],\"name\":\"concludePushOutcomeAndTransferAll\",\"outputs\":[],\"stateMutability\":\"nonpayable\",\"type\":\"function\"},{\"inputs\":[{\"internalType\":\"bytes32\",\"name\":\"channelId\",\"type\":\"bytes32\"}],\"name\":\"getChannelStorage\",\"outputs\":[{\"internalType\":\"uint48\",\"name\":\"turnNumRecord\",\"type\":\"uint48\"},{\"internalType\":\"uint48\",\"name\":\"finalizesAt\",\"type\":\"uint48\"},{\"internalType\":\"uint160\",\"name\":\"fingerprint\",\"type\":\"uint160\"}],\"stateMutability\":\"view\",\"type\":\"function\"},{\"inputs\":[{\"internalType\":\"bytes32\",\"name\":\"channelId\",\"type\":\"bytes32\"},{\"internalType\":\"uint48\",\"name\":\"turnNumRecord\",\"type\":\"uint48\"},{\"internalType\":\"uint48\",\"name\":\"finalizesAt\",\"type\":\"uint48\"},{\"internalType\":\"bytes32\",\"name\":\"stateHash\",\"type\":\"bytes32\"},{\"internalType\":\"address\",\"name\":\"challengerAddress\",\"type\":\"address\"},{\"internalType\":\"bytes\",\"name\":\"outcomeBytes\",\"type\":\"bytes\"}],\"name\":\"pushOutcome\",\"outputs\":[],\"stateMutability\":\"nonpayable\",\"type\":\"function\"},{\"inputs\":[{\"internalType\":\"bytes32\",\"name\":\"channelId\",\"type\":\"bytes32\"},{\"internalType\":\"uint48\",\"name\":\"turnNumRecord\",\"type\":\"uint48\"},{\"internalType\":\"uint48\",\"name\":\"finalizesAt\",\"type\":\"uint48\"},{\"internalType\":\"bytes32\",\"name\":\"stateHash\",\"type\":\"bytes32\"},{\"internalType\":\"address\",\"name\":\"challengerAddress\",\"type\":\"address\"},{\"internalType\":\"bytes\",\"name\":\"outcomeBytes\",\"type\":\"bytes\"}],\"name\":\"pushOutcomeAndTransferAll\",\"outputs\":[],\"stateMutability\":\"nonpayable\",\"type\":\"function\"},{\"inputs\":[{\"internalType\":\"address\",\"name\":\"challenger\",\"type\":\"address\"},{\"internalType\":\"bool[2]\",\"name\":\"isFinalAB\",\"type\":\"bool[2]\"},{\"components\":[{\"internalType\":\"uint256\",\"name\":\"chainId\",\"type\":\"uint256\"},{\"internalType\":\"address[]\",\"name\":\"participants\",\"type\":\"address[]\"},{\"internalType\":\"uint48\",\"name\":\"channelNonce\",\"type\":\"uint48\"},{\"internalType\":\"address\",\"name\":\"appDefinition\",\"type\":\"address\"},{\"internalType\":\"uint48\",\"name\":\"challengeDuration\",\"type\":\"uint48\"}],\"internalType\":\"struct IForceMove.FixedPart\",\"name\":\"fixedPart\",\"type\":\"tuple\"},{\"components\":[{\"internalType\":\"bytes\",\"name\":\"outcome\",\"type\":\"bytes\"},{\"internalType\":\"bytes\",\"name\":\"appData\",\"type\":\"bytes\"}],\"internalType\":\"struct ForceMoveApp.VariablePart[2]\",\"name\":\"variablePartAB\",\"type\":\"tuple[2]\"},{\"components\":[{\"internalType\":\"uint8\",\"name\":\"v\",\"type\":\"uint8\"},{\"internalType\":\"bytes32\",\"name\":\"r\",\"type\":\"bytes32\"},{\"internalType\":\"bytes32\",\"name\":\"s\",\"type\":\"bytes32\"}],\"internalType\":\"struct IForceMove.Signature\",\"name\":\"sig\",\"type\":\"tuple\"}],\"name\":\"respond\",\"outputs\":[],\"stateMutability\":\"nonpayable\",\"type\":\"function\"},{\"inputs\":[{\"internalType\":\"uint256\",\"name\":\"nParticipants\",\"type\":\"uint256\"},{\"internalType\":\"bool[2]\",\"name\":\"isFinalAB\",\"type\":\"bool[2]\"},{\"components\":[{\"internalType\":\"bytes\",\"name\":\"outcome\",\"type\":\"bytes\"},{\"internalType\":\"bytes\",\"name\":\"appData\",\"type\":\"bytes\"}],\"internalType\":\"struct ForceMoveApp.VariablePart[2]\",\"name\":\"ab\",\"type\":\"tuple[2]\"},{\"internalType\":\"uint48\",\"name\":\"turnNumB\",\"type\":\"uint48\"},{\"internalType\":\"address\",\"name\":\"appDefinition\",\"type\":\"address\"}],\"name\":\"validTransition\",\"outputs\":[{\"internalType\":\"bool\",\"name\":\"\",\"type\":\"bool\"}],\"stateMutability\":\"pure\",\"type\":\"function\"}],\"devdoc\":{\"details\":\"The NitroAdjudicator contract extends ForceMove and hence inherits all ForceMove methods, and also extends and implements the Adjudicator interface, allowing for a finalized outcome to be pushed to an asset holder.\",\"kind\":\"dev\",\"methods\":{\"challenge((uint256,address[],uint48,address,uint48),uint48,(bytes,bytes)[],uint8,(uint8,bytes32,bytes32)[],uint8[],(uint8,bytes32,bytes32))\":{\"details\":\"Registers a challenge against a state channel. A challenge will either prompt another participant into clearing the challenge (via one of the other methods), or cause the channel to finalize at a specific time.\",\"params\":{\"challengerSig\":\"The signature of a participant on the keccak256 of the abi.encode of (supportedStateHash, 'forceMove').\",\"fixedPart\":\"Data describing properties of the state channel that do not change with state updates.\",\"isFinalCount\":\"Describes how many of the submitted states have the `isFinal` property set to `true`. It is implied that the rightmost `isFinalCount` states are final, and the rest are not final.\",\"largestTurnNum\":\"The largest turn number of the submitted states; will overwrite the stored value of `turnNumRecord`.\",\"sigs\":\"An array of signatures that support the state with the `largestTurnNum`. There must be one for each participant, e.g.: [sig-from-p0, sig-from-p1, ...]\",\"variableParts\":\"An ordered array of structs, each decribing the properties of the state channel that may change with each state update. Length is from 1 to the number of participants (inclusive).\",\"whoSignedWhat\":\"An array denoting which participant has signed which state: `participant[i]` signed the state with index `whoSignedWhat[i]`.\"}},\"checkpoint((uint256,address[],uint48,address,uint48),uint48,(bytes,bytes)[],uint8,(uint8,bytes32,bytes32)[],uint8[])\":{\"details\":\"Overwrites the `turnNumRecord` stored against a channel by providing a state with higher turn number, supported by a signature from each participant.\",\"params\":{\"fixedPart\":\"Data describing properties of the state channel that do not change with state updates.\",\"isFinalCount\":\"Describes how many of the submitted states have the `isFinal` property set to `true`. It is implied that the rightmost `isFinalCount` states are final, and the rest are not final.\",\"largestTurnNum\":\"The largest turn number of the submitted states; will overwrite the stored value of `turnNumRecord`.\",\"sigs\":\"An array of signatures that support the state with the `largestTurnNum`.\",\"variableParts\":\"An ordered array of structs, each decribing the properties of the state channel that may change with each state update.\",\"whoSignedWhat\":\"An array denoting which participant has signed which state: `participant[i]` signed the state with index `whoSignedWhat[i]`.\"}},\"conclude(uint48,(uint256,address[],uint48,address,uint48),bytes32,bytes32,uint8,uint8[],(uint8,bytes32,bytes32)[])\":{\"details\":\"Finalizes a channel by providing a finalization proof.\",\"params\":{\"appPartHash\":\"The keccak256 of the abi.encode of `(challengeDuration, appDefinition, appData)`. Applies to all states in the finalization proof.\",\"fixedPart\":\"Data describing properties of the state channel that do not change with state updates.\",\"largestTurnNum\":\"The largest turn number of the submitted states; will overwrite the stored value of `turnNumRecord`.\",\"numStates\":\"The number of states in the finalization proof.\",\"outcomeHash\":\"The keccak256 of the abi.encode of the `outcome`. Applies to all stats in the finalization proof.\",\"sigs\":\"An array of signatures that support the state with the `largestTurnNum`.\",\"whoSignedWhat\":\"An array denoting which participant has signed which state: `participant[i]` signed the state with index `whoSignedWhat[i]`.\"}},\"concludePushOutcomeAndTransferAll(uint48,(uint256,address[],uint48,address,uint48),bytes32,bytes,uint8,uint8[],(uint8,bytes32,bytes32)[])\":{\"details\":\"Finalizes a channel by providing a finalization proof, allows a finalized channel's outcome to be decoded and transferAll to be triggered in external Asset Holder contracts.\",\"params\":{\"appPartHash\":\"The keccak256 of the abi.encode of `(challengeDuration, appDefinition, appData)`. Applies to all states in the finalization proof.\",\"fixedPart\":\"Data describing properties of the state channel that do not change with state updates.\",\"largestTurnNum\":\"The largest turn number of the submitted states; will overwrite the stored value of `turnNumRecord`.\",\"numStates\":\"The number of states in the finalization proof.\",\"outcomeBytes\":\"abi.encode of an array of Outcome.OutcomeItem structs.\",\"sigs\":\"An array of signatures that support the state with the `largestTurnNum`.\",\"whoSignedWhat\":\"An array denoting which participant has signed which state: `participant[i]` signed the state with index `whoSignedWhat[i]`.\"}},\"getChannelStorage(bytes32)\":{\"details\":\"Unpacks turnNumRecord, finalizesAt and fingerprint from the channelStorageHash of a particular channel.\",\"params\":{\"channelId\":\"Unique identifier for a state channel.\"},\"returns\":{\"finalizesAt\":\"The unix timestamp when `channelId` will finalize.\",\"fingerprint\":\"Unique identifier for the channel's current state, up to hash collisions.\",\"turnNumRecord\":\"A turnNum that (the adjudicator knows) is supported by a signature from each participant.\"}},\"pushOutcome(bytes32,uint48,uint48,bytes32,address,bytes)\":{\"details\":\"Allows a finalized channel's outcome to be decoded and one or more AssetOutcomes registered in external Asset Holder contracts.\",\"params\":{\"challengerAddress\":\"The address of the participant whom registered the challenge, if any.\",\"channelId\":\"Unique identifier for a state channel\",\"finalizesAt\":\"The unix timestamp when this channel will finalize\",\"outcomeBytes\":\"The encoded Outcome of this state channel.\",\"stateHash\":\"The keccak256 of the abi.encode of the State (struct) stored by the adjudicator\",\"turnNumRecord\":\"A turnNum that (the adjudicator knows and stores) is supported by a signature from each participant.\"}},\"pushOutcomeAndTransferAll(bytes32,uint48,uint48,bytes32,address,bytes)\":{\"details\":\"Allows a finalized channel's outcome to be decoded and one or more AssetOutcomes registered in external Asset Holder contracts.\",\"params\":{\"challengerAddress\":\"The address of the participant whom registered the challenge, if any.\",\"channelId\":\"Unique identifier for a state channel\",\"finalizesAt\":\"The unix timestamp when this channel will finalize\",\"outcomeBytes\":\"The encoded Outcome of this state channel.\",\"stateHash\":\"The keccak256 of the abi.encode of the State (struct) stored by the adjudicator\",\"turnNumRecord\":\"A turnNum that (the adjudicator knows and stores) is supported by a signature from each participant.\"}},\"respond(address,bool[2],(uint256,address[],uint48,address,uint48),(bytes,bytes)[2],(uint8,bytes32,bytes32))\":{\"details\":\"Repsonds to an ongoing challenge registered against a state channel.\",\"params\":{\"challenger\":\"The address of the participant whom registered the challenge.\",\"fixedPart\":\"Data describing properties of the state channel that do not change with state updates.\",\"isFinalAB\":\"An pair of booleans describing if the challenge state and/or the response state have the `isFinal` property set to `true`.\",\"sig\":\"The responder's signature on the `responseStateHash`.\",\"variablePartAB\":\"An pair of structs, each decribing the properties of the state channel that may change with each state update (for the challenge state and for the response state).\"}},\"validTransition(uint256,bool[2],(bytes,bytes)[2],uint48,address)\":{\"details\":\"Check that the submitted pair of states form a valid transition (public wrapper for internal function _requireValidTransition)\",\"params\":{\"ab\":\"Variable parts of each of the pair of states\",\"appDefinition\":\"Address of deployed contract containing application-specific validTransition function.\",\"isFinalAB\":\"Pair of booleans denoting whether the first and second state (resp.) are final.\",\"nParticipants\":\"Number of participants in the channel. transition\",\"turnNumB\":\"turnNum of the later state of the pair.\"},\"returns\":{\"_0\":\"true if the later state is a validTransition from its predecessor, reverts otherwise.\"}}},\"version\":1},\"userdoc\":{\"kind\":\"user\",\"methods\":{\"challenge((uint256,address[],uint48,address,uint48),uint48,(bytes,bytes)[],uint8,(uint8,bytes32,bytes32)[],uint8[],(uint8,bytes32,bytes32))\":{\"notice\":\"Registers a challenge against a state channel. A challenge will either prompt another participant into clearing the challenge (via one of the other methods), or cause the channel to finalize at a specific time.\"},\"checkpoint((uint256,address[],uint48,address,uint48),uint48,(bytes,bytes)[],uint8,(uint8,bytes32,bytes32)[],uint8[])\":{\"notice\":\"Overwrites the `turnNumRecord` stored against a channel by providing a state with higher turn number, supported by a signature from each participant.\"},\"conclude(uint48,(uint256,address[],uint48,address,uint48),bytes32,bytes32,uint8,uint8[],(uint8,bytes32,bytes32)[])\":{\"notice\":\"Finalizes a channel by providing a finalization proof.\"},\"concludePushOutcomeAndTransferAll(uint48,(uint256,address[],uint48,address,uint48),bytes32,bytes,uint8,uint8[],(uint8,bytes32,bytes32)[])\":{\"notice\":\"Finalizes a channel by providing a finalization proof, allows a finalized channel's outcome to be decoded and transferAll to be triggered in external Asset Holder contracts.\"},\"getChannelStorage(bytes32)\":{\"notice\":\"Unpacks turnNumRecord, finalizesAt and fingerprint from the channelStorageHash of a particular channel.\"},\"pushOutcome(bytes32,uint48,uint48,bytes32,address,bytes)\":{\"notice\":\"Allows a finalized channel's outcome to be decoded and one or more AssetOutcomes registered in external Asset Holder contracts.\"},\"pushOutcomeAndTransferAll(bytes32,uint48,uint48,bytes32,address,bytes)\":{\"notice\":\"Allows a finalized channel's outcome to be decoded and transferAll to be triggered in external Asset Holder contracts.\"},\"respond(address,bool[2],(uint256,address[],uint48,address,uint48),(bytes,bytes)[2],(uint8,bytes32,bytes32))\":{\"notice\":\"Repsonds to an ongoing challenge registered against a state channel.\"},\"validTransition(uint256,bool[2],(bytes,bytes)[2],uint48,address)\":{\"notice\":\"Check that the submitted pair of states form a valid transition (public wrapper for internal function _requireValidTransition)\"}},\"version\":1}},\"settings\":{\"compilationTarget\":{\"contracts/NitroAdjudicator.sol\":\"NitroAdjudicator\"},\"evmVersion\":\"istanbul\",\"libraries\":{},\"metadata\":{\"bytecodeHash\":\"ipfs\",\"useLiteralContent\":true},\"optimizer\":{\"enabled\":false,\"runs\":200},\"remappings\":[]},\"sources\":{\"@openzeppelin/contracts/math/SafeMath.sol\":{\"content\":\"pragma solidity ^0.6.0;\\n\\n/**\\n * @dev Wrappers over Solidity's arithmetic operations with added overflow\\n * checks.\\n *\\n * Arithmetic operations in Solidity wrap on overflow. This can easily result\\n * in bugs, because programmers usually assume that an overflow raises an\\n * error, which is the standard behavior in high level programming languages.\\n * `SafeMath` restores this intuition by reverting the transaction when an\\n * operation overflows.\\n *\\n * Using this library instead of the unchecked operations eliminates an entire\\n * class of bugs, so it's recommended to use it always.\\n */\\nlibrary SafeMath {\\n    /**\\n     * @dev Returns the addition of two unsigned integers, reverting on\\n     * overflow.\\n     *\\n     * Counterpart to Solidity's `+` operator.\\n     *\\n     * Requirements:\\n     * - Addition cannot overflow.\\n     */\\n    function add(uint256 a, uint256 b) internal pure returns (uint256) {\\n        uint256 c = a + b;\\n        require(c >= a, \\\"SafeMath: addition overflow\\\");\\n\\n        return c;\\n    }\\n\\n    /**\\n     * @dev Returns the subtraction of two unsigned integers, reverting on\\n     * overflow (when the result is negative).\\n     *\\n     * Counterpart to Solidity's `-` operator.\\n     *\\n     * Requirements:\\n     * - Subtraction cannot overflow.\\n     */\\n    function sub(uint256 a, uint256 b) internal pure returns (uint256) {\\n        return sub(a, b, \\\"SafeMath: subtraction overflow\\\");\\n    }\\n\\n    /**\\n     * @dev Returns the subtraction of two unsigned integers, reverting with custom message on\\n     * overflow (when the result is negative).\\n     *\\n     * Counterpart to Solidity's `-` operator.\\n     *\\n     * Requirements:\\n     * - Subtraction cannot overflow.\\n     */\\n    function sub(uint256 a, uint256 b, string memory errorMessage) internal pure returns (uint256) {\\n        require(b <= a, errorMessage);\\n        uint256 c = a - b;\\n\\n        return c;\\n    }\\n\\n    /**\\n     * @dev Returns the multiplication of two unsigned integers, reverting on\\n     * overflow.\\n     *\\n     * Counterpart to Solidity's `*` operator.\\n     *\\n     * Requirements:\\n     * - Multiplication cannot overflow.\\n     */\\n    function mul(uint256 a, uint256 b) internal pure returns (uint256) {\\n        // Gas optimization: this is cheaper than requiring 'a' not being zero, but the\\n        // benefit is lost if 'b' is also tested.\\n        // See: https://github.com/OpenZeppelin/openzeppelin-contracts/pull/522\\n        if (a == 0) {\\n            return 0;\\n        }\\n\\n        uint256 c = a * b;\\n        require(c / a == b, \\\"SafeMath: multiplication overflow\\\");\\n\\n        return c;\\n    }\\n\\n    /**\\n     * @dev Returns the integer division of two unsigned integers. Reverts on\\n     * division by zero. The result is rounded towards zero.\\n     *\\n     * Counterpart to Solidity's `/` operator. Note: this function uses a\\n     * `revert` opcode (which leaves remaining gas untouched) while Solidity\\n     * uses an invalid opcode to revert (consuming all remaining gas).\\n     *\\n     * Requirements:\\n     * - The divisor cannot be zero.\\n     */\\n    function div(uint256 a, uint256 b) internal pure returns (uint256) {\\n        return div(a, b, \\\"SafeMath: division by zero\\\");\\n    }\\n\\n    /**\\n     * @dev Returns the integer division of two unsigned integers. Reverts with custom message on\\n     * division by zero. The result is rounded towards zero.\\n     *\\n     * Counterpart to Solidity's `/` operator. Note: this function uses a\\n     * `revert` opcode (which leaves remaining gas untouched) while Solidity\\n     * uses an invalid opcode to revert (consuming all remaining gas).\\n     *\\n     * Requirements:\\n     * - The divisor cannot be zero.\\n     */\\n    function div(uint256 a, uint256 b, string memory errorMessage) internal pure returns (uint256) {\\n        // Solidity only automatically asserts when dividing by 0\\n        require(b > 0, errorMessage);\\n        uint256 c = a / b;\\n        // assert(a == b * c + a % b); // There is no case in which this doesn't hold\\n\\n        return c;\\n    }\\n\\n    /**\\n     * @dev Returns the remainder of dividing two unsigned integers. (unsigned integer modulo),\\n     * Reverts when dividing by zero.\\n     *\\n     * Counterpart to Solidity's `%` operator. This function uses a `revert`\\n     * opcode (which leaves remaining gas untouched) while Solidity uses an\\n     * invalid opcode to revert (consuming all remaining gas).\\n     *\\n     * Requirements:\\n     * - The divisor cannot be zero.\\n     */\\n    function mod(uint256 a, uint256 b) internal pure returns (uint256) {\\n        return mod(a, b, \\\"SafeMath: modulo by zero\\\");\\n    }\\n\\n    /**\\n     * @dev Returns the remainder of dividing two unsigned integers. (unsigned integer modulo),\\n     * Reverts with custom message when dividing by zero.\\n     *\\n     * Counterpart to Solidity's `%` operator. This function uses a `revert`\\n     * opcode (which leaves remaining gas untouched) while Solidity uses an\\n     * invalid opcode to revert (consuming all remaining gas).\\n     *\\n     * Requirements:\\n     * - The divisor cannot be zero.\\n     */\\n    function mod(uint256 a, uint256 b, string memory errorMessage) internal pure returns (uint256) {\\n        require(b != 0, errorMessage);\\n        return a % b;\\n    }\\n}\\n\",\"keccak256\":\"0x04d34b3cd5677bea25f8dfceb6dec0eaa071d4d4b789a43f13fe0c415ba4c296\"},\"contracts/AssetHolder.sol\":{\"content\":\"// SPDX-License-Identifier: MIT\\npragma solidity 0.6.12;\\npragma experimental ABIEncoderV2;\\nimport './Outcome.sol';\\nimport '@openzeppelin/contracts/math/SafeMath.sol';\\nimport './interfaces/IAssetHolder.sol';\\n\\n/**\\n * @dev An implementation of the IAssetHolder interface. The AssetHolder contract escrows ETH or tokens against state channels. It allows assets to be internally accounted for, and ultimately prepared for transfer from one channel to other channel and/or external destinations, as well as for guarantees to be claimed. Note there is no deposit function and the _transferAsset function is unimplemented; inheriting contracts should implement these functions in a manner appropriate to the asset type (e.g. ETH or ERC20 tokens).\\n */\\ncontract AssetHolder is IAssetHolder {\\n    using SafeMath for uint256;\\n\\n    address public AdjudicatorAddress;\\n\\n    mapping(bytes32 => uint256) public holdings;\\n\\n    mapping(bytes32 => bytes32) public assetOutcomeHashes;\\n\\n    /**\\n     * @notice Transfers as many funds escrowed against `channelId` as can be afforded for a specific destination. Assumes no repeated entries. Performs no checks.\\n     * @dev Transfers as many funds escrowed against `channelId` as can be afforded for a specific destination. Assumes no repeated entries. Performs no checks.\\n     * @param fromChannelId Unique identifier for state channel to transfer funds *from*.\\n     * @param allocationBytes The abi.encode of AssetOutcome.Allocation\\n     * @param destination External destination or channel to transfer funds *to*.\\n     */\\n    function _transfer(bytes32 fromChannelId, bytes memory allocationBytes, bytes32 destination) internal {\\n        Outcome.AllocationItem[] memory allocation = abi.decode(\\n            allocationBytes,\\n            (Outcome.AllocationItem[])\\n        );\\n        uint256 balance = holdings[fromChannelId];\\n        uint256 affordsForDestination;\\n        uint256 residualAllocationAmount;\\n        uint256 _amount;\\n        uint256 i;\\n        bool deleteHash = false;\\n\\n        // loop over allocations and decrease balance until we hit the specified destination\\n        for (i = 0; i < allocation.length; i++) {\\n            if (balance == 0) {\\n                revert('_transfer | fromChannel affords 0 for destination');\\n            }\\n            _amount = allocation[i].amount;\\n            if (allocation[i].destination == destination) {\\n                 if (balance < _amount) {\\n                    affordsForDestination = balance;\\n                    residualAllocationAmount = _amount - balance;\\n                    balance = 0;\\n                } else {\\n                    affordsForDestination = _amount;\\n                    residualAllocationAmount = 0;\\n                    balance = balance.sub(_amount);\\n                }\\n            break; // means that i holds the index of the destination that may need to be altered or removed\\n            }\\n            if (balance < _amount) {\\n                balance = 0;\\n            } else {\\n                balance = balance.sub(_amount);\\n            }\\n        }\\n\\n        // effects\\n        holdings[fromChannelId] -= affordsForDestination;\\n\\n        // construct new outcome\\n\\n        bytes memory encodedAllocation; \\n\\n        if (residualAllocationAmount > 0) {\\n            // new allocation identical save for a single entry \\n            Outcome.AllocationItem[] memory newAllocation = new Outcome.AllocationItem[](\\n                allocation.length\\n            );\\n            for (uint256 k = 0; k < allocation.length; k++) {\\n                newAllocation[k] = allocation[k];\\n                if (allocation[k].destination == destination) {\\n                    newAllocation[k].amount = residualAllocationAmount;\\n                }\\n            }\\n            encodedAllocation = abi.encode(newAllocation);\\n        }\\n\\n        if (residualAllocationAmount == 0) {\\n            Outcome.AllocationItem[] memory splicedAllocation = new Outcome.AllocationItem[](\\n                allocation.length - 1\\n            );\\n            // full payout so we want to splice a shorter outcome\\n            for (uint256 k = 0; k < i; k++) {\\n                splicedAllocation[k] = allocation[k];\\n            }\\n            for (uint256 k = i + 1; k < allocation.length; k++) {\\n                splicedAllocation[k - 1] = allocation[k];\\n            }\\n            if (splicedAllocation.length == 0) {\\n                deleteHash = true;\\n            }\\n            encodedAllocation = abi.encode(splicedAllocation);\\n        }\\n\\n        // replace or delete hash\\n        if (deleteHash) {\\n            delete assetOutcomeHashes[fromChannelId];\\n        } else {\\n            assetOutcomeHashes[fromChannelId] = keccak256(\\n                abi.encode(\\n                    Outcome.AssetOutcome(\\n                        uint8(Outcome.AssetOutcomeType.Allocation),\\n                        encodedAllocation\\n                    )\\n                )\\n            );\\n        } \\n\\n        // storage updated BEFORE asset transferred (prevent reentrancy)\\n\\n        if (_isExternalDestination(destination)) {\\n            _transferAsset(_bytes32ToAddress(destination), affordsForDestination);\\n            emit AssetTransferred(fromChannelId, destination, affordsForDestination);\\n        } else {\\n            holdings[destination] += affordsForDestination;\\n        }\\n        \\n    }\\n\\n    /**\\n     * @notice Transfers the funds escrowed against `channelId` to the beneficiaries of that channel. No checks performed.\\n     * @dev Transfers the funds escrowed against `channelId` and transfers them to the beneficiaries of that channel. No checks performed.\\n     * @param channelId Unique identifier for a state channel.\\n     * @param allocationBytes The abi.encode of AssetOutcome.Allocation\\n     */\\n    function _transferAll(bytes32 channelId, bytes memory allocationBytes) internal {\\n        Outcome.AllocationItem[] memory allocation = abi.decode(\\n            allocationBytes,\\n            (Outcome.AllocationItem[])\\n        );\\n        uint256 balance = holdings[channelId];\\n        uint256 numPayouts = 0;\\n        uint256 numNewAllocationItems = allocation.length;\\n        uint256 _amount;\\n        bool overlap;\\n        uint256 finalPayoutAmount;\\n        uint256 firstNewAllocationItemAmount;\\n\\n        for (uint256 i = 0; i < allocation.length; i++) {\\n            if (balance == 0) {\\n                // if funds are completely depleted, keep the allocationItem and do not pay out\\n            } else {\\n                _amount = allocation[i].amount;\\n                if (balance < _amount) {\\n                    // if funds still exist but are insufficient for this allocationItem, payout what's available and keep the allocationItem (but reduce the amount allocated)\\n                    // this block is never executed more than once\\n                    numPayouts++;\\n                    overlap = true;\\n                    finalPayoutAmount = balance;\\n                    firstNewAllocationItemAmount = _amount.sub(balance);\\n                    balance = 0;\\n                } else {\\n                    // if ample funds still exist, pay them out and discard the allocationItem\\n                    numPayouts++;\\n                    numNewAllocationItems = numNewAllocationItems.sub(1);\\n                    balance = balance.sub(_amount);\\n                }\\n            }\\n        }\\n\\n        // effects\\n        holdings[channelId] = balance;\\n\\n        if (numNewAllocationItems > 0) {\\n            // construct newAllocation\\n            Outcome.AllocationItem[] memory newAllocation = new Outcome.AllocationItem[](\\n                numNewAllocationItems\\n            );\\n            for (uint256 k = 0; k < numNewAllocationItems; k++) {\\n                newAllocation[k] = allocation[allocation.length.sub(numNewAllocationItems).add(k)];\\n                if (overlap && k == 0) {\\n                    newAllocation[k].amount = firstNewAllocationItemAmount;\\n                }\\n            }\\n\\n            // store hash\\n            assetOutcomeHashes[channelId] = keccak256(\\n                abi.encode(\\n                    Outcome.AssetOutcome(\\n                        uint8(Outcome.AssetOutcomeType.Allocation),\\n                        abi.encode(newAllocation)\\n                    )\\n                )\\n            );\\n        } else {\\n            delete assetOutcomeHashes[channelId];\\n        }\\n        // holdings updated BEFORE asset transferred (prevent reentrancy)\\n        uint256 payoutAmount;\\n        for (uint256 m = 0; m < numPayouts; m++) {\\n            if (overlap && m == numPayouts.sub(1)) {\\n                payoutAmount = finalPayoutAmount;\\n            } else {\\n                payoutAmount = allocation[m].amount;\\n            }\\n            if (_isExternalDestination(allocation[m].destination)) {\\n                _transferAsset(_bytes32ToAddress(allocation[m].destination), payoutAmount);\\n                emit AssetTransferred(channelId, allocation[m].destination, payoutAmount);\\n            } else {\\n                holdings[allocation[m].destination] += payoutAmount;\\n            }\\n        }\\n    }\\n\\n\\n\\n    // **************\\n    // Public methods\\n    // **************\\n\\n    /**\\n     * @notice Transfers as many funds escrowed against `channelId` as can be afforded for a specific destination. Assumes no repeated entries.\\n     * @dev Transfers as many funds escrowed against `channelId` as can be afforded for a specific destination. Assumes no repeated entries.\\n     * @param fromChannelId Unique identifier for state channel to transfer funds *from*.\\n     * @param allocationBytes The abi.encode of AssetOutcome.Allocation\\n     * @param destination External destination or channel to transfer funds *to*.\\n     */\\n    function transfer(bytes32 fromChannelId, bytes memory allocationBytes, bytes32 destination) public {\\n        // checks\\n        require(\\n            assetOutcomeHashes[fromChannelId] ==\\n                keccak256(\\n                    abi.encode(\\n                        Outcome.AssetOutcome(\\n                            uint8(Outcome.AssetOutcomeType.Allocation),\\n                            allocationBytes\\n                        )\\n                    )\\n                ),\\n            'transfer | submitted data does not match stored assetOutcomeHash'\\n        );\\n        _transfer(fromChannelId, allocationBytes, destination);\\n    }\\n\\n    /**\\n     * @notice Transfers the funds escrowed against `channelId` to the beneficiaries of that channel. Checks against the storage in this contract.\\n     * @dev Transfers the funds escrowed against `channelId` and transfers them to the beneficiaries of that channel. Checks against the storage in this contract.\\n     * @param channelId Unique identifier for a state channel.\\n     * @param allocationBytes The abi.encode of AssetOutcome.Allocation\\n     */\\n    function transferAll(bytes32 channelId, bytes memory allocationBytes) public override {\\n        // checks\\n        require(\\n            assetOutcomeHashes[channelId] ==\\n                keccak256(\\n                    abi.encode(\\n                        Outcome.AssetOutcome(\\n                            uint8(Outcome.AssetOutcomeType.Allocation),\\n                            allocationBytes\\n                        )\\n                    )\\n                ),\\n            'transferAll | submitted data does not match stored assetOutcomeHash'\\n        );\\n        _transferAll(channelId, allocationBytes);\\n    }\\n\\n    /**\\n     * @notice Transfers the funds escrowed against `channelId` to the beneficiaries of that channel. No checks performed against storage in this contract. Permissioned.\\n     * @dev Transfers the funds escrowed against `channelId` and transfers them to the beneficiaries of that channel. No checks performed against storage in this contract. Permissioned.\\n     * @param channelId Unique identifier for a state channel.\\n     * @param allocationBytes The abi.encode of AssetOutcome.Allocation\\n     */\\n    function transferAllAdjudicatorOnly(bytes32 channelId, bytes calldata allocationBytes)\\n        external\\n        virtual\\n        AdjudicatorOnly\\n    {\\n        _transferAll(channelId, allocationBytes);\\n    }\\n\\n    /**\\n     * @notice Transfers the funds escrowed against `guarantorChannelId` to the beneficiaries of the __target__ of that channel.\\n     * @dev Transfers the funds escrowed against `guarantorChannelId` to the beneficiaries of the __target__ of that channel.\\n     * @param guarantorChannelId Unique identifier for a guarantor state channel.\\n     * @param guaranteeBytes The abi.encode of Outcome.Guarantee\\n     * @param allocationBytes The abi.encode of AssetOutcome.Allocation for the __target__\\n     */\\n    function claimAll(\\n        bytes32 guarantorChannelId,\\n        bytes memory guaranteeBytes,\\n        bytes memory allocationBytes\\n    ) public override {\\n        \\n        // CHECKS\\n        require(\\n            assetOutcomeHashes[guarantorChannelId] ==\\n                keccak256(\\n                    abi.encode(\\n                        Outcome.AssetOutcome(\\n                            uint8(Outcome.AssetOutcomeType.Guarantee),\\n                            guaranteeBytes\\n                        )\\n                    )\\n                ),\\n            'claimAll | submitted data does not match assetOutcomeHash stored against guarantorChannelId'\\n        );\\n\\n        Outcome.Guarantee memory guarantee = abi.decode(guaranteeBytes, (Outcome.Guarantee));\\n\\n        require(\\n            assetOutcomeHashes[guarantee.targetChannelId] ==\\n                keccak256(\\n                    abi.encode(\\n                        Outcome.AssetOutcome(\\n                            uint8(Outcome.AssetOutcomeType.Allocation),\\n                            allocationBytes\\n                        )\\n                    )\\n                ),\\n            'claimAll | submitted data does not match assetOutcomeHash stored against targetChannelId'\\n        );\\n\\n        uint256 balance = holdings[guarantorChannelId];\\n\\n        Outcome.AllocationItem[] memory allocation = abi.decode(\\n            allocationBytes,\\n            (Outcome.AllocationItem[])\\n        ); // this remains constant length\\n\\n        uint256[] memory payouts = new uint256[](allocation.length);\\n        uint256 newAllocationLength = allocation.length;\\n\\n        // first increase payouts according to guarantee\\n        for (uint256 i = 0; i < guarantee.destinations.length; i++) {\\n            // for each destination in the guarantee\\n            bytes32 _destination = guarantee.destinations[i];\\n            for (uint256 j = 0; j < allocation.length; j++) {\\n                if (balance == 0) {\\n                    break;\\n                }\\n                if (_destination == allocation[j].destination) {\\n                    // find amount allocated to that destination (if it exists in channel alllocation)\\n                    uint256 _amount = allocation[j].amount;\\n                    if (_amount > 0) {\\n                        if (balance >= _amount) {\\n                            balance = balance.sub(_amount);\\n                            allocation[j].amount = 0; // subtract _amount;\\n                            newAllocationLength = newAllocationLength.sub(1);\\n                            payouts[j] += _amount;\\n                            break;\\n                        } else {\\n                            allocation[j].amount = _amount.sub(balance);\\n                            payouts[j] += balance;\\n                            balance = 0;\\n                            break;\\n                        }\\n                    }\\n                }\\n            }\\n        }\\n\\n        // next, increase payouts according to original allocation order\\n        // this block only has an effect if balance > 0\\n        for (uint256 j = 0; j < allocation.length; j++) {\\n            // for each entry in the target channel's outcome\\n            if (balance == 0) {\\n                break;\\n            }\\n            uint256 _amount = allocation[j].amount;\\n            if (_amount > 0) {\\n                if (balance >= _amount) {\\n                    balance = balance.sub(_amount);\\n                    allocation[j].amount = 0; // subtract _amount;\\n                    newAllocationLength = newAllocationLength.sub(1);\\n                    payouts[j]+= _amount;\\n                } else {\\n                    allocation[j].amount = _amount.sub(balance);\\n                    payouts[j]+= balance;\\n                    balance = 0;\\n                }\\n            }\\n        }\\n\\n        // EFFECTS\\n        holdings[guarantorChannelId] = balance;\\n       \\n\\n        // at this point have payouts array of uint256s, each corresponding to original destinations\\n        // and allocations has some zero amounts which we want to prune\\n        Outcome.AllocationItem[] memory newAllocation;\\n        if (newAllocationLength > 0) {\\n            newAllocation = new Outcome.AllocationItem[](newAllocationLength);\\n        }\\n\\n        uint256 k = 0;\\n        for (uint256 j = 0; j < allocation.length; j++) {\\n            // for each destination in the target channel's allocation\\n            if (allocation[j].amount > 0) {\\n                newAllocation[k] = allocation[j];\\n                k++;\\n            }\\n        }\\n        assert(k == newAllocationLength);\\n\\n        if (newAllocationLength > 0) {\\n            // store hash\\n            assetOutcomeHashes[guarantee.targetChannelId] = keccak256(\\n                abi.encode(\\n                    Outcome.AssetOutcome(\\n                        uint8(Outcome.AssetOutcomeType.Allocation),\\n                        abi.encode(newAllocation)\\n                    )\\n                )\\n            );\\n        } else {\\n            delete assetOutcomeHashes[guarantorChannelId];\\n            delete assetOutcomeHashes[guarantee.targetChannelId];\\n        }\\n\\n        // INTERACTIONS\\n        for (uint256 j = 0; j < allocation.length; j++) {\\n            // for each destination in the target channel's allocation\\n            if (payouts[j] > 0) {\\n                if (_isExternalDestination(allocation[j].destination)) {\\n                    _transferAsset(_bytes32ToAddress(allocation[j].destination), payouts[j]);\\n                    emit AssetTransferred(\\n                        guarantorChannelId,\\n                        allocation[j].destination,\\n                        payouts[j]\\n                    );\\n                } else {\\n                    holdings[allocation[j].destination] += payouts[j];\\n                }\\n            }\\n        }\\n    }\\n\\n    // **************\\n    // Permissioned methods\\n    // **************\\n\\n    modifier AdjudicatorOnly {\\n        require(msg.sender == AdjudicatorAddress, 'Only the NitroAdjudicator is authorized');\\n        _;\\n    }\\n\\n    /**\\n     * @notice Sets the given assetOutcomeHash for the given channelId in the assetOutcomeHashes storage mapping\\n     * @dev Sets the given assetOutcomeHash for the given channelId in the assetOutcomeHashes storage mapping\\n     * @param channelId Unique identifier for a state channel.\\n     * @param assetOutcomeHash The keccak256 of the abi.encode of the Outcome.\\n     */\\n    function _setAssetOutcomeHash(bytes32 channelId, bytes32 assetOutcomeHash) internal {\\n        require(assetOutcomeHashes[channelId] == bytes32(0), 'Outcome hash already exists');\\n        assetOutcomeHashes[channelId] = assetOutcomeHash;\\n    }\\n\\n    /**\\n     * @notice Sets the given assetOutcomeHash for the given channelId in the assetOutcomeHashes storage mapping.\\n     * @dev Sets the given assetOutcomeHash for the given channelId in the assetOutcomeHashes storage mapping.\\n     * @param channelId Unique identifier for a state channel.\\n     * @param assetOutcomeHash The keccak256 of the abi.encode of the Outcome.\\n     */\\n    function setAssetOutcomeHash(bytes32 channelId, bytes32 assetOutcomeHash)\\n        external\\n        AdjudicatorOnly\\n        returns (bool success)\\n    {\\n        _setAssetOutcomeHash(channelId, assetOutcomeHash);\\n        return true;\\n    }\\n\\n    // **************\\n    // Internal methods\\n    // **************\\n\\n    /**\\n     * @notice Transfers the given amount of this AssetHolders's asset type to a supplied ethereum address.\\n     * @dev Transfers the given amount of this AssetHolders's asset type to a supplied ethereum address.\\n     * @param destination ethereum address to be credited.\\n     * @param amount Quantity of assets to be transferred.\\n     */\\n    function _transferAsset(address payable destination, uint256 amount) internal virtual {}\\n\\n    /**\\n     * @notice Checks if a given destination is external (and can therefore have assets transferred to it) or not.\\n     * @dev Checks if a given destination is external (and can therefore have assets transferred to it) or not.\\n     * @param destination Destination to be checked.\\n     * @return True if the destination is external, false otherwise.\\n     */\\n    function _isExternalDestination(bytes32 destination) internal pure returns (bool) {\\n        return uint96(bytes12(destination)) == 0;\\n    }\\n\\n    /**\\n     * @notice Converts an ethereum address to a nitro external destination.\\n     * @dev Converts an ethereum address to a nitro external destination.\\n     * @param participant The address to be converted.\\n     * @return The input address left-padded with zeros.\\n     */\\n    function _addressToBytes32(address participant) internal pure returns (bytes32) {\\n        return bytes32(uint256(participant));\\n    }\\n\\n    /**\\n     * @notice Converts a nitro destination to an ethereum address.\\n     * @dev Converts a nitro destination to an ethereum address.\\n     * @param destination The destination to be converted.\\n     * @return The rightmost 160 bits of the input string.\\n     */\\n    function _bytes32ToAddress(bytes32 destination) internal pure returns (address payable) {\\n        return address(uint160(uint256(destination)));\\n    }\\n}\\n\",\"keccak256\":\"0xe2dacce923099bf3767c5cc6639b74024d34caea54e056d7114a2bee8361c53c\",\"license\":\"MIT\"},\"contracts/ForceMove.sol\":{\"content\":\"// SPDX-License-Identifier: MIT\\npragma solidity 0.6.12;\\npragma experimental ABIEncoderV2;\\n\\nimport './interfaces/IForceMove.sol';\\nimport './interfaces/ForceMoveApp.sol';\\n\\n/**\\n * @dev An implementation of ForceMove protocol, which allows state channels to be adjudicated and finalized.\\n */\\ncontract ForceMove is IForceMove {\\n    mapping(bytes32 => bytes32) public channelStorageHashes;\\n\\n    // Public methods:\\n\\n    /**\\n     * @notice Unpacks turnNumRecord, finalizesAt and fingerprint from the channelStorageHash of a particular channel.\\n     * @dev Unpacks turnNumRecord, finalizesAt and fingerprint from the channelStorageHash of a particular channel.\\n     * @param channelId Unique identifier for a state channel.\\n     * @return turnNumRecord A turnNum that (the adjudicator knows) is supported by a signature from each participant.\\n     * @return finalizesAt The unix timestamp when `channelId` will finalize.\\n     * @return fingerprint Unique identifier for the channel's current state, up to hash collisions.\\n     */\\n    function getChannelStorage(bytes32 channelId)\\n        public\\n        view\\n        returns (\\n            uint48 turnNumRecord,\\n            uint48 finalizesAt,\\n            uint160 fingerprint\\n        )\\n    {\\n        (turnNumRecord, finalizesAt, fingerprint) = _getChannelStorage(channelId);\\n    }\\n\\n    /**\\n     * @notice Registers a challenge against a state channel. A challenge will either prompt another participant into clearing the challenge (via one of the other methods), or cause the channel to finalize at a specific time.\\n     * @dev Registers a challenge against a state channel. A challenge will either prompt another participant into clearing the challenge (via one of the other methods), or cause the channel to finalize at a specific time.\\n     * @param fixedPart Data describing properties of the state channel that do not change with state updates.\\n     * @param largestTurnNum The largest turn number of the submitted states; will overwrite the stored value of `turnNumRecord`.\\n     * @param variableParts An ordered array of structs, each decribing the properties of the state channel that may change with each state update. Length is from 1 to the number of participants (inclusive).\\n     * @param isFinalCount Describes how many of the submitted states have the `isFinal` property set to `true`. It is implied that the rightmost `isFinalCount` states are final, and the rest are not final.\\n     * @param sigs An array of signatures that support the state with the `largestTurnNum`. There must be one for each participant, e.g.: [sig-from-p0, sig-from-p1, ...]\\n     * @param whoSignedWhat An array denoting which participant has signed which state: `participant[i]` signed the state with index `whoSignedWhat[i]`.\\n     * @param challengerSig The signature of a participant on the keccak256 of the abi.encode of (supportedStateHash, 'forceMove').\\n     */\\n    function challenge(\\n        FixedPart memory fixedPart,\\n        uint48 largestTurnNum,\\n        ForceMoveApp.VariablePart[] memory variableParts,\\n        uint8 isFinalCount, // how many of the states are final\\n        Signature[] memory sigs,\\n        uint8[] memory whoSignedWhat,\\n        Signature memory challengerSig\\n    ) public override {\\n        bytes32 channelId = _getChannelId(fixedPart);\\n\\n        if (_mode(channelId) == ChannelMode.Open) {\\n            _requireNonDecreasedTurnNumber(channelId, largestTurnNum);\\n        } else if (_mode(channelId) == ChannelMode.Challenge) {\\n            _requireIncreasedTurnNumber(channelId, largestTurnNum);\\n        } else {\\n            // This should revert.\\n            _requireChannelNotFinalized(channelId);\\n        }\\n        bytes32 supportedStateHash = _requireStateSupportedBy(\\n            largestTurnNum,\\n            variableParts,\\n            isFinalCount,\\n            channelId,\\n            fixedPart,\\n            sigs,\\n            whoSignedWhat\\n        );\\n\\n        address challenger = _requireChallengerIsParticipant(\\n            supportedStateHash,\\n            fixedPart.participants,\\n            challengerSig\\n        );\\n\\n        // effects\\n\\n        emit ChallengeRegistered(\\n            channelId,\\n            largestTurnNum,\\n            uint48(now) + fixedPart.challengeDuration, // This could overflow, so don't join a channel with a huge challengeDuration\\n            challenger,\\n            isFinalCount > 0,\\n            fixedPart,\\n            variableParts,\\n            sigs,\\n            whoSignedWhat\\n        );\\n\\n        channelStorageHashes[channelId] = _hashChannelData(\\n            ChannelData(\\n                largestTurnNum,\\n                uint48(now) + fixedPart.challengeDuration,\\n                supportedStateHash,\\n                challenger,\\n                keccak256(abi.encode(variableParts[variableParts.length - 1].outcome))\\n            )\\n        );\\n    }\\n\\n    /**\\n     * @notice Repsonds to an ongoing challenge registered against a state channel.\\n     * @dev Repsonds to an ongoing challenge registered against a state channel.\\n     * @param challenger The address of the participant whom registered the challenge.\\n     * @param isFinalAB An pair of booleans describing if the challenge state and/or the response state have the `isFinal` property set to `true`.\\n     * @param fixedPart Data describing properties of the state channel that do not change with state updates.\\n     * @param variablePartAB An pair of structs, each decribing the properties of the state channel that may change with each state update (for the challenge state and for the response state).\\n     * @param sig The responder's signature on the `responseStateHash`.\\n     */\\n    function respond(\\n        address challenger,\\n        bool[2] memory isFinalAB,\\n        FixedPart memory fixedPart,\\n        ForceMoveApp.VariablePart[2] memory variablePartAB,\\n        // variablePartAB[0] = challengeVariablePart\\n        // variablePartAB[1] = responseVariablePart\\n        Signature memory sig\\n    ) public override {\\n        bytes32 channelId = _getChannelId(fixedPart);\\n        (uint48 turnNumRecord, uint48 finalizesAt, ) = _getChannelStorage(channelId);\\n\\n        bytes32 challengeOutcomeHash = _hashOutcome(variablePartAB[0].outcome);\\n        bytes32 responseOutcomeHash = _hashOutcome(variablePartAB[1].outcome);\\n        bytes32 challengeStateHash = _hashState(\\n            turnNumRecord,\\n            isFinalAB[0],\\n            channelId,\\n            fixedPart,\\n            variablePartAB[0].appData,\\n            challengeOutcomeHash\\n        );\\n\\n        bytes32 responseStateHash = _hashState(\\n            turnNumRecord + 1,\\n            isFinalAB[1],\\n            channelId,\\n            fixedPart,\\n            variablePartAB[1].appData,\\n            responseOutcomeHash\\n        );\\n\\n        // checks\\n\\n        _requireSpecificChallenge(\\n            ChannelData(\\n                turnNumRecord,\\n                finalizesAt,\\n                challengeStateHash,\\n                challenger,\\n                challengeOutcomeHash\\n            ),\\n            channelId\\n        );\\n\\n        require(\\n            _recoverSigner(responseStateHash, sig) ==\\n                fixedPart.participants[(turnNumRecord + 1) % fixedPart.participants.length],\\n            'Response not signed by authorized mover'\\n        );\\n\\n        _requireValidTransition(\\n            fixedPart.participants.length,\\n            isFinalAB,\\n            variablePartAB,\\n            turnNumRecord + 1,\\n            fixedPart.appDefinition\\n        );\\n\\n        // effects\\n        _clearChallenge(channelId, turnNumRecord + 1);\\n    }\\n\\n    /**\\n     * @notice Overwrites the `turnNumRecord` stored against a channel by providing a state with higher turn number, supported by a signature from each participant.\\n     * @dev Overwrites the `turnNumRecord` stored against a channel by providing a state with higher turn number, supported by a signature from each participant.\\n     * @param fixedPart Data describing properties of the state channel that do not change with state updates.\\n     * @param largestTurnNum The largest turn number of the submitted states; will overwrite the stored value of `turnNumRecord`.\\n     * @param variableParts An ordered array of structs, each decribing the properties of the state channel that may change with each state update.\\n     * @param isFinalCount Describes how many of the submitted states have the `isFinal` property set to `true`. It is implied that the rightmost `isFinalCount` states are final, and the rest are not final.\\n     * @param sigs An array of signatures that support the state with the `largestTurnNum`.\\n     * @param whoSignedWhat An array denoting which participant has signed which state: `participant[i]` signed the state with index `whoSignedWhat[i]`.\\n     */\\n    function checkpoint(\\n        FixedPart memory fixedPart,\\n        uint48 largestTurnNum,\\n        ForceMoveApp.VariablePart[] memory variableParts,\\n        uint8 isFinalCount, // how many of the states are final\\n        Signature[] memory sigs,\\n        uint8[] memory whoSignedWhat\\n    ) public override {\\n        bytes32 channelId = _getChannelId(fixedPart);\\n\\n        // checks\\n        _requireChannelNotFinalized(channelId);\\n        _requireIncreasedTurnNumber(channelId, largestTurnNum);\\n        _requireStateSupportedBy(\\n            largestTurnNum,\\n            variableParts,\\n            isFinalCount,\\n            channelId,\\n            fixedPart,\\n            sigs,\\n            whoSignedWhat\\n        );\\n\\n        // effects\\n        _clearChallenge(channelId, largestTurnNum);\\n    }\\n\\n    /**\\n     * @notice Finalizes a channel by providing a finalization proof.\\n     * @dev Finalizes a channel by providing a finalization proof.\\n     * @param largestTurnNum The largest turn number of the submitted states; will overwrite the stored value of `turnNumRecord`.\\n     * @param fixedPart Data describing properties of the state channel that do not change with state updates.\\n     * @param appPartHash The keccak256 of the abi.encode of `(challengeDuration, appDefinition, appData)`. Applies to all states in the finalization proof.\\n     * @param outcomeHash The keccak256 of the abi.encode of the `outcome`. Applies to all stats in the finalization proof.\\n     * @param numStates The number of states in the finalization proof.\\n     * @param whoSignedWhat An array denoting which participant has signed which state: `participant[i]` signed the state with index `whoSignedWhat[i]`.\\n     * @param sigs An array of signatures that support the state with the `largestTurnNum`.\\n     */\\n    function conclude(\\n        uint48 largestTurnNum,\\n        FixedPart memory fixedPart,\\n        bytes32 appPartHash,\\n        bytes32 outcomeHash,\\n        uint8 numStates,\\n        uint8[] memory whoSignedWhat,\\n        Signature[] memory sigs\\n    ) public override {\\n        bytes32 channelId = _getChannelId(fixedPart);\\n        _requireChannelNotFinalized(channelId);\\n\\n        require(\\n            largestTurnNum + 1 >= numStates,\\n            'largestTurnNum + 1 must be greater than or equal to numStates'\\n        );\\n        // ^^ SW-C101: prevent underflow\\n\\n        // By construction, the following states form a valid transition\\n        bytes32[] memory stateHashes = new bytes32[](numStates);\\n        for (uint48 i = 0; i < numStates; i++) {\\n            stateHashes[i] = keccak256(\\n                abi.encode(\\n                    State(\\n                        largestTurnNum + (i + 1) - numStates, // turnNum\\n                        // ^^ SW-C101: It is not easy to use SafeMath here, since we are not using uint256s\\n                        // Instead, we are protected by the require statement above\\n                        true, // isFinal\\n                        channelId,\\n                        appPartHash,\\n                        outcomeHash\\n                    )\\n                )\\n            );\\n        }\\n\\n        // checks\\n        require(\\n            _validSignatures(\\n                largestTurnNum,\\n                fixedPart.participants,\\n                stateHashes,\\n                sigs,\\n                whoSignedWhat\\n            ),\\n            'Invalid signatures OR isFinal=true expected'\\n        );\\n\\n        // effects\\n        channelStorageHashes[channelId] = _hashChannelData(\\n            ChannelData(0, uint48(now), bytes32(0), address(0), outcomeHash)\\n        );\\n        emit Concluded(channelId);\\n    }\\n\\n    // Internal methods:\\n\\n    /**\\n     * @notice Checks that the challengerSignature was created by one of the supplied participants.\\n     * @dev Checks that the challengerSignature was created by one of the supplied participants.\\n     * @param supportedStateHash Forms part of the digest to be signed, along with the string 'forceMove'.\\n     * @param participants A list of addresses representing the participants of a channel.\\n     * @param challengerSignature The signature of a participant on the keccak256 of the abi.encode of (supportedStateHash, 'forceMove').\\n     */\\n    function _requireChallengerIsParticipant(\\n        bytes32 supportedStateHash,\\n        address[] memory participants,\\n        Signature memory challengerSignature\\n    ) internal pure returns (address challenger) {\\n        challenger = _recoverSigner(\\n            keccak256(abi.encode(supportedStateHash, 'forceMove')),\\n            challengerSignature\\n        );\\n        require(_isAddressInArray(challenger, participants), 'Challenger is not a participant');\\n    }\\n\\n    /**\\n     * @notice Tests whether a given address is in a given array of addresses.\\n     * @dev Tests whether a given address is in a given array of addresses.\\n     * @param suspect A single address of interest.\\n     * @param addresses A line-up of possible perpetrators.\\n     * @return true if the address is in the array, false otherwise\\n     */\\n    function _isAddressInArray(address suspect, address[] memory addresses)\\n        internal\\n        pure\\n        returns (bool)\\n    {\\n        for (uint256 i = 0; i < addresses.length; i++) {\\n            if (suspect == addresses[i]) {\\n                return true;\\n            }\\n        }\\n        return false;\\n    }\\n\\n    /**\\n     * @notice Given an array of state hashes, checks the validity of the supplied signatures. Valid means there is a signature for each participant, either on the hash of the state for which they are a mover, or on the hash of a state that appears after that state in the array.\\n     * @dev Given an array of state hashes, checks the validity of the supplied signatures. Valid means there is a signature for each participant, either on the hash of the state for which they are a mover, or on the hash of a state that appears after that state in the array.\\n     * @param largestTurnNum The largest turn number of the submitted states; will overwrite the stored value of `turnNumRecord`.\\n     * @param participants A list of addresses representing the participants of a channel.\\n     * @param stateHashes Array of keccak256(State) submitted in support of a state,\\n     * @param sigs Array of Signatures, one for each participant\\n     * @param whoSignedWhat participant[i] signed stateHashes[whoSignedWhat[i]]\\n     * @return true if the signatures are valid, false otherwise\\n     */\\n    function _validSignatures(\\n        uint48 largestTurnNum,\\n        address[] memory participants,\\n        bytes32[] memory stateHashes,\\n        Signature[] memory sigs,\\n        uint8[] memory whoSignedWhat // whoSignedWhat[i] is the index of the state in stateHashes that was signed by participants[i]\\n    ) internal pure returns (bool) {\\n        uint256 nParticipants = participants.length;\\n        uint256 nStates = stateHashes.length;\\n\\n        require(\\n            _acceptableWhoSignedWhat(whoSignedWhat, largestTurnNum, nParticipants, nStates),\\n            'Unacceptable whoSignedWhat array'\\n        );\\n        for (uint256 i = 0; i < nParticipants; i++) {\\n            address signer = _recoverSigner(stateHashes[whoSignedWhat[i]], sigs[i]);\\n            if (signer != participants[i]) {\\n                return false;\\n            }\\n        }\\n        return true;\\n    }\\n\\n    /**\\n     * @notice Given a declaration of which state in the support proof was signed by which participant, check if this declaration is acceptable. Acceptable means there is a signature for each participant, either on the hash of the state for which they are a mover, or on the hash of a state that appears after that state in the array.\\n     * @dev Given a declaration of which state in the support proof was signed by which participant, check if this declaration is acceptable. Acceptable means there is a signature for each participant, either on the hash of the state for which they are a mover, or on the hash of a state that appears after that state in the array.\\n     * @param whoSignedWhat participant[i] signed stateHashes[whoSignedWhat[i]]\\n     * @param largestTurnNum Largest turnNum of the support proof\\n     * @param nParticipants Number of participants in the channel\\n     * @param nStates Number of states in the support proof\\n     * @return true if whoSignedWhat is acceptable, false otherwise\\n     */\\n    function _acceptableWhoSignedWhat(\\n        uint8[] memory whoSignedWhat,\\n        uint48 largestTurnNum,\\n        uint256 nParticipants,\\n        uint256 nStates\\n    ) internal pure returns (bool) {\\n        require(\\n            whoSignedWhat.length == nParticipants,\\n            '_validSignatures: whoSignedWhat must be the same length as participants'\\n        );\\n        for (uint256 i = 0; i < nParticipants; i++) {\\n            uint256 offset = (nParticipants + largestTurnNum - i) % nParticipants;\\n            // offset is the difference between the index of participant[i] and the index of the participant who owns the largesTurnNum state\\n            // the additional nParticipants in the dividend ensures offset always positive\\n            if (whoSignedWhat[i] + offset + 1 < nStates) {\\n                return false;\\n            }\\n        }\\n        return true;\\n    }\\n\\n    bytes constant prefix = '\\\\x19Ethereum Signed Message:\\\\n32';\\n\\n    /**\\n     * @notice Given a digest and ethereum digital signature, recover the signer\\n     * @dev Given a digest and digital signature, recover the signer\\n     * @param _d message digest\\n     * @param sig ethereum digital signature\\n     * @return signer\\n     */\\n    function _recoverSigner(bytes32 _d, Signature memory sig) internal pure returns (address) {\\n        bytes32 prefixedHash = keccak256(abi.encodePacked(prefix, _d));\\n        address a = ecrecover(prefixedHash, sig.v, sig.r, sig.s);\\n        return (a);\\n    }\\n\\n    /**\\n     * @notice Check that the submitted data constitute a support proof.\\n     * @dev Check that the submitted data constitute a support proof.\\n     * @param largestTurnNum Largest turnNum of the support proof\\n     * @param variableParts Variable parts of the states in the support proof\\n     * @param isFinalCount How many of the states are final? The final isFinalCount states are implied final, the remainder are implied not final.\\n     * @param channelId Unique identifier for a channel.\\n     * @param fixedPart Fixed Part of the states in the support proof\\n     * @param sigs A signature from each participant.\\n     * @param whoSignedWhat participant[i] signed stateHashes[whoSignedWhat[i]]\\n     * @return The hash of the latest state in the proof, if supported, else reverts.\\n     */\\n    function _requireStateSupportedBy(\\n        uint48 largestTurnNum,\\n        ForceMoveApp.VariablePart[] memory variableParts,\\n        uint8 isFinalCount,\\n        bytes32 channelId,\\n        FixedPart memory fixedPart,\\n        Signature[] memory sigs,\\n        uint8[] memory whoSignedWhat\\n    ) internal pure returns (bytes32) {\\n        bytes32[] memory stateHashes = _requireValidTransitionChain(\\n            largestTurnNum,\\n            variableParts,\\n            isFinalCount,\\n            channelId,\\n            fixedPart\\n        );\\n\\n        require(\\n            _validSignatures(\\n                largestTurnNum,\\n                fixedPart.participants,\\n                stateHashes,\\n                sigs,\\n                whoSignedWhat\\n            ),\\n            'Invalid signatures'\\n        );\\n\\n        return stateHashes[stateHashes.length - 1];\\n    }\\n\\n    /**\\n     * @notice Check that the submitted states form a chain of valid transitions\\n     * @dev Check that the submitted states form a chain of valid transitions\\n     * @param largestTurnNum Largest turnNum of the support proof\\n     * @param variableParts Variable parts of the states in the support proof\\n     * @param isFinalCount How many of the states are final? The final isFinalCount states are implied final, the remainder are implied not final.\\n     * @param channelId Unique identifier for a channel.\\n     * @param fixedPart Fixed Part of the states in the support proof\\n     * @return true if every state is a validTransition from its predecessor, false otherwise.\\n     */\\n    function _requireValidTransitionChain(\\n        // returns stateHashes array if valid\\n        // else, reverts\\n        uint48 largestTurnNum,\\n        ForceMoveApp.VariablePart[] memory variableParts,\\n        uint8 isFinalCount,\\n        bytes32 channelId,\\n        FixedPart memory fixedPart\\n    ) internal pure returns (bytes32[] memory) {\\n        bytes32[] memory stateHashes = new bytes32[](variableParts.length);\\n        uint48 firstFinalTurnNum = largestTurnNum - isFinalCount + 1;\\n        uint48 turnNum;\\n\\n        for (uint48 i = 0; i < variableParts.length; i++) {\\n            turnNum = largestTurnNum - uint48(variableParts.length) + 1 + i;\\n            stateHashes[i] = _hashState(\\n                turnNum,\\n                turnNum >= firstFinalTurnNum,\\n                channelId,\\n                fixedPart,\\n                variableParts[i].appData,\\n                _hashOutcome(variableParts[i].outcome)\\n            );\\n            if (turnNum < largestTurnNum) {\\n                _requireValidTransition(\\n                    fixedPart.participants.length,\\n                    [turnNum >= firstFinalTurnNum, turnNum + 1 >= firstFinalTurnNum],\\n                    [variableParts[i], variableParts[i + 1]],\\n                    turnNum + 1,\\n                    fixedPart.appDefinition\\n                );\\n            }\\n        }\\n        return stateHashes;\\n    }\\n\\n    /**\\n    * @notice Check that the submitted pair of states form a valid transition\\n    * @dev Check that the submitted pair of states form a valid transition\\n    * @param nParticipants Number of participants in the channel.\\n    transition\\n    * @param isFinalAB Pair of booleans denoting whether the first and second state (resp.) are final.\\n    * @param ab Variable parts of each of the pair of states\\n    * @param turnNumB turnNum of the later state of the pair.\\n    * @param appDefinition Address of deployed contract containing application-specific validTransition function.\\n    * @return true if the later state is a validTransition from its predecessor, false otherwise.\\n    */\\n    function _requireValidTransition(\\n        uint256 nParticipants,\\n        bool[2] memory isFinalAB, // [a.isFinal, b.isFinal]\\n        ForceMoveApp.VariablePart[2] memory ab, // [a,b]\\n        uint48 turnNumB,\\n        address appDefinition\\n    ) internal pure returns (bool) {\\n        // a prior check on the signatures for the submitted states implies that the following fields are equal for a and b:\\n        // chainId, participants, channelNonce, appDefinition, challengeDuration\\n        // and that the b.turnNum = a.turnNum + 1\\n        if (isFinalAB[1]) {\\n            require(\\n                _bytesEqual(ab[1].outcome, ab[0].outcome),\\n                'InvalidTransitionError: Cannot move to a final state with a different default outcome'\\n            );\\n        } else {\\n            require(\\n                !isFinalAB[0],\\n                'InvalidTransitionError: Cannot move from a final state to a non final state'\\n            );\\n            if (turnNumB < 2 * nParticipants) {\\n                require(\\n                    _bytesEqual(ab[1].outcome, ab[0].outcome),\\n                    'InvalidTransitionError: Cannot change the default outcome during setup phase'\\n                );\\n                require(\\n                    _bytesEqual(ab[1].appData, ab[0].appData),\\n                    'InvalidTransitionError: Cannot change the appData during setup phase'\\n                );\\n            } else {\\n                require(\\n                    ForceMoveApp(appDefinition).validTransition(\\n                        ab[0],\\n                        ab[1],\\n                        turnNumB,\\n                        nParticipants\\n                    )\\n                );\\n                // reason string not necessary (called function will provide reason for reverting)\\n            }\\n        }\\n        return true;\\n    }\\n\\n    /**\\n     * @notice Check for equality of two byte strings\\n     * @dev Check for equality of two byte strings\\n     * @param _preBytes One bytes string\\n     * @param _postBytes The other bytes string\\n     * @return true if the bytes are identical, false otherwise.\\n     */\\n    function _bytesEqual(bytes memory _preBytes, bytes memory _postBytes)\\n        internal\\n        pure\\n        returns (bool)\\n    {\\n        // copied from https://www.npmjs.com/package/solidity-bytes-utils/v/0.1.1\\n        bool success = true;\\n\\n        assembly {\\n            let length := mload(_preBytes)\\n\\n            // if lengths don't match the arrays are not equal\\n            switch eq(length, mload(_postBytes))\\n                case 1 {\\n                    // cb is a circuit breaker in the for loop since there's\\n                    //  no said feature for inline assembly loops\\n                    // cb = 1 - don't breaker\\n                    // cb = 0 - break\\n                    let cb := 1\\n\\n                    let mc := add(_preBytes, 0x20)\\n                    let end := add(mc, length)\\n\\n                    for {\\n                        let cc := add(_postBytes, 0x20)\\n                        // the next line is the loop condition:\\n                        // while(uint256(mc < end) + cb == 2)\\n                    } eq(add(lt(mc, end), cb), 2) {\\n                        mc := add(mc, 0x20)\\n                        cc := add(cc, 0x20)\\n                    } {\\n                        // if any of these checks fails then arrays are not equal\\n                        if iszero(eq(mload(mc), mload(cc))) {\\n                            // unsuccess:\\n                            success := 0\\n                            cb := 0\\n                        }\\n                    }\\n                }\\n                default {\\n                    // unsuccess:\\n                    success := 0\\n                }\\n        }\\n\\n        return success;\\n    }\\n\\n    /**\\n     * @notice Clears a challenge by updating the turnNumRecord and resetting the remaining channel storage fields, and emits a ChallengeCleared event.\\n     * @dev Clears a challenge by updating the turnNumRecord and resetting the remaining channel storage fields, and emits a ChallengeCleared event.\\n     * @param channelId Unique identifier for a channel.\\n     * @param newTurnNumRecord New turnNumRecord to overwrite existing value\\n     */\\n    function _clearChallenge(bytes32 channelId, uint48 newTurnNumRecord) internal {\\n        channelStorageHashes[channelId] = _hashChannelData(\\n            ChannelData(newTurnNumRecord, 0, bytes32(0), address(0), bytes32(0))\\n        );\\n        emit ChallengeCleared(channelId, newTurnNumRecord);\\n    }\\n\\n    /**\\n     * @notice Checks that the submitted turnNumRecord is strictly greater than the turnNumRecord stored on chain.\\n     * @dev Checks that the submitted turnNumRecord is strictly greater than the turnNumRecord stored on chain.\\n     * @param channelId Unique identifier for a channel.\\n     * @param newTurnNumRecord New turnNumRecord intended to overwrite existing value\\n     */\\n    function _requireIncreasedTurnNumber(bytes32 channelId, uint48 newTurnNumRecord) internal view {\\n        (uint48 turnNumRecord, , ) = _getChannelStorage(channelId);\\n        require(newTurnNumRecord > turnNumRecord, 'turnNumRecord not increased.');\\n    }\\n\\n    /**\\n     * @notice Checks that the submitted turnNumRecord is greater than or equal to the turnNumRecord stored on chain.\\n     * @dev Checks that the submitted turnNumRecord is greater than or equal to the turnNumRecord stored on chain.\\n     * @param channelId Unique identifier for a channel.\\n     * @param newTurnNumRecord New turnNumRecord intended to overwrite existing value\\n     */\\n    function _requireNonDecreasedTurnNumber(bytes32 channelId, uint48 newTurnNumRecord)\\n        internal\\n        view\\n    {\\n        (uint48 turnNumRecord, , ) = _getChannelStorage(channelId);\\n        require(newTurnNumRecord >= turnNumRecord, 'turnNumRecord decreased.');\\n    }\\n\\n    /**\\n     * @notice Checks that a given ChannelData struct matches the challenge stored on chain, and that the channel is in Challenge mode.\\n     * @dev Checks that a given ChannelData struct matches the challenge stored on chain, and that the channel is in Challenge mode.\\n     * @param data A given ChannelData data structure.\\n     * @param channelId Unique identifier for a channel.\\n     */\\n    function _requireSpecificChallenge(ChannelData memory data, bytes32 channelId) internal view {\\n        _requireMatchingStorage(data, channelId);\\n        _requireOngoingChallenge(channelId);\\n    }\\n\\n    /**\\n     * @notice Checks that a given channel is in the Challenge mode.\\n     * @dev Checks that a given channel is in the Challenge mode.\\n     * @param channelId Unique identifier for a channel.\\n     */\\n    function _requireOngoingChallenge(bytes32 channelId) internal view {\\n        require(_mode(channelId) == ChannelMode.Challenge, 'No ongoing challenge.');\\n    }\\n\\n    /**\\n     * @notice Checks that a given channel is NOT in the Finalized mode.\\n     * @dev Checks that a given channel is in the Challenge mode.\\n     * @param channelId Unique identifier for a channel.\\n     */\\n    function _requireChannelNotFinalized(bytes32 channelId) internal view {\\n        require(_mode(channelId) != ChannelMode.Finalized, 'Channel finalized.');\\n    }\\n\\n    /**\\n     * @notice Checks that a given channel is in the Finalized mode.\\n     * @dev Checks that a given channel is in the Challenge mode.\\n     * @param channelId Unique identifier for a channel.\\n     */\\n    function _requireChannelFinalized(bytes32 channelId) internal view {\\n        require(_mode(channelId) == ChannelMode.Finalized, 'Channel not finalized.');\\n    }\\n\\n    /**\\n     * @notice Checks that a given channel is in the Open mode.\\n     * @dev Checks that a given channel is in the Challenge mode.\\n     * @param channelId Unique identifier for a channel.\\n     */\\n    function _requireChannelOpen(bytes32 channelId) internal view {\\n        require(_mode(channelId) == ChannelMode.Open, 'Channel not open.');\\n    }\\n\\n    /**\\n     * @notice Checks that a given ChannelData struct matches the challenge stored on chain.\\n     * @dev Checks that a given ChannelData struct matches the challenge stored on chain.\\n     * @param data A given ChannelData data structure.\\n     * @param channelId Unique identifier for a channel.\\n     */\\n    function _requireMatchingStorage(ChannelData memory data, bytes32 channelId) internal view {\\n        require(\\n            _matchesHash(data, channelStorageHashes[channelId]),\\n            'Channel storage does not match stored version.'\\n        );\\n    }\\n\\n    /**\\n     * @notice Computes the ChannelMode for a given channelId.\\n     * @dev Computes the ChannelMode for a given channelId.\\n     * @param channelId Unique identifier for a channel.\\n     */\\n    function _mode(bytes32 channelId) internal view returns (ChannelMode) {\\n        // Note that _getChannelStorage(someRandomChannelId) returns (0,0,0), which is\\n        // correct when nobody has written to storage yet.\\n\\n        (, uint48 finalizesAt, ) = _getChannelStorage(channelId);\\n        if (finalizesAt == 0) {\\n            return ChannelMode.Open;\\n        } else if (finalizesAt <= now) {\\n            return ChannelMode.Finalized;\\n        } else {\\n            return ChannelMode.Challenge;\\n        }\\n    }\\n\\n    /**\\n     * @notice Hashes the input data and formats it for on chain storage.\\n     * @dev Hashes the input data and formats it for on chain storage.\\n     * @param channelData ChannelData data.\\n     */\\n    function _hashChannelData(ChannelData memory channelData)\\n        internal\\n        pure\\n        returns (bytes32 newHash)\\n    {\\n        // The hash is constructed from left to right.\\n        uint256 result;\\n        uint16 cursor = 256;\\n\\n        // Shift turnNumRecord 208 bits left to fill the first 48 bits\\n        result = uint256(channelData.turnNumRecord) << (cursor -= 48);\\n\\n        // logical or with finalizesAt padded with 160 zeros to get the next 48 bits\\n        result |= (uint256(channelData.finalizesAt) << (cursor -= 48));\\n\\n        // logical or with the last 160 bits of the hash of the encoded storage\\n        result |= uint256(uint160(uint256(keccak256(abi.encode(channelData)))));\\n\\n        newHash = bytes32(result);\\n    }\\n\\n    /**\\n     * @notice Unpacks turnNumRecord, finalizesAt and fingerprint from the channelStorageHash of a particular channel.\\n     * @dev Unpacks turnNumRecord, finalizesAt and fingerprint from the channelStorageHash of a particular channel.\\n     * @param channelId Unique identifier for a state channel.\\n     * @return turnNumRecord A turnNum that (the adjudicator knows) is supported by a signature from each participant.\\n     * @return finalizesAt The unix timestamp when `channelId` will finalize.\\n     * @return fingerprint Unique identifier for the channel's current state, up to hash collisions.\\n     */\\n    function _getChannelStorage(bytes32 channelId)\\n        internal\\n        view\\n        returns (\\n            uint48 turnNumRecord,\\n            uint48 finalizesAt,\\n            uint160 fingerprint\\n        )\\n    {\\n        bytes32 storageHash = channelStorageHashes[channelId];\\n        uint16 cursor = 256;\\n        turnNumRecord = uint48(uint256(storageHash) >> (cursor -= 48));\\n        finalizesAt = uint48(uint256(storageHash) >> (cursor -= 48));\\n        fingerprint = uint160(uint256(storageHash));\\n    }\\n\\n    /**\\n     * @notice Checks that a given ChannelData struct matches a supplied bytes32 when formatted for storage.\\n     * @dev Checks that a given ChannelData struct matches a supplied bytes32 when formatted for storage.\\n     * @param data A given ChannelData data structure.\\n     * @param h Some data in on-chain storage format.\\n     */\\n    function _matchesHash(ChannelData memory data, bytes32 h) internal pure returns (bool) {\\n        return _hashChannelData(data) == h;\\n    }\\n\\n    /**\\n     * @notice Computes the hash of the state corresponding to the input data.\\n     * @dev Computes the hash of the state corresponding to the input data.\\n     * @param turnNum Turn number\\n     * @param isFinal Is the state final?\\n     * @param channelId Unique identifier for the channel\\n     * @param fixedPart Part of the state that does not change\\n     * @param appData Application specific date\\n     * @param outcomeHash Hash of the outcome.\\n     * @return The stateHash\\n     */\\n    function _hashState(\\n        uint48 turnNum,\\n        bool isFinal,\\n        bytes32 channelId,\\n        FixedPart memory fixedPart,\\n        bytes memory appData,\\n        bytes32 outcomeHash\\n    ) internal pure returns (bytes32) {\\n        return\\n            keccak256(\\n                abi.encode(\\n                    State(\\n                        turnNum,\\n                        isFinal,\\n                        channelId,\\n                        keccak256(\\n                            abi.encode(\\n                                fixedPart.challengeDuration,\\n                                fixedPart.appDefinition,\\n                                appData\\n                            )\\n                        ),\\n                        outcomeHash\\n                    )\\n                )\\n            );\\n    }\\n\\n    /**\\n     * @notice Computes the hash of a given outcome.\\n     * @dev Computes the hash of a given outcome.\\n     * @param outcome An outcome\\n     * @return The outcomeHash\\n     */\\n    function _hashOutcome(bytes memory outcome) internal pure returns (bytes32) {\\n        return keccak256(abi.encode(outcome));\\n    }\\n\\n    /**\\n     * @notice Computes the unique id of a channel.\\n     * @dev Computes the unique id of a channel.\\n     * @param fixedPart Part of the state that does not change\\n     * @return channelId\\n     */\\n    function _getChannelId(FixedPart memory fixedPart) internal pure returns (bytes32 channelId) {\\n        channelId = keccak256(\\n            abi.encode(fixedPart.chainId, fixedPart.participants, fixedPart.channelNonce)\\n        );\\n    }\\n\\n    // events\\n    event ChallengeRegistered(\\n        bytes32 indexed channelId,\\n        // everything needed to respond or checkpoint\\n        uint48 turnNumRecord,\\n        uint48 finalizesAt,\\n        address challenger,\\n        bool isFinal,\\n        FixedPart fixedPart,\\n        ForceMoveApp.VariablePart[] variableParts,\\n        Signature[] sigs,\\n        uint8[] whoSignedWhat\\n    );\\n\\n    event ChallengeCleared(bytes32 indexed channelId, uint48 newTurnNumRecord);\\n    event Concluded(bytes32 indexed channelId);\\n}\\n\",\"keccak256\":\"0x22843685ae2ebbe1ce0644e49319ad55d2a6100894da1961c9182e11da73c996\",\"license\":\"MIT\"},\"contracts/NitroAdjudicator.sol\":{\"content\":\"// SPDX-License-Identifier: MIT\\npragma solidity 0.6.12;\\npragma experimental ABIEncoderV2;\\n\\nimport './interfaces/Adjudicator.sol';\\nimport './ForceMove.sol';\\nimport './Outcome.sol';\\nimport './AssetHolder.sol';\\n\\n/**\\n * @dev The NitroAdjudicator contract extends ForceMove and hence inherits all ForceMove methods, and also extends and implements the Adjudicator interface, allowing for a finalized outcome to be pushed to an asset holder.\\n */\\ncontract NitroAdjudicator is Adjudicator, ForceMove {\\n    /**\\n     * @notice Allows a finalized channel's outcome to be decoded and one or more AssetOutcomes registered in external Asset Holder contracts.\\n     * @dev Allows a finalized channel's outcome to be decoded and one or more AssetOutcomes registered in external Asset Holder contracts.\\n     * @param channelId Unique identifier for a state channel\\n     * @param turnNumRecord A turnNum that (the adjudicator knows and stores) is supported by a signature from each participant.\\n     * @param finalizesAt The unix timestamp when this channel will finalize\\n     * @param stateHash The keccak256 of the abi.encode of the State (struct) stored by the adjudicator\\n     * @param challengerAddress The address of the participant whom registered the challenge, if any.\\n     * @param outcomeBytes The encoded Outcome of this state channel.\\n     */\\n    function pushOutcome(\\n        bytes32 channelId,\\n        uint48 turnNumRecord,\\n        uint48 finalizesAt,\\n        bytes32 stateHash,\\n        address challengerAddress,\\n        bytes memory outcomeBytes\\n    ) public override {\\n        // requirements\\n        _requireChannelFinalized(channelId);\\n\\n        bytes32 outcomeHash = keccak256(abi.encode(outcomeBytes));\\n\\n        _requireMatchingStorage(\\n            ChannelData(turnNumRecord, finalizesAt, stateHash, challengerAddress, outcomeHash),\\n            channelId\\n        );\\n\\n        Outcome.OutcomeItem[] memory outcome = abi.decode(outcomeBytes, (Outcome.OutcomeItem[]));\\n\\n        for (uint256 i = 0; i < outcome.length; i++) {\\n            require(\\n                AssetHolder(outcome[i].assetHolderAddress).setAssetOutcomeHash(\\n                    channelId,\\n                    keccak256(outcome[i].assetOutcomeBytes)\\n                )\\n            );\\n        }\\n    }\\n\\n    /**\\n     * @notice Allows a finalized channel's outcome to be decoded and transferAll to be triggered in external Asset Holder contracts.\\n     * @dev Allows a finalized channel's outcome to be decoded and one or more AssetOutcomes registered in external Asset Holder contracts.\\n     * @param channelId Unique identifier for a state channel\\n     * @param turnNumRecord A turnNum that (the adjudicator knows and stores) is supported by a signature from each participant.\\n     * @param finalizesAt The unix timestamp when this channel will finalize\\n     * @param stateHash The keccak256 of the abi.encode of the State (struct) stored by the adjudicator\\n     * @param challengerAddress The address of the participant whom registered the challenge, if any.\\n     * @param outcomeBytes The encoded Outcome of this state channel.\\n     */\\n    function pushOutcomeAndTransferAll(\\n        bytes32 channelId,\\n        uint48 turnNumRecord,\\n        uint48 finalizesAt,\\n        bytes32 stateHash,\\n        address challengerAddress,\\n        bytes memory outcomeBytes\\n    ) public {\\n        // requirements\\n        _requireChannelFinalized(channelId);\\n\\n        bytes32 outcomeHash = keccak256(abi.encode(outcomeBytes));\\n\\n        _requireMatchingStorage(\\n            ChannelData(turnNumRecord, finalizesAt, stateHash, challengerAddress, outcomeHash),\\n            channelId\\n        );\\n\\n        _transferAllFromAllAssetHolders(channelId, outcomeBytes);\\n    }\\n\\n    /**\\n     * @notice Finalizes a channel by providing a finalization proof, allows a finalized channel's outcome to be decoded and transferAll to be triggered in external Asset Holder contracts.\\n     * @dev Finalizes a channel by providing a finalization proof, allows a finalized channel's outcome to be decoded and transferAll to be triggered in external Asset Holder contracts.\\n     * @param largestTurnNum The largest turn number of the submitted states; will overwrite the stored value of `turnNumRecord`.\\n     * @param fixedPart Data describing properties of the state channel that do not change with state updates.\\n     * @param appPartHash The keccak256 of the abi.encode of `(challengeDuration, appDefinition, appData)`. Applies to all states in the finalization proof.\\n     * @param outcomeBytes abi.encode of an array of Outcome.OutcomeItem structs.\\n     * @param numStates The number of states in the finalization proof.\\n     * @param whoSignedWhat An array denoting which participant has signed which state: `participant[i]` signed the state with index `whoSignedWhat[i]`.\\n     * @param sigs An array of signatures that support the state with the `largestTurnNum`.\\n     */\\n    function concludePushOutcomeAndTransferAll(\\n        uint48 largestTurnNum,\\n        FixedPart memory fixedPart,\\n        bytes32 appPartHash,\\n        bytes memory outcomeBytes,\\n        uint8 numStates,\\n        uint8[] memory whoSignedWhat,\\n        Signature[] memory sigs\\n    ) public {\\n        // requirements\\n        bytes32 channelId = _getChannelId(fixedPart);\\n\\n        _requireChannelNotFinalized(channelId);\\n\\n        // By construction, the following states form a valid transition\\n        bytes32[] memory stateHashes = new bytes32[](numStates);\\n\\n        bytes32 outcomeHash = keccak256(abi.encode(outcomeBytes));\\n        for (uint48 i = 0; i < numStates; i++) {\\n            stateHashes[i] = keccak256(\\n                abi.encode(\\n                    State(\\n                        largestTurnNum + (i + 1) - numStates, // turnNum\\n                        true, // isFinal\\n                        channelId,\\n                        appPartHash,\\n                        outcomeHash\\n                    )\\n                )\\n            );\\n        }\\n\\n        require(\\n            _validSignatures(\\n                largestTurnNum,\\n                fixedPart.participants,\\n                stateHashes,\\n                sigs,\\n                whoSignedWhat\\n            ),\\n            'Invalid signatures'\\n        );\\n\\n        // effects\\n\\n        channelStorageHashes[channelId] = _hashChannelData(\\n            ChannelData(0, uint48(now), bytes32(0), address(0), outcomeHash)\\n        );\\n        emit Concluded(channelId);\\n\\n        _transferAllFromAllAssetHolders(channelId, outcomeBytes);\\n    }\\n\\n    /**\\n     * @notice Triggers transferAll in all external Asset Holder contracts specified in a given outcome for a given channelId.\\n     * @dev Triggers transferAll in  all external Asset Holder contracts specified in a given outcome for a given channelId.\\n     * @param channelId Unique identifier for a state channel\\n     * @param outcomeBytes abi.encode of an array of Outcome.OutcomeItem structs.\\n     */\\n    function _transferAllFromAllAssetHolders(bytes32 channelId, bytes memory outcomeBytes)\\n        internal\\n    {\\n        Outcome.OutcomeItem[] memory outcome = abi.decode(outcomeBytes, (Outcome.OutcomeItem[]));\\n\\n        for (uint256 i = 0; i < outcome.length; i++) {\\n            Outcome.AssetOutcome memory assetOutcome = abi.decode(\\n                outcome[i].assetOutcomeBytes,\\n                (Outcome.AssetOutcome)\\n            );\\n            if (assetOutcome.assetOutcomeType == uint8(Outcome.AssetOutcomeType.Allocation)) {\\n                AssetHolder(outcome[i].assetHolderAddress).transferAllAdjudicatorOnly(\\n                    channelId,\\n                    assetOutcome.allocationOrGuaranteeBytes\\n                );\\n            } else {\\n                revert('_transferAllFromAllAssetHolders: AssetOutcomeType is not an allocation');\\n            }\\n        }\\n    }\\n\\n    /**\\n    * @notice Check that the submitted pair of states form a valid transition (public wrapper for internal function _requireValidTransition)\\n    * @dev Check that the submitted pair of states form a valid transition (public wrapper for internal function _requireValidTransition)\\n    * @param nParticipants Number of participants in the channel.\\n    transition\\n    * @param isFinalAB Pair of booleans denoting whether the first and second state (resp.) are final.\\n    * @param ab Variable parts of each of the pair of states\\n    * @param turnNumB turnNum of the later state of the pair.\\n    * @param appDefinition Address of deployed contract containing application-specific validTransition function.\\n    * @return true if the later state is a validTransition from its predecessor, reverts otherwise.\\n    */\\n    function validTransition(\\n        uint256 nParticipants,\\n        bool[2] memory isFinalAB, // [a.isFinal, b.isFinal]\\n        ForceMoveApp.VariablePart[2] memory ab, // [a,b]\\n        uint48 turnNumB,\\n        address appDefinition\\n    ) public pure returns (bool) {\\n        return _requireValidTransition(nParticipants, isFinalAB, ab, turnNumB, appDefinition);\\n    }\\n}\\n\",\"keccak256\":\"0xf471123b8613cfd65c24c007fcacc92faea20fd56393f15d1fb7483d6044f6f3\",\"license\":\"MIT\"},\"contracts/Outcome.sol\":{\"content\":\"// SPDX-License-Identifier: MIT\\npragma solidity 0.6.12;\\npragma experimental ABIEncoderV2;\\n\\nlibrary Outcome {\\n    //An outcome is an array of OutcomeItems\\n    // Outcome = OutcomeItem[]\\n    // OutcomeItem = (AssetHolderAddress, AssetOutcome)\\n    // AssetOutcome = (AssetOutcomeType, Allocation | Guarantee)\\n    // Allocation = AllocationItem[]\\n    // AllocationItem = (Destination, Amount)\\n    // Guarantee = (ChannelAddress, Destination[])\\n    // Destination = ChannelAddress | ExternalDestination\\n\\n    struct OutcomeItem {\\n        address assetHolderAddress;\\n        bytes assetOutcomeBytes; // abi.encode(AssetOutcome)\\n    }\\n\\n    enum AssetOutcomeType {Allocation, Guarantee}\\n\\n    struct AssetOutcome {\\n        uint8 assetOutcomeType; // AssetOutcomeType.Allocation or AssetOutcomeType.Guarantee\\n        bytes allocationOrGuaranteeBytes; // abi.encode(AllocationItem[]) or abi.encode(Guarantee), depending on OutcomeType\\n    }\\n\\n    // reserve Allocation to refer to AllocationItem[]\\n    struct AllocationItem {\\n        bytes32 destination;\\n        uint256 amount;\\n    }\\n\\n    struct Guarantee {\\n        bytes32 targetChannelId;\\n        bytes32[] destinations;\\n    }\\n}\\n\",\"keccak256\":\"0x1f52a3bd34cedb97f1c754b2baba4069fc86dc34eb492bd89de9ef1f40e70ecc\",\"license\":\"MIT\"},\"contracts/interfaces/Adjudicator.sol\":{\"content\":\"// SPDX-License-Identifier: MIT\\npragma solidity 0.6.12;\\npragma experimental ABIEncoderV2;\\n\\n/**\\n * @dev An Adjudicator Interface calls for a method that allows a finalized outcome to be pushed to an asset holder.\\n */\\ninterface Adjudicator {\\n    /**\\n     * @notice Allows a finalized channel's outcome to be decoded and one or more AssetOutcomes registered in external Asset Holder contracts.\\n     * @dev Allows a finalized channel's outcome to be decoded and one or more AssetOutcomes registered in external Asset Holder contracts.\\n     * @param channelId Unique identifier for a state channel\\n     * @param turnNumRecord A turnNum that (the adjudicator knows and stores) is supported by a signature from each participant.\\n     * @param finalizesAt The unix timestamp when this channel will finalize\\n     * @param stateHash The keccak256 of the abi.encode of the State (struct) stored by the adjudicator\\n     * @param challengerAddress The address of the participant whom registered the challenge, if any.\\n     * @param outcomeBytes The encoded Outcome of this state channel.\\n     */\\n    function pushOutcome(\\n        bytes32 channelId,\\n        uint48 turnNumRecord,\\n        uint48 finalizesAt,\\n        bytes32 stateHash,\\n        address challengerAddress,\\n        bytes calldata outcomeBytes\\n    ) external;\\n}\\n\",\"keccak256\":\"0x108b50e6becc6d1b2616e90eb3b41cb0bfad0f1842c76125ab37970b82f1bac0\",\"license\":\"MIT\"},\"contracts/interfaces/ForceMoveApp.sol\":{\"content\":\"// SPDX-License-Identifier: MIT\\npragma solidity 0.6.12;\\npragma experimental ABIEncoderV2;\\n\\n/**\\n * @dev The ForceMoveApp interface calls for its children to implement an application-specific validTransition function, defining the state machine of a ForceMove state channel DApp.\\n */\\ninterface ForceMoveApp {\\n    struct VariablePart {\\n        bytes outcome;\\n        bytes appData;\\n    }\\n\\n    /**\\n     * @notice Encodes application-specific rules for a particular ForceMove-compliant state channel.\\n     * @dev Encodes application-specific rules for a particular ForceMove-compliant state channel.\\n     * @param a State being transitioned from.\\n     * @param b State being transitioned to.\\n     * @param turnNumB Turn number being transitioned to.\\n     * @param nParticipants Number of participants in this state channel.\\n     * @return true if the transition conforms to this application's rules, false otherwise\\n     */\\n    function validTransition(\\n        VariablePart calldata a,\\n        VariablePart calldata b,\\n        uint48 turnNumB,\\n        uint256 nParticipants\\n    ) external pure returns (bool);\\n}\\n\",\"keccak256\":\"0x7bdfa0d2bf2d988b9029a6b6837cbce33b98eb74848f8d5b1e83092278e5d5e3\",\"license\":\"MIT\"},\"contracts/interfaces/IAssetHolder.sol\":{\"content\":\"// SPDX-License-Identifier: MIT\\npragma solidity 0.6.12;\\npragma experimental ABIEncoderV2;\\n\\n/**\\n * @dev The IAssetHolder interface calls for functions that allow assets to be transferred from one channel to other channel and/or external destinations, as well as for guarantees to be claimed.\\n */\\ninterface IAssetHolder {\\n    /**\\n     * @notice Transfers the funds escrowed against `channelId` to the beneficiaries of that channel.\\n     * @dev Transfers the funds escrowed against `channelId` and transfers them to the beneficiaries of that channel.\\n     * @param channelId Unique identifier for a state channel.\\n     * @param allocationBytes The abi.encode of AssetOutcome.Allocation\\n     */\\n    function transferAll(bytes32 channelId, bytes calldata allocationBytes) external;\\n\\n    /**\\n     * @notice Transfers the funds escrowed against `guarantorChannelId` to the beneficiaries of the __target__ of that channel.\\n     * @dev Transfers the funds escrowed against `guarantorChannelId` to the beneficiaries of the __target__ of that channel.\\n     * @param guarantorChannelId Unique identifier for a guarantor state channel.\\n     * @param guaranteeBytes The abi.encode of Outcome.Guarantee\\n     * @param allocationBytes The abi.encode of AssetOutcome.Allocation for the __target__\\n     */\\n    function claimAll(\\n        bytes32 guarantorChannelId,\\n        bytes calldata guaranteeBytes,\\n        bytes calldata allocationBytes\\n    ) external;\\n\\n    /**\\n     * @dev Indicates that `amountDeposited` has been deposited into `destination`.\\n     * @param destination The channel being deposited into.\\n     * @param amountDeposited The amount being deposited.\\n     * @param destinationHoldings The new holdings for `destination`.\\n     */\\n    event Deposited(\\n        bytes32 indexed destination,\\n        uint256 amountDeposited,\\n        uint256 destinationHoldings\\n    );\\n\\n    /**\\n     * @dev Indicates that `amount` assets have been transferred to the external destination denoted by `destination`.\\n     * @param channelId The channelId of the funds being withdrawn.\\n     * @param destination An external destination, left-padded with zeros.\\n     * @param amount Number of assets transferred (wei or tokens).\\n     */\\n    event AssetTransferred(bytes32 indexed channelId, bytes32 indexed destination, uint256 amount);\\n}\\n\",\"keccak256\":\"0xeb2df7cba5d9f3c224360c69e89431db796986b61fcf23a86d15a9eedf81a030\",\"license\":\"MIT\"},\"contracts/interfaces/IForceMove.sol\":{\"content\":\"// SPDX-License-Identifier: MIT\\npragma solidity 0.6.12;\\npragma experimental ABIEncoderV2;\\n\\nimport './ForceMoveApp.sol';\\n\\n/**\\n * @dev The IForceMove contract abstraction defines the interface that an implementation of ForceMove should implement. ForceMove protocol allows state channels to be adjudicated and finalized.\\n */\\nabstract contract IForceMove {\\n    struct Signature {\\n        uint8 v;\\n        bytes32 r;\\n        bytes32 s;\\n    }\\n\\n    struct FixedPart {\\n        uint256 chainId;\\n        address[] participants;\\n        uint48 channelNonce;\\n        address appDefinition;\\n        uint48 challengeDuration;\\n    }\\n\\n    struct State {\\n        // participants sign the hash of this\\n        uint48 turnNum;\\n        bool isFinal;\\n        bytes32 channelId; // keccack(chainId,participants,channelNonce)\\n        bytes32 appPartHash;\\n        //     keccak256(abi.encode(\\n        //         fixedPart.challengeDuration,\\n        //         fixedPart.appDefinition,\\n        //         variablePart.appData\\n        //     )\\n        // )\\n        bytes32 outcomeHash;\\n    }\\n\\n    struct ChannelData {\\n        uint48 turnNumRecord;\\n        uint48 finalizesAt;\\n        bytes32 stateHash; // keccak256(abi.encode(State))\\n        address challengerAddress;\\n        bytes32 outcomeHash;\\n    }\\n\\n    enum ChannelMode {Open, Challenge, Finalized}\\n\\n    /**\\n     * @notice Registers a challenge against a state channel. A challenge will either prompt another participant into clearing the challenge (via one of the other methods), or cause the channel to finalize at a specific time.\\n     * @dev Registers a challenge against a state channel. A challenge will either prompt another participant into clearing the challenge (via one of the other methods), or cause the channel to finalize at a specific time.\\n     * @param fixedPart Data describing properties of the state channel that do not change with state updates.\\n     * @param largestTurnNum The largest turn number of the submitted states; will overwrite the stored value of `turnNumRecord`.\\n     * @param variableParts An ordered array of structs, each decribing the properties of the state channel that may change with each state update.\\n     * @param isFinalCount Describes how many of the submitted states have the `isFinal` property set to `true`. It is implied that the rightmost `isFinalCount` states are final, and the rest are not final.\\n     * @param sigs An array of signatures that support the state with the `largestTurnNum`.\\n     * @param whoSignedWhat An array denoting which participant has signed which state: `participant[i]` signed the state with index `whoSignedWhat[i]`.\\n     * @param challengerSig The signature of a participant on the keccak256 of the abi.encode of (supportedStateHash, 'forceMove').\\n     */\\n    function challenge(\\n        FixedPart memory fixedPart,\\n        uint48 largestTurnNum,\\n        ForceMoveApp.VariablePart[] memory variableParts,\\n        uint8 isFinalCount, // how many of the states are final\\n        Signature[] memory sigs,\\n        uint8[] memory whoSignedWhat,\\n        Signature memory challengerSig\\n    ) public virtual;\\n\\n    /**\\n     * @notice Repsonds to an ongoing challenge registered against a state channel.\\n     * @dev Repsonds to an ongoing challenge registered against a state channel.\\n     * @param challenger The address of the participant whom registered the challenge.\\n     * @param isFinalAB An pair of booleans describing if the challenge state and/or the response state have the `isFinal` property set to `true`.\\n     * @param fixedPart Data describing properties of the state channel that do not change with state updates.\\n     * @param variablePartAB An pair of structs, each decribing the properties of the state channel that may change with each state update (for the challenge state and for the response state).\\n     * @param sig The responder's signature on the `responseStateHash`.\\n     */\\n    function respond(\\n        address challenger,\\n        bool[2] memory isFinalAB,\\n        FixedPart memory fixedPart,\\n        ForceMoveApp.VariablePart[2] memory variablePartAB,\\n        // variablePartAB[0] = challengeVariablePart\\n        // variablePartAB[1] = responseVariablePart\\n        Signature memory sig\\n    ) public virtual;\\n\\n    /**\\n     * @notice Overwrites the `turnNumRecord` stored against a channel by providing a state with higher turn number, supported by a signature from each participant.\\n     * @dev Overwrites the `turnNumRecord` stored against a channel by providing a state with higher turn number, supported by a signature from each participant.\\n     * @param fixedPart Data describing properties of the state channel that do not change with state updates.\\n     * @param largestTurnNum The largest turn number of the submitted states; will overwrite the stored value of `turnNumRecord`.\\n     * @param variableParts An ordered array of structs, each decribing the properties of the state channel that may change with each state update.\\n     * @param isFinalCount Describes how many of the submitted states have the `isFinal` property set to `true`. It is implied that the rightmost `isFinalCount` states are final, and the rest are not final.\\n     * @param sigs An array of signatures that support the state with the `largestTurnNum`.\\n     * @param whoSignedWhat An array denoting which participant has signed which state: `participant[i]` signed the state with index `whoSignedWhat[i]`.\\n     */\\n    function checkpoint(\\n        FixedPart memory fixedPart,\\n        uint48 largestTurnNum,\\n        ForceMoveApp.VariablePart[] memory variableParts,\\n        uint8 isFinalCount, // how many of the states are final\\n        Signature[] memory sigs,\\n        uint8[] memory whoSignedWhat\\n    ) public virtual;\\n\\n    /**\\n     * @notice Finalizes a channel by providing a finalization proof.\\n     * @dev Finalizes a channel by providing a finalization proof.\\n     * @param largestTurnNum The largest turn number of the submitted states; will overwrite the stored value of `turnNumRecord`.\\n     * @param fixedPart Data describing properties of the state channel that do not change with state updates.\\n     * @param appPartHash The keccak256 of the abi.encode of `(challengeDuration, appDefinition, appData)`. Applies to all states in the finalization proof.\\n     * @param outcomeHash The keccak256 of the abi.encode of the `outcome`. Applies to all stats in the finalization proof.\\n     * @param numStates The number of states in the finalization proof.\\n     * @param whoSignedWhat An array denoting which participant has signed which state: `participant[i]` signed the state with index `whoSignedWhat[i]`.\\n     * @param sigs An array of signatures that support the state with the `largestTurnNum`.\\n     */\\n    function conclude(\\n        uint48 largestTurnNum,\\n        FixedPart memory fixedPart,\\n        bytes32 appPartHash,\\n        bytes32 outcomeHash,\\n        uint8 numStates,\\n        uint8[] memory whoSignedWhat,\\n        Signature[] memory sigs\\n    ) public virtual;\\n\\n    // events\\n\\n    /**\\n     * @dev Indicates that a challenge has been registered against `channelId`.\\n     * @param channelId Unique identifier for a state channel.\\n     * @param turnNumRecord A turnNum that (the adjudicator knows) is supported by a signature from each participant.\\n     * @param finalizesAt The unix timestamp when `channelId` will finalize.\\n     * @param challenger The address of the participant whom registered the challenge.\\n     * @param isFinal Boolean denoting whether the challenge state is final.\\n     * @param fixedPart Data describing properties of the state channel that do not change with state updates.\\n     * @param variableParts An ordered array of structs, each decribing the properties of the state channel that may change with each state update.\\n     * @param sigs A list of Signatures that supported the challenge\\n     * @param whoSignedWhat Indexing information to identify which signature was by which participant\\n     */\\n    event ChallengeRegistered(\\n        bytes32 indexed channelId,\\n        // everything needed to respond or checkpoint\\n        uint48 turnNumRecord,\\n        uint48 finalizesAt,\\n        address challenger,\\n        bool isFinal,\\n        FixedPart fixedPart,\\n        ForceMoveApp.VariablePart[] variableParts,\\n        Signature[] sigs,\\n        uint8[] whoSignedWhat\\n    );\\n\\n    /**\\n     * @dev Indicates that a challenge, previously registered against `channelId`, has been cleared.\\n     * @param channelId Unique identifier for a state channel.\\n     * @param newTurnNumRecord A turnNum that (the adjudicator knows) is supported by a signature from each participant.\\n     */\\n    event ChallengeCleared(bytes32 indexed channelId, uint48 newTurnNumRecord);\\n\\n    /**\\n     * @dev Indicates that a challenge has been registered against `channelId`.\\n     * @param channelId Unique identifier for a state channel.\\n     */\\n    event Concluded(bytes32 indexed channelId);\\n}\\n\",\"keccak256\":\"0xc7c6fbab783ca84a834effd78e0f4e17b3f64f5d4d4a3bbd20b7f83568ccf119\",\"license\":\"MIT\"}},\"version\":1}",
  "bytecode": "0x608060405234801561001057600080fd5b50614122806100206000396000f3fe608060405234801561001057600080fd5b506004361061009e5760003560e01c80637ff6a982116100665780637ff6a98214610157578063eb02651414610173578063f198bea91461018f578063fe9e5db9146101ab578063ff8ceb32146101dd5761009e565b80630149b762146100a35780635a04d456146100bf5780636775b173146100db5780636f65e87d1461010b57806374ce052a1461013b575b600080fd5b6100bd60048036038101906100b89190612623565b6101f9565b005b6100d960048036038101906100d49190612541565b61023c565b005b6100f560048036038101906100f0919061280b565b6103cd565b604051610102919061379c565b60405180910390f35b61012560048036038101906101209190612518565b6103e7565b60405161013291906137b7565b60405180910390f35b61015560048036038101906101509190612541565b6103ff565b005b610171600480360381019061016c919061289a565b61049c565b005b61018d60048036038101906101889190612980565b6106ef565b005b6101a960048036038101906101a4919061270c565b610927565b005b6101c560048036038101906101c09190612518565b610ae1565b6040516101d493929190613cba565b60405180910390f35b6101f760048036038101906101f29190612406565b610b02565b005b600061020487610d09565b905061020f81610d49565b6102198187610dad565b610228868686848b8888610e13565b506102338187610e9c565b50505050505050565b61024586610f4b565b600081604051602001610258919061389e565b6040516020818303038152906040528051906020012090506102c66040518060a001604052808865ffffffffffff1681526020018765ffffffffffff1681526020018681526020018573ffffffffffffffffffffffffffffffffffffffff1681526020018381525088610fae565b6060828060200190518101906102dc91906124ae565b905060005b81518110156103c2578181815181106102f657fe5b60200260200101516000015173ffffffffffffffffffffffffffffffffffffffff1663a3c863a38a84848151811061032a57fe5b602002602001015160200151805190602001206040518363ffffffff1660e01b815260040161035a9291906137d2565b602060405180830381600087803b15801561037457600080fd5b505af1158015610388573d6000803e3d6000fd5b505050506040513d601f19601f820116820180604052508101906103ac91906124ef565b6103b557600080fd5b80806001019150506102e1565b505050505050505050565b60006103dc868686868661100d565b905095945050505050565b60006020528060005260406000206000915090505481565b61040886610f4b565b60008160405160200161041b919061389e565b6040516020818303038152906040528051906020012090506104896040518060a001604052808865ffffffffffff1681526020018765ffffffffffff1681526020018681526020018573ffffffffffffffffffffffffffffffffffffffff1681526020018381525088610fae565b61049387836112b7565b50505050505050565b60006104a787610d09565b90506104b281610d49565b8360ff166001890165ffffffffffff161015610503576040517f08c379a00000000000000000000000000000000000000000000000000000000081526004016104fa906138e0565b60405180910390fd5b60608460ff1667ffffffffffffffff8111801561051f57600080fd5b5060405190808252806020026020018201604052801561054e5781602001602082028036833780820191505090505b50905060005b8560ff168165ffffffffffff1610156105f6576040518060a001604052808760ff16600184018d010365ffffffffffff168152602001600115158152602001848152602001898152602001888152506040516020016105b39190613b1b565b60405160208183030381529060405280519060200120828265ffffffffffff16815181106105dd57fe5b6020026020010181815250508080600101915050610554565b5061060889896020015183868861140a565b610647576040517f08c379a000000000000000000000000000000000000000000000000000000000815260040161063e90613a80565b60405180910390fd5b6106a16040518060a00160405280600065ffffffffffff1681526020014265ffffffffffff1681526020016000801b8152602001600073ffffffffffffffffffffffffffffffffffffffff16815260200188815250611529565b60008084815260200190815260200160002081905550817f3e659e9176c25a527f4575e010a270b3e1f8e9d1e94f5e49d4a91dd2c59e8cf860405160405180910390a2505050505050505050565b60006106fa87610d09565b905061070581610d49565b60608460ff1667ffffffffffffffff8111801561072157600080fd5b506040519080825280602002602001820160405280156107505781602001602082028036833780820191505090505b509050600086604051602001610766919061389e565b60405160208183030381529060405280519060200120905060005b8660ff168165ffffffffffff161015610823576040518060a001604052808860ff16600184018e010365ffffffffffff1681526020016001151581526020018581526020018a8152602001838152506040516020016107e09190613b1b565b60405160208183030381529060405280519060200120838265ffffffffffff168151811061080a57fe5b6020026020010181815250508080600101915050610781565b506108358a8a6020015184878961140a565b610874576040517f08c379a000000000000000000000000000000000000000000000000000000000815260040161086b906139c0565b60405180910390fd5b6108ce6040518060a00160405280600065ffffffffffff1681526020014265ffffffffffff1681526020016000801b8152602001600073ffffffffffffffffffffffffffffffffffffffff16815260200183815250611529565b60008085815260200190815260200160002081905550827f3e659e9176c25a527f4575e010a270b3e1f8e9d1e94f5e49d4a91dd2c59e8cf860405160405180910390a261091b83886112b7565b50505050505050505050565b600061093288610d09565b90506000600281111561094157fe5b61094a826115be565b600281111561095557fe5b141561096a57610965818861160d565b6109ab565b6001600281111561097757fe5b610980826115be565b600281111561098b57fe5b14156109a05761099b8188610dad565b6109aa565b6109a981610d49565b5b5b60006109bc888888858d8a8a610e13565b905060006109cf828b6020015186611674565b9050827f1f9f029de8ab3f81b5381a9bc066b421d0f215db28cc8160ec346bc6f0463c6e8a8c6080015142018460008c60ff16118f8e8d8d604051610a1b989796959493929190613c20565b60405180910390a2610abf6040518060a001604052808b65ffffffffffff1681526020018c60800151420165ffffffffffff1681526020018481526020018373ffffffffffffffffffffffffffffffffffffffff1681526020018a60018c510381518110610a8557fe5b602002602001015160000151604051602001610aa1919061389e565b60405160208183030381529060405280519060200120815250611529565b6000808581526020019081526020016000208190555050505050505050505050565b6000806000610aef846116f8565b8093508194508295505050509193909250565b6000610b0d84610d09565b9050600080610b1b836116f8565b50915091506000610b4086600060028110610b3257fe5b60200201516000015161174f565b90506000610b6287600160028110610b5457fe5b60200201516000015161174f565b90506000610b9a858b600060028110610b7757fe5b6020020151888c8c600060028110610b8b57fe5b6020020151602001518861177f565b90506000610bd5600187018c600160028110610bb257fe5b6020020151898d8d600160028110610bc657fe5b6020020151602001518861177f565b9050610c2d6040518060a001604052808865ffffffffffff1681526020018765ffffffffffff1681526020018481526020018e73ffffffffffffffffffffffffffffffffffffffff1681526020018681525088611816565b89602001518a60200151516001880165ffffffffffff1681610c4b57fe5b0681518110610c5657fe5b602002602001015173ffffffffffffffffffffffffffffffffffffffff16610c7e828a61182d565b73ffffffffffffffffffffffffffffffffffffffff1614610cd4576040517f08c379a0000000000000000000000000000000000000000000000000000000008152600401610ccb90613ae0565b60405180910390fd5b610ced8a60200151518c8b60018a018e6060015161100d565b50610cfb8760018801610e9c565b505050505050505050505050565b6000816000015182602001518360400151604051602001610d2c93929190613b89565b604051602081830303815290604052805190602001209050919050565b600280811115610d5557fe5b610d5e826115be565b6002811115610d6957fe5b1415610daa576040517f08c379a0000000000000000000000000000000000000000000000000000000008152600401610da190613940565b60405180910390fd5b50565b6000610db8836116f8565b505090508065ffffffffffff168265ffffffffffff1611610e0e576040517f08c379a0000000000000000000000000000000000000000000000000000000008152600401610e0590613900565b60405180910390fd5b505050565b60006060610e2489898989896118fa565b9050610e3789866020015183878761140a565b610e76576040517f08c379a0000000000000000000000000000000000000000000000000000000008152600401610e6d906139c0565b60405180910390fd5b80600182510381518110610e8657fe5b6020026020010151915050979650505050505050565b610ef96040518060a001604052808365ffffffffffff168152602001600065ffffffffffff1681526020016000801b8152602001600073ffffffffffffffffffffffffffffffffffffffff1681526020016000801b815250611529565b60008084815260200190815260200160002081905550817f07da0a0674fb921e484018c8b81d80e292745e5d8ed134b580c8b9c631c5e9e082604051610f3f9190613bc7565b60405180910390a25050565b600280811115610f5757fe5b610f60826115be565b6002811115610f6b57fe5b14610fab576040517f08c379a0000000000000000000000000000000000000000000000000000000008152600401610fa290613ac0565b60405180910390fd5b50565b610fca8260008084815260200190815260200160002054611ae1565b611009576040517f08c379a000000000000000000000000000000000000000000000000000000000815260040161100090613a60565b60405180910390fd5b5050565b60008460016002811061101c57fe5b60200201511561109e5761105a8460016002811061103657fe5b6020020151600001518560006002811061104c57fe5b602002015160000151611af6565b611099576040517f08c379a000000000000000000000000000000000000000000000000000000000815260040161109090613a40565b60405180910390fd5b6112aa565b846000600281106110ab57fe5b6020020151156110f0576040517f08c379a00000000000000000000000000000000000000000000000000000000081526004016110e790613a20565b60405180910390fd5b856002028365ffffffffffff1610156111ee576111378460016002811061111357fe5b6020020151600001518560006002811061112957fe5b602002015160000151611af6565b611176576040517f08c379a000000000000000000000000000000000000000000000000000000000815260040161116d906139e0565b60405180910390fd5b6111aa8460016002811061118657fe5b6020020151602001518560006002811061119c57fe5b602002015160200151611af6565b6111e9576040517f08c379a00000000000000000000000000000000000000000000000000000000081526004016111e0906138c0565b60405180910390fd5b6112a9565b8173ffffffffffffffffffffffffffffffffffffffff1663fd7a2f658560006002811061121757fe5b60200201518660016002811061122957fe5b6020020151868a6040518563ffffffff1660e01b815260040161124f9493929190613b36565b60206040518083038186803b15801561126757600080fd5b505afa15801561127b573d6000803e3d6000fd5b505050506040513d601f19601f8201168201806040525081019061129f91906124ef565b6112a857600080fd5b5b5b6001905095945050505050565b6060818060200190518101906112cd91906124ae565b905060005b8151811015611404576112e3611cf6565b8282815181106112ef57fe5b60200260200101516020015180602001905181019061130e91906125e2565b90506000600181111561131d57fe5b60ff16816000015160ff1614156113bb5782828151811061133a57fe5b60200260200101516000015173ffffffffffffffffffffffffffffffffffffffff1663022cbbe88683602001516040518363ffffffff1660e01b81526004016113849291906137fb565b600060405180830381600087803b15801561139e57600080fd5b505af11580156113b2573d6000803e3d6000fd5b505050506113f6565b6040517f08c379a00000000000000000000000000000000000000000000000000000000081526004016113ed90613920565b60405180910390fd5b5080806001019150506112d2565b50505050565b6000808551905060008551905061142384898484611b63565b611462576040517f08c379a000000000000000000000000000000000000000000000000000000000815260040161145990613aa0565b60405180910390fd5b60005b828110156115185760006114b58887848151811061147f57fe5b602002602001015160ff168151811061149457fe5b60200260200101518884815181106114a857fe5b602002602001015161182d565b90508882815181106114c357fe5b602002602001015173ffffffffffffffffffffffffffffffffffffffff168173ffffffffffffffffffffffffffffffffffffffff161461150a576000945050505050611520565b508080600101915050611465565b506001925050505b95945050505050565b600080600061010090506030810390508061ffff16846000015165ffffffffffff16901b91506030810390508061ffff16846020015165ffffffffffff16901b821791508360405160200161157e9190613b00565b6040516020818303038152906040528051906020012060001c73ffffffffffffffffffffffffffffffffffffffff16821791508160001b92505050919050565b6000806115ca836116f8565b5091505060008165ffffffffffff1614156115e9576000915050611608565b428165ffffffffffff1611611602576002915050611608565b60019150505b919050565b6000611618836116f8565b505090508065ffffffffffff168265ffffffffffff16101561166f576040517f08c379a000000000000000000000000000000000000000000000000000000000815260040161166690613960565b60405180910390fd5b505050565b60006116a68460405160200161168a919061382b565b604051602081830303815290604052805190602001208361182d565b90506116b28184611c17565b6116f1576040517f08c379a00000000000000000000000000000000000000000000000000000000081526004016116e8906139a0565b60405180910390fd5b9392505050565b600080600080600080868152602001908152602001600020549050600061010090506030810390508061ffff168260001c901c94506030810390508061ffff168260001c901c93508160001c925050509193909250565b600081604051602001611762919061389e565b604051602081830303815290604052805190602001209050919050565b60006040518060a001604052808865ffffffffffff168152602001871515815260200186815260200185608001518660600151866040516020016117c593929190613be2565b604051602081830303815290604052805190602001208152602001838152506040516020016117f49190613b1b565b6040516020818303038152906040528051906020012090509695505050505050565b6118208282610fae565b61182981611c92565b5050565b6000806040518060400160405280601c81526020017f19457468657265756d205369676e6564204d6573736167653a0a33320000000081525084604051602001611878929190613774565b6040516020818303038152906040528051906020012090506000600182856000015186602001518760400151604051600081526020016040526040516118c19493929190613859565b6020604051602081039080840390855afa1580156118e3573d6000803e3d6000fd5b505050602060405103519050809250505092915050565b606080855167ffffffffffffffff8111801561191557600080fd5b506040519080825280602002602001820160405280156119445781602001602082028036833780820191505090505b509050600060018660ff168903019050600080600090505b88518165ffffffffffff161015611ad1578060018a518c03010191506119df828465ffffffffffff168465ffffffffffff16101589898d8665ffffffffffff16815181106119a657fe5b6020026020010151602001516119da8f8865ffffffffffff16815181106119c957fe5b60200260200101516000015161174f565b61177f565b848265ffffffffffff16815181106119f357fe5b6020026020010181815250508965ffffffffffff168265ffffffffffff161015611ac457611ac286602001515160405180604001604052808665ffffffffffff168665ffffffffffff1610151515151581526020018665ffffffffffff166001870165ffffffffffff1610151515151581525060405180604001604052808d8665ffffffffffff1681518110611a8557fe5b602002602001015181526020018d6001870165ffffffffffff1681518110611aa957fe5b6020026020010151815250600186018a6060015161100d565b505b808060010191505061195c565b5082935050505095945050505050565b600081611aed84611529565b14905092915050565b6000806001905083518351811460018114611b145760009250611b57565b600160208701838101602088015b600284838510011415611b52578051835114611b415760009650600093505b602083019250602081019050611b22565b505050505b50508091505092915050565b600082855114611ba8576040517f08c379a0000000000000000000000000000000000000000000000000000000008152600401611b9f90613a00565b60405180910390fd5b60005b83811015611c0957600084828765ffffffffffff1687010381611bca57fe5b06905083600182898581518110611bdd57fe5b602002602001015160ff1601011015611bfb57600092505050611c0f565b508080600101915050611bab565b50600190505b949350505050565b600080600090505b8251811015611c8657828181518110611c3457fe5b602002602001015173ffffffffffffffffffffffffffffffffffffffff168473ffffffffffffffffffffffffffffffffffffffff161415611c79576001915050611c8c565b8080600101915050611c1f565b50600090505b92915050565b60016002811115611c9f57fe5b611ca8826115be565b6002811115611cb357fe5b14611cf3576040517f08c379a0000000000000000000000000000000000000000000000000000000008152600401611cea90613980565b60405180910390fd5b50565b6040518060400160405280600060ff168152602001606081525090565b600081359050611d2281614062565b92915050565b600081519050611d3781614062565b92915050565b600082601f830112611d4e57600080fd5b8135611d61611d5c82613d1e565b613cf1565b91508181835260208401935060208101905083856020840282011115611d8657600080fd5b60005b83811015611db65781611d9c8882611d13565b845260208401935060208301925050600181019050611d89565b5050505092915050565b600082601f830112611dd157600080fd5b6002611de4611ddf82613d46565b613cf1565b91508183856020840282011115611dfa57600080fd5b60005b83811015611e2a5781611e108882612087565b845260208401935060208301925050600181019050611dfd565b5050505092915050565b600082601f830112611e4557600080fd5b8151611e58611e5382613d68565b613cf1565b9150818183526020840193506020810190508360005b83811015611e9e5781518601611e848882612272565b845260208401935060208301925050600181019050611e6e565b5050505092915050565b600082601f830112611eb957600080fd5b8135611ecc611ec782613d90565b613cf1565b91508181835260208401935060208101905083856060840282011115611ef157600080fd5b60005b83811015611f215781611f0788826122d6565b845260208401935060608301925050600181019050611ef4565b5050505092915050565b600082601f830112611f3c57600080fd5b6002611f4f611f4a82613db8565b613cf1565b9150818360005b83811015611f865781358601611f6c8882612336565b845260208401935060208301925050600181019050611f56565b5050505092915050565b600082601f830112611fa157600080fd5b8135611fb4611faf82613dda565b613cf1565b9150818183526020840193506020810190508360005b83811015611ffa5781358601611fe08882612336565b845260208401935060208301925050600181019050611fca565b5050505092915050565b600082601f83011261201557600080fd5b813561202861202382613e02565b613cf1565b9150818183526020840193506020810190508385602084028201111561204d57600080fd5b60005b8381101561207d578161206388826123dc565b845260208401935060208301925050600181019050612050565b5050505092915050565b60008135905061209681614079565b92915050565b6000815190506120ab81614079565b92915050565b6000813590506120c081614090565b92915050565b600082601f8301126120d757600080fd5b81356120ea6120e582613e2a565b613cf1565b9150808252602083016020830185838301111561210657600080fd5b612111838284614005565b50505092915050565b600082601f83011261212b57600080fd5b815161213e61213982613e2a565b613cf1565b9150808252602083016020830185838301111561215a57600080fd5b612165838284614014565b50505092915050565b60006040828403121561218057600080fd5b61218a6040613cf1565b9050600061219a848285016123f1565b600083015250602082015167ffffffffffffffff8111156121ba57600080fd5b6121c68482850161211a565b60208301525092915050565b600060a082840312156121e457600080fd5b6121ee60a0613cf1565b905060006121fe848285016123b2565b600083015250602082013567ffffffffffffffff81111561221e57600080fd5b61222a84828501611d3d565b602083015250604061223e848285016123c7565b604083015250606061225284828501611d13565b6060830152506080612266848285016123c7565b60808301525092915050565b60006040828403121561228457600080fd5b61228e6040613cf1565b9050600061229e84828501611d28565b600083015250602082015167ffffffffffffffff8111156122be57600080fd5b6122ca8482850161211a565b60208301525092915050565b6000606082840312156122e857600080fd5b6122f26060613cf1565b90506000612302848285016123dc565b6000830152506020612316848285016120b1565b602083015250604061232a848285016120b1565b60408301525092915050565b60006040828403121561234857600080fd5b6123526040613cf1565b9050600082013567ffffffffffffffff81111561236e57600080fd5b61237a848285016120c6565b600083015250602082013567ffffffffffffffff81111561239a57600080fd5b6123a6848285016120c6565b60208301525092915050565b6000813590506123c1816140a7565b92915050565b6000813590506123d6816140be565b92915050565b6000813590506123eb816140d5565b92915050565b600081519050612400816140d5565b92915050565b6000806000806000610100868803121561241f57600080fd5b600061242d88828901611d13565b955050602061243e88828901611dc0565b945050606086013567ffffffffffffffff81111561245b57600080fd5b612467888289016121d2565b935050608086013567ffffffffffffffff81111561248457600080fd5b61249088828901611f2b565b92505060a06124a1888289016122d6565b9150509295509295909350565b6000602082840312156124c057600080fd5b600082015167ffffffffffffffff8111156124da57600080fd5b6124e684828501611e34565b91505092915050565b60006020828403121561250157600080fd5b600061250f8482850161209c565b91505092915050565b60006020828403121561252a57600080fd5b6000612538848285016120b1565b91505092915050565b60008060008060008060c0878903121561255a57600080fd5b600061256889828a016120b1565b965050602061257989828a016123c7565b955050604061258a89828a016123c7565b945050606061259b89828a016120b1565b93505060806125ac89828a01611d13565b92505060a087013567ffffffffffffffff8111156125c957600080fd5b6125d589828a016120c6565b9150509295509295509295565b6000602082840312156125f457600080fd5b600082015167ffffffffffffffff81111561260e57600080fd5b61261a8482850161216e565b91505092915050565b60008060008060008060c0878903121561263c57600080fd5b600087013567ffffffffffffffff81111561265657600080fd5b61266289828a016121d2565b965050602061267389828a016123c7565b955050604087013567ffffffffffffffff81111561269057600080fd5b61269c89828a01611f90565b94505060606126ad89828a016123dc565b935050608087013567ffffffffffffffff8111156126ca57600080fd5b6126d689828a01611ea8565b92505060a087013567ffffffffffffffff8111156126f357600080fd5b6126ff89828a01612004565b9150509295509295509295565b6000806000806000806000610120888a03121561272857600080fd5b600088013567ffffffffffffffff81111561274257600080fd5b61274e8a828b016121d2565b975050602061275f8a828b016123c7565b965050604088013567ffffffffffffffff81111561277c57600080fd5b6127888a828b01611f90565b95505060606127998a828b016123dc565b945050608088013567ffffffffffffffff8111156127b657600080fd5b6127c28a828b01611ea8565b93505060a088013567ffffffffffffffff8111156127df57600080fd5b6127eb8a828b01612004565b92505060c06127fc8a828b016122d6565b91505092959891949750929550565b600080600080600060c0868803121561282357600080fd5b6000612831888289016123b2565b955050602061284288828901611dc0565b945050606086013567ffffffffffffffff81111561285f57600080fd5b61286b88828901611f2b565b935050608061287c888289016123c7565b92505060a061288d88828901611d13565b9150509295509295909350565b600080600080600080600060e0888a0312156128b557600080fd5b60006128c38a828b016123c7565b975050602088013567ffffffffffffffff8111156128e057600080fd5b6128ec8a828b016121d2565b96505060406128fd8a828b016120b1565b955050606061290e8a828b016120b1565b945050608061291f8a828b016123dc565b93505060a088013567ffffffffffffffff81111561293c57600080fd5b6129488a828b01612004565b92505060c088013567ffffffffffffffff81111561296557600080fd5b6129718a828b01611ea8565b91505092959891949750929550565b600080600080600080600060e0888a03121561299b57600080fd5b60006129a98a828b016123c7565b975050602088013567ffffffffffffffff8111156129c657600080fd5b6129d28a828b016121d2565b96505060406129e38a828b016120b1565b955050606088013567ffffffffffffffff811115612a0057600080fd5b612a0c8a828b016120c6565b9450506080612a1d8a828b016123dc565b93505060a088013567ffffffffffffffff811115612a3a57600080fd5b612a468a828b01612004565b92505060c088013567ffffffffffffffff811115612a6357600080fd5b612a6f8a828b01611ea8565b91505092959891949750929550565b6000612a8a8383612ada565b60208301905092915050565b6000612aa283836135d9565b60608301905092915050565b6000612aba8383613683565b905092915050565b6000612ace8383613756565b60208301905092915050565b612ae381613f94565b82525050565b612af281613f94565b82525050565b6000612b0382613e96565b612b0d8185613f01565b9350612b1883613e56565b8060005b83811015612b49578151612b308882612a7e565b9750612b3b83613ecd565b925050600181019050612b1c565b5085935050505092915050565b6000612b6182613e96565b612b6b8185613f12565b9350612b7683613e56565b8060005b83811015612ba7578151612b8e8882612a7e565b9750612b9983613ecd565b925050600181019050612b7a565b5085935050505092915050565b6000612bbf82613ea1565b612bc98185613f23565b9350612bd483613e66565b8060005b83811015612c05578151612bec8882612a96565b9750612bf783613eda565b925050600181019050612bd8565b5085935050505092915050565b6000612c1d82613eac565b612c278185613f34565b935083602082028501612c3985613e76565b8060005b85811015612c755784840389528151612c568582612aae565b9450612c6183613ee7565b925060208a01995050600181019050612c3d565b50829750879550505050505092915050565b6000612c9282613eb7565b612c9c8185613f45565b9350612ca783613e86565b8060005b83811015612cd8578151612cbf8882612ac2565b9750612cca83613ef4565b925050600181019050612cab565b5085935050505092915050565b612cee81613fa6565b82525050565b612cfd81613fa6565b82525050565b612d0c81613fb2565b82525050565b612d1b81613fb2565b82525050565b612d32612d2d82613fb2565b614047565b82525050565b6000612d4382613ec2565b612d4d8185613f56565b9350612d5d818560208601614014565b612d6681614051565b840191505092915050565b6000612d7c82613ec2565b612d868185613f67565b9350612d96818560208601614014565b612d9f81614051565b840191505092915050565b6000612db582613ec2565b612dbf8185613f78565b9350612dcf818560208601614014565b80840191505092915050565b6000612de8604483613f83565b91507f496e76616c69645472616e736974696f6e4572726f723a2043616e6e6f74206360008301527f68616e676520746865206170704461746120647572696e67207365747570207060208301527f68617365000000000000000000000000000000000000000000000000000000006040830152606082019050919050565b6000612e74603d83613f83565b91507f6c6172676573745475726e4e756d202b2031206d75737420626520677265617460008301527f6572207468616e206f7220657175616c20746f206e756d5374617465730000006020830152604082019050919050565b6000612eda601c83613f83565b91507f7475726e4e756d5265636f7264206e6f7420696e637265617365642e000000006000830152602082019050919050565b6000612f1a604683613f83565b91507f5f7472616e73666572416c6c46726f6d416c6c4173736574486f6c646572733a60008301527f2041737365744f7574636f6d6554797065206973206e6f7420616e20616c6c6f60208301527f636174696f6e00000000000000000000000000000000000000000000000000006040830152606082019050919050565b6000612fa6601283613f83565b91507f4368616e6e656c2066696e616c697a65642e00000000000000000000000000006000830152602082019050919050565b6000612fe6601883613f83565b91507f7475726e4e756d5265636f7264206465637265617365642e00000000000000006000830152602082019050919050565b6000613026601583613f83565b91507f4e6f206f6e676f696e67206368616c6c656e67652e00000000000000000000006000830152602082019050919050565b6000613066601f83613f83565b91507f4368616c6c656e676572206973206e6f742061207061727469636970616e74006000830152602082019050919050565b60006130a6601283613f83565b91507f496e76616c6964207369676e61747572657300000000000000000000000000006000830152602082019050919050565b60006130e6604c83613f83565b91507f496e76616c69645472616e736974696f6e4572726f723a2043616e6e6f74206360008301527f68616e6765207468652064656661756c74206f7574636f6d6520647572696e6760208301527f20736574757020706861736500000000000000000000000000000000000000006040830152606082019050919050565b6000613172604783613f83565b91507f5f76616c69645369676e6174757265733a2077686f5369676e6564576861742060008301527f6d757374206265207468652073616d65206c656e67746820617320706172746960208301527f636970616e7473000000000000000000000000000000000000000000000000006040830152606082019050919050565b60006131fe600983613f83565b91507f666f7263654d6f766500000000000000000000000000000000000000000000006000830152602082019050919050565b600061323e604b83613f83565b91507f496e76616c69645472616e736974696f6e4572726f723a2043616e6e6f74206d60008301527f6f76652066726f6d20612066696e616c20737461746520746f2061206e6f6e2060208301527f66696e616c2073746174650000000000000000000000000000000000000000006040830152606082019050919050565b60006132ca605583613f83565b91507f496e76616c69645472616e736974696f6e4572726f723a2043616e6e6f74206d60008301527f6f766520746f20612066696e616c20737461746520776974682061206469666660208301527f6572656e742064656661756c74206f7574636f6d6500000000000000000000006040830152606082019050919050565b6000613356602e83613f83565b91507f4368616e6e656c2073746f7261676520646f6573206e6f74206d61746368207360008301527f746f7265642076657273696f6e2e0000000000000000000000000000000000006020830152604082019050919050565b60006133bc602b83613f83565b91507f496e76616c6964207369676e617475726573204f5220697346696e616c3d747260008301527f75652065787065637465640000000000000000000000000000000000000000006020830152604082019050919050565b6000613422602083613f83565b91507f556e61636365707461626c652077686f5369676e6564576861742061727261796000830152602082019050919050565b6000613462601683613f83565b91507f4368616e6e656c206e6f742066696e616c697a65642e000000000000000000006000830152602082019050919050565b60006134a2602783613f83565b91507f526573706f6e7365206e6f74207369676e656420627920617574686f72697a6560008301527f64206d6f766572000000000000000000000000000000000000000000000000006020830152604082019050919050565b60a0820160008201516135116000850182613738565b5060208201516135246020850182613738565b5060408201516135376040850182612d03565b50606082015161354a6060850182612ada565b50608082015161355d6080850182612d03565b50505050565b600060a08301600083015161357b600086018261371a565b50602083015184820360208601526135938282612af8565b91505060408301516135a86040860182613738565b5060608301516135bb6060860182612ada565b5060808301516135ce6080860182613738565b508091505092915050565b6060820160008201516135ef6000850182613756565b5060208201516136026020850182612d03565b5060408201516136156040850182612d03565b50505050565b60a0820160008201516136316000850182613738565b5060208201516136446020850182612ce5565b5060408201516136576040850182612d03565b50606082015161366a6060850182612d03565b50608082015161367d6080850182612d03565b50505050565b600060408301600083015184820360008601526136a08282612d38565b915050602083015184820360208601526136ba8282612d38565b9150508091505092915050565b600060408301600083015184820360008601526136e48282612d38565b915050602083015184820360208601526136fe8282612d38565b9150508091505092915050565b61371481613fbc565b82525050565b61372381613fdc565b82525050565b61373281613fdc565b82525050565b61374181613fe6565b82525050565b61375081613fe6565b82525050565b61375f81613ff8565b82525050565b61376e81613ff8565b82525050565b60006137808285612daa565b915061378c8284612d21565b6020820191508190509392505050565b60006020820190506137b16000830184612cf4565b92915050565b60006020820190506137cc6000830184612d12565b92915050565b60006040820190506137e76000830185612d12565b6137f46020830184612d12565b9392505050565b60006040820190506138106000830185612d12565b81810360208301526138228184612d71565b90509392505050565b60006040820190506138406000830184612d12565b8181036020830152613851816131f1565b905092915050565b600060808201905061386e6000830187612d12565b61387b6020830186613765565b6138886040830185612d12565b6138956060830184612d12565b95945050505050565b600060208201905081810360008301526138b88184612d71565b905092915050565b600060208201905081810360008301526138d981612ddb565b9050919050565b600060208201905081810360008301526138f981612e67565b9050919050565b6000602082019050818103600083015261391981612ecd565b9050919050565b6000602082019050818103600083015261393981612f0d565b9050919050565b6000602082019050818103600083015261395981612f99565b9050919050565b6000602082019050818103600083015261397981612fd9565b9050919050565b6000602082019050818103600083015261399981613019565b9050919050565b600060208201905081810360008301526139b981613059565b9050919050565b600060208201905081810360008301526139d981613099565b9050919050565b600060208201905081810360008301526139f9816130d9565b9050919050565b60006020820190508181036000830152613a1981613165565b9050919050565b60006020820190508181036000830152613a3981613231565b9050919050565b60006020820190508181036000830152613a59816132bd565b9050919050565b60006020820190508181036000830152613a7981613349565b9050919050565b60006020820190508181036000830152613a99816133af565b9050919050565b60006020820190508181036000830152613ab981613415565b9050919050565b60006020820190508181036000830152613ad981613455565b9050919050565b60006020820190508181036000830152613af981613495565b9050919050565b600060a082019050613b1560008301846134fb565b92915050565b600060a082019050613b30600083018461361b565b92915050565b60006080820190508181036000830152613b5081876136c7565b90508181036020830152613b6481866136c7565b9050613b736040830185613747565b613b806060830184613729565b95945050505050565b6000606082019050613b9e6000830186613729565b8181036020830152613bb08185612b56565b9050613bbf6040830184613747565b949350505050565b6000602082019050613bdc6000830184613747565b92915050565b6000606082019050613bf76000830186613747565b613c046020830185612ae9565b8181036040830152613c168184612d71565b9050949350505050565b600061010082019050613c36600083018b613747565b613c43602083018a613747565b613c506040830189612ae9565b613c5d6060830188612cf4565b8181036080830152613c6f8187613563565b905081810360a0830152613c838186612c12565b905081810360c0830152613c978185612bb4565b905081810360e0830152613cab8184612c87565b90509998505050505050505050565b6000606082019050613ccf6000830186613747565b613cdc6020830185613747565b613ce9604083018461370b565b949350505050565b6000604051905081810181811067ffffffffffffffff82111715613d1457600080fd5b8060405250919050565b600067ffffffffffffffff821115613d3557600080fd5b602082029050602081019050919050565b600067ffffffffffffffff821115613d5d57600080fd5b602082029050919050565b600067ffffffffffffffff821115613d7f57600080fd5b602082029050602081019050919050565b600067ffffffffffffffff821115613da757600080fd5b602082029050602081019050919050565b600067ffffffffffffffff821115613dcf57600080fd5b602082029050919050565b600067ffffffffffffffff821115613df157600080fd5b602082029050602081019050919050565b600067ffffffffffffffff821115613e1957600080fd5b602082029050602081019050919050565b600067ffffffffffffffff821115613e4157600080fd5b601f19601f8301169050602081019050919050565b6000819050602082019050919050565b6000819050602082019050919050565b6000819050602082019050919050565b6000819050602082019050919050565b600081519050919050565b600081519050919050565b600081519050919050565b600081519050919050565b600081519050919050565b6000602082019050919050565b6000602082019050919050565b6000602082019050919050565b6000602082019050919050565b600082825260208201905092915050565b600082825260208201905092915050565b600082825260208201905092915050565b600082825260208201905092915050565b600082825260208201905092915050565b600082825260208201905092915050565b600082825260208201905092915050565b600081905092915050565b600082825260208201905092915050565b6000613f9f82613fbc565b9050919050565b60008115159050919050565b6000819050919050565b600073ffffffffffffffffffffffffffffffffffffffff82169050919050565b6000819050919050565b600065ffffffffffff82169050919050565b600060ff82169050919050565b82818337600083830152505050565b60005b83811015614032578082015181840152602081019050614017565b83811115614041576000848401525b50505050565b6000819050919050565b6000601f19601f8301169050919050565b61406b81613f94565b811461407657600080fd5b50565b61408281613fa6565b811461408d57600080fd5b50565b61409981613fb2565b81146140a457600080fd5b50565b6140b081613fdc565b81146140bb57600080fd5b50565b6140c781613fe6565b81146140d257600080fd5b50565b6140de81613ff8565b81146140e957600080fd5b5056fea2646970667358221220d85c09aa60926bcd66495cd6d9ed4aa188667019b411d5d015c9a2addf4e22d564736f6c634300060c0033",
  "deployedBytecode": "0x608060405234801561001057600080fd5b506004361061009e5760003560e01c80637ff6a982116100665780637ff6a98214610157578063eb02651414610173578063f198bea91461018f578063fe9e5db9146101ab578063ff8ceb32146101dd5761009e565b80630149b762146100a35780635a04d456146100bf5780636775b173146100db5780636f65e87d1461010b57806374ce052a1461013b575b600080fd5b6100bd60048036038101906100b89190612623565b6101f9565b005b6100d960048036038101906100d49190612541565b61023c565b005b6100f560048036038101906100f0919061280b565b6103cd565b604051610102919061379c565b60405180910390f35b61012560048036038101906101209190612518565b6103e7565b60405161013291906137b7565b60405180910390f35b61015560048036038101906101509190612541565b6103ff565b005b610171600480360381019061016c919061289a565b61049c565b005b61018d60048036038101906101889190612980565b6106ef565b005b6101a960048036038101906101a4919061270c565b610927565b005b6101c560048036038101906101c09190612518565b610ae1565b6040516101d493929190613cba565b60405180910390f35b6101f760048036038101906101f29190612406565b610b02565b005b600061020487610d09565b905061020f81610d49565b6102198187610dad565b610228868686848b8888610e13565b506102338187610e9c565b50505050505050565b61024586610f4b565b600081604051602001610258919061389e565b6040516020818303038152906040528051906020012090506102c66040518060a001604052808865ffffffffffff1681526020018765ffffffffffff1681526020018681526020018573ffffffffffffffffffffffffffffffffffffffff1681526020018381525088610fae565b6060828060200190518101906102dc91906124ae565b905060005b81518110156103c2578181815181106102f657fe5b60200260200101516000015173ffffffffffffffffffffffffffffffffffffffff1663a3c863a38a84848151811061032a57fe5b602002602001015160200151805190602001206040518363ffffffff1660e01b815260040161035a9291906137d2565b602060405180830381600087803b15801561037457600080fd5b505af1158015610388573d6000803e3d6000fd5b505050506040513d601f19601f820116820180604052508101906103ac91906124ef565b6103b557600080fd5b80806001019150506102e1565b505050505050505050565b60006103dc868686868661100d565b905095945050505050565b60006020528060005260406000206000915090505481565b61040886610f4b565b60008160405160200161041b919061389e565b6040516020818303038152906040528051906020012090506104896040518060a001604052808865ffffffffffff1681526020018765ffffffffffff1681526020018681526020018573ffffffffffffffffffffffffffffffffffffffff1681526020018381525088610fae565b61049387836112b7565b50505050505050565b60006104a787610d09565b90506104b281610d49565b8360ff166001890165ffffffffffff161015610503576040517f08c379a00000000000000000000000000000000000000000000000000000000081526004016104fa906138e0565b60405180910390fd5b60608460ff1667ffffffffffffffff8111801561051f57600080fd5b5060405190808252806020026020018201604052801561054e5781602001602082028036833780820191505090505b50905060005b8560ff168165ffffffffffff1610156105f6576040518060a001604052808760ff16600184018d010365ffffffffffff168152602001600115158152602001848152602001898152602001888152506040516020016105b39190613b1b565b60405160208183030381529060405280519060200120828265ffffffffffff16815181106105dd57fe5b6020026020010181815250508080600101915050610554565b5061060889896020015183868861140a565b610647576040517f08c379a000000000000000000000000000000000000000000000000000000000815260040161063e90613a80565b60405180910390fd5b6106a16040518060a00160405280600065ffffffffffff1681526020014265ffffffffffff1681526020016000801b8152602001600073ffffffffffffffffffffffffffffffffffffffff16815260200188815250611529565b60008084815260200190815260200160002081905550817f3e659e9176c25a527f4575e010a270b3e1f8e9d1e94f5e49d4a91dd2c59e8cf860405160405180910390a2505050505050505050565b60006106fa87610d09565b905061070581610d49565b60608460ff1667ffffffffffffffff8111801561072157600080fd5b506040519080825280602002602001820160405280156107505781602001602082028036833780820191505090505b509050600086604051602001610766919061389e565b60405160208183030381529060405280519060200120905060005b8660ff168165ffffffffffff161015610823576040518060a001604052808860ff16600184018e010365ffffffffffff1681526020016001151581526020018581526020018a8152602001838152506040516020016107e09190613b1b565b60405160208183030381529060405280519060200120838265ffffffffffff168151811061080a57fe5b6020026020010181815250508080600101915050610781565b506108358a8a6020015184878961140a565b610874576040517f08c379a000000000000000000000000000000000000000000000000000000000815260040161086b906139c0565b60405180910390fd5b6108ce6040518060a00160405280600065ffffffffffff1681526020014265ffffffffffff1681526020016000801b8152602001600073ffffffffffffffffffffffffffffffffffffffff16815260200183815250611529565b60008085815260200190815260200160002081905550827f3e659e9176c25a527f4575e010a270b3e1f8e9d1e94f5e49d4a91dd2c59e8cf860405160405180910390a261091b83886112b7565b50505050505050505050565b600061093288610d09565b90506000600281111561094157fe5b61094a826115be565b600281111561095557fe5b141561096a57610965818861160d565b6109ab565b6001600281111561097757fe5b610980826115be565b600281111561098b57fe5b14156109a05761099b8188610dad565b6109aa565b6109a981610d49565b5b5b60006109bc888888858d8a8a610e13565b905060006109cf828b6020015186611674565b9050827f1f9f029de8ab3f81b5381a9bc066b421d0f215db28cc8160ec346bc6f0463c6e8a8c6080015142018460008c60ff16118f8e8d8d604051610a1b989796959493929190613c20565b60405180910390a2610abf6040518060a001604052808b65ffffffffffff1681526020018c60800151420165ffffffffffff1681526020018481526020018373ffffffffffffffffffffffffffffffffffffffff1681526020018a60018c510381518110610a8557fe5b602002602001015160000151604051602001610aa1919061389e565b60405160208183030381529060405280519060200120815250611529565b6000808581526020019081526020016000208190555050505050505050505050565b6000806000610aef846116f8565b8093508194508295505050509193909250565b6000610b0d84610d09565b9050600080610b1b836116f8565b50915091506000610b4086600060028110610b3257fe5b60200201516000015161174f565b90506000610b6287600160028110610b5457fe5b60200201516000015161174f565b90506000610b9a858b600060028110610b7757fe5b6020020151888c8c600060028110610b8b57fe5b6020020151602001518861177f565b90506000610bd5600187018c600160028110610bb257fe5b6020020151898d8d600160028110610bc657fe5b6020020151602001518861177f565b9050610c2d6040518060a001604052808865ffffffffffff1681526020018765ffffffffffff1681526020018481526020018e73ffffffffffffffffffffffffffffffffffffffff1681526020018681525088611816565b89602001518a60200151516001880165ffffffffffff1681610c4b57fe5b0681518110610c5657fe5b602002602001015173ffffffffffffffffffffffffffffffffffffffff16610c7e828a61182d565b73ffffffffffffffffffffffffffffffffffffffff1614610cd4576040517f08c379a0000000000000000000000000000000000000000000000000000000008152600401610ccb90613ae0565b60405180910390fd5b610ced8a60200151518c8b60018a018e6060015161100d565b50610cfb8760018801610e9c565b505050505050505050505050565b6000816000015182602001518360400151604051602001610d2c93929190613b89565b604051602081830303815290604052805190602001209050919050565b600280811115610d5557fe5b610d5e826115be565b6002811115610d6957fe5b1415610daa576040517f08c379a0000000000000000000000000000000000000000000000000000000008152600401610da190613940565b60405180910390fd5b50565b6000610db8836116f8565b505090508065ffffffffffff168265ffffffffffff1611610e0e576040517f08c379a0000000000000000000000000000000000000000000000000000000008152600401610e0590613900565b60405180910390fd5b505050565b60006060610e2489898989896118fa565b9050610e3789866020015183878761140a565b610e76576040517f08c379a0000000000000000000000000000000000000000000000000000000008152600401610e6d906139c0565b60405180910390fd5b80600182510381518110610e8657fe5b6020026020010151915050979650505050505050565b610ef96040518060a001604052808365ffffffffffff168152602001600065ffffffffffff1681526020016000801b8152602001600073ffffffffffffffffffffffffffffffffffffffff1681526020016000801b815250611529565b60008084815260200190815260200160002081905550817f07da0a0674fb921e484018c8b81d80e292745e5d8ed134b580c8b9c631c5e9e082604051610f3f9190613bc7565b60405180910390a25050565b600280811115610f5757fe5b610f60826115be565b6002811115610f6b57fe5b14610fab576040517f08c379a0000000000000000000000000000000000000000000000000000000008152600401610fa290613ac0565b60405180910390fd5b50565b610fca8260008084815260200190815260200160002054611ae1565b611009576040517f08c379a000000000000000000000000000000000000000000000000000000000815260040161100090613a60565b60405180910390fd5b5050565b60008460016002811061101c57fe5b60200201511561109e5761105a8460016002811061103657fe5b6020020151600001518560006002811061104c57fe5b602002015160000151611af6565b611099576040517f08c379a000000000000000000000000000000000000000000000000000000000815260040161109090613a40565b60405180910390fd5b6112aa565b846000600281106110ab57fe5b6020020151156110f0576040517f08c379a00000000000000000000000000000000000000000000000000000000081526004016110e790613a20565b60405180910390fd5b856002028365ffffffffffff1610156111ee576111378460016002811061111357fe5b6020020151600001518560006002811061112957fe5b602002015160000151611af6565b611176576040517f08c379a000000000000000000000000000000000000000000000000000000000815260040161116d906139e0565b60405180910390fd5b6111aa8460016002811061118657fe5b6020020151602001518560006002811061119c57fe5b602002015160200151611af6565b6111e9576040517f08c379a00000000000000000000000000000000000000000000000000000000081526004016111e0906138c0565b60405180910390fd5b6112a9565b8173ffffffffffffffffffffffffffffffffffffffff1663fd7a2f658560006002811061121757fe5b60200201518660016002811061122957fe5b6020020151868a6040518563ffffffff1660e01b815260040161124f9493929190613b36565b60206040518083038186803b15801561126757600080fd5b505afa15801561127b573d6000803e3d6000fd5b505050506040513d601f19601f8201168201806040525081019061129f91906124ef565b6112a857600080fd5b5b5b6001905095945050505050565b6060818060200190518101906112cd91906124ae565b905060005b8151811015611404576112e3611cf6565b8282815181106112ef57fe5b60200260200101516020015180602001905181019061130e91906125e2565b90506000600181111561131d57fe5b60ff16816000015160ff1614156113bb5782828151811061133a57fe5b60200260200101516000015173ffffffffffffffffffffffffffffffffffffffff1663022cbbe88683602001516040518363ffffffff1660e01b81526004016113849291906137fb565b600060405180830381600087803b15801561139e57600080fd5b505af11580156113b2573d6000803e3d6000fd5b505050506113f6565b6040517f08c379a00000000000000000000000000000000000000000000000000000000081526004016113ed90613920565b60405180910390fd5b5080806001019150506112d2565b50505050565b6000808551905060008551905061142384898484611b63565b611462576040517f08c379a000000000000000000000000000000000000000000000000000000000815260040161145990613aa0565b60405180910390fd5b60005b828110156115185760006114b58887848151811061147f57fe5b602002602001015160ff168151811061149457fe5b60200260200101518884815181106114a857fe5b602002602001015161182d565b90508882815181106114c357fe5b602002602001015173ffffffffffffffffffffffffffffffffffffffff168173ffffffffffffffffffffffffffffffffffffffff161461150a576000945050505050611520565b508080600101915050611465565b506001925050505b95945050505050565b600080600061010090506030810390508061ffff16846000015165ffffffffffff16901b91506030810390508061ffff16846020015165ffffffffffff16901b821791508360405160200161157e9190613b00565b6040516020818303038152906040528051906020012060001c73ffffffffffffffffffffffffffffffffffffffff16821791508160001b92505050919050565b6000806115ca836116f8565b5091505060008165ffffffffffff1614156115e9576000915050611608565b428165ffffffffffff1611611602576002915050611608565b60019150505b919050565b6000611618836116f8565b505090508065ffffffffffff168265ffffffffffff16101561166f576040517f08c379a000000000000000000000000000000000000000000000000000000000815260040161166690613960565b60405180910390fd5b505050565b60006116a68460405160200161168a919061382b565b604051602081830303815290604052805190602001208361182d565b90506116b28184611c17565b6116f1576040517f08c379a00000000000000000000000000000000000000000000000000000000081526004016116e8906139a0565b60405180910390fd5b9392505050565b600080600080600080868152602001908152602001600020549050600061010090506030810390508061ffff168260001c901c94506030810390508061ffff168260001c901c93508160001c925050509193909250565b600081604051602001611762919061389e565b604051602081830303815290604052805190602001209050919050565b60006040518060a001604052808865ffffffffffff168152602001871515815260200186815260200185608001518660600151866040516020016117c593929190613be2565b604051602081830303815290604052805190602001208152602001838152506040516020016117f49190613b1b565b6040516020818303038152906040528051906020012090509695505050505050565b6118208282610fae565b61182981611c92565b5050565b6000806040518060400160405280601c81526020017f19457468657265756d205369676e6564204d6573736167653a0a33320000000081525084604051602001611878929190613774565b6040516020818303038152906040528051906020012090506000600182856000015186602001518760400151604051600081526020016040526040516118c19493929190613859565b6020604051602081039080840390855afa1580156118e3573d6000803e3d6000fd5b505050602060405103519050809250505092915050565b606080855167ffffffffffffffff8111801561191557600080fd5b506040519080825280602002602001820160405280156119445781602001602082028036833780820191505090505b509050600060018660ff168903019050600080600090505b88518165ffffffffffff161015611ad1578060018a518c03010191506119df828465ffffffffffff168465ffffffffffff16101589898d8665ffffffffffff16815181106119a657fe5b6020026020010151602001516119da8f8865ffffffffffff16815181106119c957fe5b60200260200101516000015161174f565b61177f565b848265ffffffffffff16815181106119f357fe5b6020026020010181815250508965ffffffffffff168265ffffffffffff161015611ac457611ac286602001515160405180604001604052808665ffffffffffff168665ffffffffffff1610151515151581526020018665ffffffffffff166001870165ffffffffffff1610151515151581525060405180604001604052808d8665ffffffffffff1681518110611a8557fe5b602002602001015181526020018d6001870165ffffffffffff1681518110611aa957fe5b6020026020010151815250600186018a6060015161100d565b505b808060010191505061195c565b5082935050505095945050505050565b600081611aed84611529565b14905092915050565b6000806001905083518351811460018114611b145760009250611b57565b600160208701838101602088015b600284838510011415611b52578051835114611b415760009650600093505b602083019250602081019050611b22565b505050505b50508091505092915050565b600082855114611ba8576040517f08c379a0000000000000000000000000000000000000000000000000000000008152600401611b9f90613a00565b60405180910390fd5b60005b83811015611c0957600084828765ffffffffffff1687010381611bca57fe5b06905083600182898581518110611bdd57fe5b602002602001015160ff1601011015611bfb57600092505050611c0f565b508080600101915050611bab565b50600190505b949350505050565b600080600090505b8251811015611c8657828181518110611c3457fe5b602002602001015173ffffffffffffffffffffffffffffffffffffffff168473ffffffffffffffffffffffffffffffffffffffff161415611c79576001915050611c8c565b8080600101915050611c1f565b50600090505b92915050565b60016002811115611c9f57fe5b611ca8826115be565b6002811115611cb357fe5b14611cf3576040517f08c379a0000000000000000000000000000000000000000000000000000000008152600401611cea90613980565b60405180910390fd5b50565b6040518060400160405280600060ff168152602001606081525090565b600081359050611d2281614062565b92915050565b600081519050611d3781614062565b92915050565b600082601f830112611d4e57600080fd5b8135611d61611d5c82613d1e565b613cf1565b91508181835260208401935060208101905083856020840282011115611d8657600080fd5b60005b83811015611db65781611d9c8882611d13565b845260208401935060208301925050600181019050611d89565b5050505092915050565b600082601f830112611dd157600080fd5b6002611de4611ddf82613d46565b613cf1565b91508183856020840282011115611dfa57600080fd5b60005b83811015611e2a5781611e108882612087565b845260208401935060208301925050600181019050611dfd565b5050505092915050565b600082601f830112611e4557600080fd5b8151611e58611e5382613d68565b613cf1565b9150818183526020840193506020810190508360005b83811015611e9e5781518601611e848882612272565b845260208401935060208301925050600181019050611e6e565b5050505092915050565b600082601f830112611eb957600080fd5b8135611ecc611ec782613d90565b613cf1565b91508181835260208401935060208101905083856060840282011115611ef157600080fd5b60005b83811015611f215781611f0788826122d6565b845260208401935060608301925050600181019050611ef4565b5050505092915050565b600082601f830112611f3c57600080fd5b6002611f4f611f4a82613db8565b613cf1565b9150818360005b83811015611f865781358601611f6c8882612336565b845260208401935060208301925050600181019050611f56565b5050505092915050565b600082601f830112611fa157600080fd5b8135611fb4611faf82613dda565b613cf1565b9150818183526020840193506020810190508360005b83811015611ffa5781358601611fe08882612336565b845260208401935060208301925050600181019050611fca565b5050505092915050565b600082601f83011261201557600080fd5b813561202861202382613e02565b613cf1565b9150818183526020840193506020810190508385602084028201111561204d57600080fd5b60005b8381101561207d578161206388826123dc565b845260208401935060208301925050600181019050612050565b5050505092915050565b60008135905061209681614079565b92915050565b6000815190506120ab81614079565b92915050565b6000813590506120c081614090565b92915050565b600082601f8301126120d757600080fd5b81356120ea6120e582613e2a565b613cf1565b9150808252602083016020830185838301111561210657600080fd5b612111838284614005565b50505092915050565b600082601f83011261212b57600080fd5b815161213e61213982613e2a565b613cf1565b9150808252602083016020830185838301111561215a57600080fd5b612165838284614014565b50505092915050565b60006040828403121561218057600080fd5b61218a6040613cf1565b9050600061219a848285016123f1565b600083015250602082015167ffffffffffffffff8111156121ba57600080fd5b6121c68482850161211a565b60208301525092915050565b600060a082840312156121e457600080fd5b6121ee60a0613cf1565b905060006121fe848285016123b2565b600083015250602082013567ffffffffffffffff81111561221e57600080fd5b61222a84828501611d3d565b602083015250604061223e848285016123c7565b604083015250606061225284828501611d13565b6060830152506080612266848285016123c7565b60808301525092915050565b60006040828403121561228457600080fd5b61228e6040613cf1565b9050600061229e84828501611d28565b600083015250602082015167ffffffffffffffff8111156122be57600080fd5b6122ca8482850161211a565b60208301525092915050565b6000606082840312156122e857600080fd5b6122f26060613cf1565b90506000612302848285016123dc565b6000830152506020612316848285016120b1565b602083015250604061232a848285016120b1565b60408301525092915050565b60006040828403121561234857600080fd5b6123526040613cf1565b9050600082013567ffffffffffffffff81111561236e57600080fd5b61237a848285016120c6565b600083015250602082013567ffffffffffffffff81111561239a57600080fd5b6123a6848285016120c6565b60208301525092915050565b6000813590506123c1816140a7565b92915050565b6000813590506123d6816140be565b92915050565b6000813590506123eb816140d5565b92915050565b600081519050612400816140d5565b92915050565b6000806000806000610100868803121561241f57600080fd5b600061242d88828901611d13565b955050602061243e88828901611dc0565b945050606086013567ffffffffffffffff81111561245b57600080fd5b612467888289016121d2565b935050608086013567ffffffffffffffff81111561248457600080fd5b61249088828901611f2b565b92505060a06124a1888289016122d6565b9150509295509295909350565b6000602082840312156124c057600080fd5b600082015167ffffffffffffffff8111156124da57600080fd5b6124e684828501611e34565b91505092915050565b60006020828403121561250157600080fd5b600061250f8482850161209c565b91505092915050565b60006020828403121561252a57600080fd5b6000612538848285016120b1565b91505092915050565b60008060008060008060c0878903121561255a57600080fd5b600061256889828a016120b1565b965050602061257989828a016123c7565b955050604061258a89828a016123c7565b945050606061259b89828a016120b1565b93505060806125ac89828a01611d13565b92505060a087013567ffffffffffffffff8111156125c957600080fd5b6125d589828a016120c6565b9150509295509295509295565b6000602082840312156125f457600080fd5b600082015167ffffffffffffffff81111561260e57600080fd5b61261a8482850161216e565b91505092915050565b60008060008060008060c0878903121561263c57600080fd5b600087013567ffffffffffffffff81111561265657600080fd5b61266289828a016121d2565b965050602061267389828a016123c7565b955050604087013567ffffffffffffffff81111561269057600080fd5b61269c89828a01611f90565b94505060606126ad89828a016123dc565b935050608087013567ffffffffffffffff8111156126ca57600080fd5b6126d689828a01611ea8565b92505060a087013567ffffffffffffffff8111156126f357600080fd5b6126ff89828a01612004565b9150509295509295509295565b6000806000806000806000610120888a03121561272857600080fd5b600088013567ffffffffffffffff81111561274257600080fd5b61274e8a828b016121d2565b975050602061275f8a828b016123c7565b965050604088013567ffffffffffffffff81111561277c57600080fd5b6127888a828b01611f90565b95505060606127998a828b016123dc565b945050608088013567ffffffffffffffff8111156127b657600080fd5b6127c28a828b01611ea8565b93505060a088013567ffffffffffffffff8111156127df57600080fd5b6127eb8a828b01612004565b92505060c06127fc8a828b016122d6565b91505092959891949750929550565b600080600080600060c0868803121561282357600080fd5b6000612831888289016123b2565b955050602061284288828901611dc0565b945050606086013567ffffffffffffffff81111561285f57600080fd5b61286b88828901611f2b565b935050608061287c888289016123c7565b92505060a061288d88828901611d13565b9150509295509295909350565b600080600080600080600060e0888a0312156128b557600080fd5b60006128c38a828b016123c7565b975050602088013567ffffffffffffffff8111156128e057600080fd5b6128ec8a828b016121d2565b96505060406128fd8a828b016120b1565b955050606061290e8a828b016120b1565b945050608061291f8a828b016123dc565b93505060a088013567ffffffffffffffff81111561293c57600080fd5b6129488a828b01612004565b92505060c088013567ffffffffffffffff81111561296557600080fd5b6129718a828b01611ea8565b91505092959891949750929550565b600080600080600080600060e0888a03121561299b57600080fd5b60006129a98a828b016123c7565b975050602088013567ffffffffffffffff8111156129c657600080fd5b6129d28a828b016121d2565b96505060406129e38a828b016120b1565b955050606088013567ffffffffffffffff811115612a0057600080fd5b612a0c8a828b016120c6565b9450506080612a1d8a828b016123dc565b93505060a088013567ffffffffffffffff811115612a3a57600080fd5b612a468a828b01612004565b92505060c088013567ffffffffffffffff811115612a6357600080fd5b612a6f8a828b01611ea8565b91505092959891949750929550565b6000612a8a8383612ada565b60208301905092915050565b6000612aa283836135d9565b60608301905092915050565b6000612aba8383613683565b905092915050565b6000612ace8383613756565b60208301905092915050565b612ae381613f94565b82525050565b612af281613f94565b82525050565b6000612b0382613e96565b612b0d8185613f01565b9350612b1883613e56565b8060005b83811015612b49578151612b308882612a7e565b9750612b3b83613ecd565b925050600181019050612b1c565b5085935050505092915050565b6000612b6182613e96565b612b6b8185613f12565b9350612b7683613e56565b8060005b83811015612ba7578151612b8e8882612a7e565b9750612b9983613ecd565b925050600181019050612b7a565b5085935050505092915050565b6000612bbf82613ea1565b612bc98185613f23565b9350612bd483613e66565b8060005b83811015612c05578151612bec8882612a96565b9750612bf783613eda565b925050600181019050612bd8565b5085935050505092915050565b6000612c1d82613eac565b612c278185613f34565b935083602082028501612c3985613e76565b8060005b85811015612c755784840389528151612c568582612aae565b9450612c6183613ee7565b925060208a01995050600181019050612c3d565b50829750879550505050505092915050565b6000612c9282613eb7565b612c9c8185613f45565b9350612ca783613e86565b8060005b83811015612cd8578151612cbf8882612ac2565b9750612cca83613ef4565b925050600181019050612cab565b5085935050505092915050565b612cee81613fa6565b82525050565b612cfd81613fa6565b82525050565b612d0c81613fb2565b82525050565b612d1b81613fb2565b82525050565b612d32612d2d82613fb2565b614047565b82525050565b6000612d4382613ec2565b612d4d8185613f56565b9350612d5d818560208601614014565b612d6681614051565b840191505092915050565b6000612d7c82613ec2565b612d868185613f67565b9350612d96818560208601614014565b612d9f81614051565b840191505092915050565b6000612db582613ec2565b612dbf8185613f78565b9350612dcf818560208601614014565b80840191505092915050565b6000612de8604483613f83565b91507f496e76616c69645472616e736974696f6e4572726f723a2043616e6e6f74206360008301527f68616e676520746865206170704461746120647572696e67207365747570207060208301527f68617365000000000000000000000000000000000000000000000000000000006040830152606082019050919050565b6000612e74603d83613f83565b91507f6c6172676573745475726e4e756d202b2031206d75737420626520677265617460008301527f6572207468616e206f7220657175616c20746f206e756d5374617465730000006020830152604082019050919050565b6000612eda601c83613f83565b91507f7475726e4e756d5265636f7264206e6f7420696e637265617365642e000000006000830152602082019050919050565b6000612f1a604683613f83565b91507f5f7472616e73666572416c6c46726f6d416c6c4173736574486f6c646572733a60008301527f2041737365744f7574636f6d6554797065206973206e6f7420616e20616c6c6f60208301527f636174696f6e00000000000000000000000000000000000000000000000000006040830152606082019050919050565b6000612fa6601283613f83565b91507f4368616e6e656c2066696e616c697a65642e00000000000000000000000000006000830152602082019050919050565b6000612fe6601883613f83565b91507f7475726e4e756d5265636f7264206465637265617365642e00000000000000006000830152602082019050919050565b6000613026601583613f83565b91507f4e6f206f6e676f696e67206368616c6c656e67652e00000000000000000000006000830152602082019050919050565b6000613066601f83613f83565b91507f4368616c6c656e676572206973206e6f742061207061727469636970616e74006000830152602082019050919050565b60006130a6601283613f83565b91507f496e76616c6964207369676e61747572657300000000000000000000000000006000830152602082019050919050565b60006130e6604c83613f83565b91507f496e76616c69645472616e736974696f6e4572726f723a2043616e6e6f74206360008301527f68616e6765207468652064656661756c74206f7574636f6d6520647572696e6760208301527f20736574757020706861736500000000000000000000000000000000000000006040830152606082019050919050565b6000613172604783613f83565b91507f5f76616c69645369676e6174757265733a2077686f5369676e6564576861742060008301527f6d757374206265207468652073616d65206c656e67746820617320706172746960208301527f636970616e7473000000000000000000000000000000000000000000000000006040830152606082019050919050565b60006131fe600983613f83565b91507f666f7263654d6f766500000000000000000000000000000000000000000000006000830152602082019050919050565b600061323e604b83613f83565b91507f496e76616c69645472616e736974696f6e4572726f723a2043616e6e6f74206d60008301527f6f76652066726f6d20612066696e616c20737461746520746f2061206e6f6e2060208301527f66696e616c2073746174650000000000000000000000000000000000000000006040830152606082019050919050565b60006132ca605583613f83565b91507f496e76616c69645472616e736974696f6e4572726f723a2043616e6e6f74206d60008301527f6f766520746f20612066696e616c20737461746520776974682061206469666660208301527f6572656e742064656661756c74206f7574636f6d6500000000000000000000006040830152606082019050919050565b6000613356602e83613f83565b91507f4368616e6e656c2073746f7261676520646f6573206e6f74206d61746368207360008301527f746f7265642076657273696f6e2e0000000000000000000000000000000000006020830152604082019050919050565b60006133bc602b83613f83565b91507f496e76616c6964207369676e617475726573204f5220697346696e616c3d747260008301527f75652065787065637465640000000000000000000000000000000000000000006020830152604082019050919050565b6000613422602083613f83565b91507f556e61636365707461626c652077686f5369676e6564576861742061727261796000830152602082019050919050565b6000613462601683613f83565b91507f4368616e6e656c206e6f742066696e616c697a65642e000000000000000000006000830152602082019050919050565b60006134a2602783613f83565b91507f526573706f6e7365206e6f74207369676e656420627920617574686f72697a6560008301527f64206d6f766572000000000000000000000000000000000000000000000000006020830152604082019050919050565b60a0820160008201516135116000850182613738565b5060208201516135246020850182613738565b5060408201516135376040850182612d03565b50606082015161354a6060850182612ada565b50608082015161355d6080850182612d03565b50505050565b600060a08301600083015161357b600086018261371a565b50602083015184820360208601526135938282612af8565b91505060408301516135a86040860182613738565b5060608301516135bb6060860182612ada565b5060808301516135ce6080860182613738565b508091505092915050565b6060820160008201516135ef6000850182613756565b5060208201516136026020850182612d03565b5060408201516136156040850182612d03565b50505050565b60a0820160008201516136316000850182613738565b5060208201516136446020850182612ce5565b5060408201516136576040850182612d03565b50606082015161366a6060850182612d03565b50608082015161367d6080850182612d03565b50505050565b600060408301600083015184820360008601526136a08282612d38565b915050602083015184820360208601526136ba8282612d38565b9150508091505092915050565b600060408301600083015184820360008601526136e48282612d38565b915050602083015184820360208601526136fe8282612d38565b9150508091505092915050565b61371481613fbc565b82525050565b61372381613fdc565b82525050565b61373281613fdc565b82525050565b61374181613fe6565b82525050565b61375081613fe6565b82525050565b61375f81613ff8565b82525050565b61376e81613ff8565b82525050565b60006137808285612daa565b915061378c8284612d21565b6020820191508190509392505050565b60006020820190506137b16000830184612cf4565b92915050565b60006020820190506137cc6000830184612d12565b92915050565b60006040820190506137e76000830185612d12565b6137f46020830184612d12565b9392505050565b60006040820190506138106000830185612d12565b81810360208301526138228184612d71565b90509392505050565b60006040820190506138406000830184612d12565b8181036020830152613851816131f1565b905092915050565b600060808201905061386e6000830187612d12565b61387b6020830186613765565b6138886040830185612d12565b6138956060830184612d12565b95945050505050565b600060208201905081810360008301526138b88184612d71565b905092915050565b600060208201905081810360008301526138d981612ddb565b9050919050565b600060208201905081810360008301526138f981612e67565b9050919050565b6000602082019050818103600083015261391981612ecd565b9050919050565b6000602082019050818103600083015261393981612f0d565b9050919050565b6000602082019050818103600083015261395981612f99565b9050919050565b6000602082019050818103600083015261397981612fd9565b9050919050565b6000602082019050818103600083015261399981613019565b9050919050565b600060208201905081810360008301526139b981613059565b9050919050565b600060208201905081810360008301526139d981613099565b9050919050565b600060208201905081810360008301526139f9816130d9565b9050919050565b60006020820190508181036000830152613a1981613165565b9050919050565b60006020820190508181036000830152613a3981613231565b9050919050565b60006020820190508181036000830152613a59816132bd565b9050919050565b60006020820190508181036000830152613a7981613349565b9050919050565b60006020820190508181036000830152613a99816133af565b9050919050565b60006020820190508181036000830152613ab981613415565b9050919050565b60006020820190508181036000830152613ad981613455565b9050919050565b60006020820190508181036000830152613af981613495565b9050919050565b600060a082019050613b1560008301846134fb565b92915050565b600060a082019050613b30600083018461361b565b92915050565b60006080820190508181036000830152613b5081876136c7565b90508181036020830152613b6481866136c7565b9050613b736040830185613747565b613b806060830184613729565b95945050505050565b6000606082019050613b9e6000830186613729565b8181036020830152613bb08185612b56565b9050613bbf6040830184613747565b949350505050565b6000602082019050613bdc6000830184613747565b92915050565b6000606082019050613bf76000830186613747565b613c046020830185612ae9565b8181036040830152613c168184612d71565b9050949350505050565b600061010082019050613c36600083018b613747565b613c43602083018a613747565b613c506040830189612ae9565b613c5d6060830188612cf4565b8181036080830152613c6f8187613563565b905081810360a0830152613c838186612c12565b905081810360c0830152613c978185612bb4565b905081810360e0830152613cab8184612c87565b90509998505050505050505050565b6000606082019050613ccf6000830186613747565b613cdc6020830185613747565b613ce9604083018461370b565b949350505050565b6000604051905081810181811067ffffffffffffffff82111715613d1457600080fd5b8060405250919050565b600067ffffffffffffffff821115613d3557600080fd5b602082029050602081019050919050565b600067ffffffffffffffff821115613d5d57600080fd5b602082029050919050565b600067ffffffffffffffff821115613d7f57600080fd5b602082029050602081019050919050565b600067ffffffffffffffff821115613da757600080fd5b602082029050602081019050919050565b600067ffffffffffffffff821115613dcf57600080fd5b602082029050919050565b600067ffffffffffffffff821115613df157600080fd5b602082029050602081019050919050565b600067ffffffffffffffff821115613e1957600080fd5b602082029050602081019050919050565b600067ffffffffffffffff821115613e4157600080fd5b601f19601f8301169050602081019050919050565b6000819050602082019050919050565b6000819050602082019050919050565b6000819050602082019050919050565b6000819050602082019050919050565b600081519050919050565b600081519050919050565b600081519050919050565b600081519050919050565b600081519050919050565b6000602082019050919050565b6000602082019050919050565b6000602082019050919050565b6000602082019050919050565b600082825260208201905092915050565b600082825260208201905092915050565b600082825260208201905092915050565b600082825260208201905092915050565b600082825260208201905092915050565b600082825260208201905092915050565b600082825260208201905092915050565b600081905092915050565b600082825260208201905092915050565b6000613f9f82613fbc565b9050919050565b60008115159050919050565b6000819050919050565b600073ffffffffffffffffffffffffffffffffffffffff82169050919050565b6000819050919050565b600065ffffffffffff82169050919050565b600060ff82169050919050565b82818337600083830152505050565b60005b83811015614032578082015181840152602081019050614017565b83811115614041576000848401525b50505050565b6000819050919050565b6000601f19601f8301169050919050565b61406b81613f94565b811461407657600080fd5b50565b61408281613fa6565b811461408d57600080fd5b50565b61409981613fb2565b81146140a457600080fd5b50565b6140b081613fdc565b81146140bb57600080fd5b50565b6140c781613fe6565b81146140d257600080fd5b50565b6140de81613ff8565b81146140e957600080fd5b5056fea2646970667358221220d85c09aa60926bcd66495cd6d9ed4aa188667019b411d5d015c9a2addf4e22d564736f6c634300060c0033",
  "devdoc": {
    "details": "The NitroAdjudicator contract extends ForceMove and hence inherits all ForceMove methods, and also extends and implements the Adjudicator interface, allowing for a finalized outcome to be pushed to an asset holder.",
    "kind": "dev",
    "methods": {
      "challenge((uint256,address[],uint48,address,uint48),uint48,(bytes,bytes)[],uint8,(uint8,bytes32,bytes32)[],uint8[],(uint8,bytes32,bytes32))": {
        "details": "Registers a challenge against a state channel. A challenge will either prompt another participant into clearing the challenge (via one of the other methods), or cause the channel to finalize at a specific time.",
        "params": {
          "challengerSig": "The signature of a participant on the keccak256 of the abi.encode of (supportedStateHash, 'forceMove').",
          "fixedPart": "Data describing properties of the state channel that do not change with state updates.",
          "isFinalCount": "Describes how many of the submitted states have the `isFinal` property set to `true`. It is implied that the rightmost `isFinalCount` states are final, and the rest are not final.",
          "largestTurnNum": "The largest turn number of the submitted states; will overwrite the stored value of `turnNumRecord`.",
          "sigs": "An array of signatures that support the state with the `largestTurnNum`. There must be one for each participant, e.g.: [sig-from-p0, sig-from-p1, ...]",
          "variableParts": "An ordered array of structs, each decribing the properties of the state channel that may change with each state update. Length is from 1 to the number of participants (inclusive).",
          "whoSignedWhat": "An array denoting which participant has signed which state: `participant[i]` signed the state with index `whoSignedWhat[i]`."
        }
      },
      "checkpoint((uint256,address[],uint48,address,uint48),uint48,(bytes,bytes)[],uint8,(uint8,bytes32,bytes32)[],uint8[])": {
        "details": "Overwrites the `turnNumRecord` stored against a channel by providing a state with higher turn number, supported by a signature from each participant.",
        "params": {
          "fixedPart": "Data describing properties of the state channel that do not change with state updates.",
          "isFinalCount": "Describes how many of the submitted states have the `isFinal` property set to `true`. It is implied that the rightmost `isFinalCount` states are final, and the rest are not final.",
          "largestTurnNum": "The largest turn number of the submitted states; will overwrite the stored value of `turnNumRecord`.",
          "sigs": "An array of signatures that support the state with the `largestTurnNum`.",
          "variableParts": "An ordered array of structs, each decribing the properties of the state channel that may change with each state update.",
          "whoSignedWhat": "An array denoting which participant has signed which state: `participant[i]` signed the state with index `whoSignedWhat[i]`."
        }
      },
      "conclude(uint48,(uint256,address[],uint48,address,uint48),bytes32,bytes32,uint8,uint8[],(uint8,bytes32,bytes32)[])": {
        "details": "Finalizes a channel by providing a finalization proof.",
        "params": {
          "appPartHash": "The keccak256 of the abi.encode of `(challengeDuration, appDefinition, appData)`. Applies to all states in the finalization proof.",
          "fixedPart": "Data describing properties of the state channel that do not change with state updates.",
          "largestTurnNum": "The largest turn number of the submitted states; will overwrite the stored value of `turnNumRecord`.",
          "numStates": "The number of states in the finalization proof.",
          "outcomeHash": "The keccak256 of the abi.encode of the `outcome`. Applies to all stats in the finalization proof.",
          "sigs": "An array of signatures that support the state with the `largestTurnNum`.",
          "whoSignedWhat": "An array denoting which participant has signed which state: `participant[i]` signed the state with index `whoSignedWhat[i]`."
        }
      },
      "concludePushOutcomeAndTransferAll(uint48,(uint256,address[],uint48,address,uint48),bytes32,bytes,uint8,uint8[],(uint8,bytes32,bytes32)[])": {
        "details": "Finalizes a channel by providing a finalization proof, allows a finalized channel's outcome to be decoded and transferAll to be triggered in external Asset Holder contracts.",
        "params": {
          "appPartHash": "The keccak256 of the abi.encode of `(challengeDuration, appDefinition, appData)`. Applies to all states in the finalization proof.",
          "fixedPart": "Data describing properties of the state channel that do not change with state updates.",
          "largestTurnNum": "The largest turn number of the submitted states; will overwrite the stored value of `turnNumRecord`.",
          "numStates": "The number of states in the finalization proof.",
          "outcomeBytes": "abi.encode of an array of Outcome.OutcomeItem structs.",
          "sigs": "An array of signatures that support the state with the `largestTurnNum`.",
          "whoSignedWhat": "An array denoting which participant has signed which state: `participant[i]` signed the state with index `whoSignedWhat[i]`."
        }
      },
      "getChannelStorage(bytes32)": {
        "details": "Unpacks turnNumRecord, finalizesAt and fingerprint from the channelStorageHash of a particular channel.",
        "params": {
          "channelId": "Unique identifier for a state channel."
        },
        "returns": {
          "finalizesAt": "The unix timestamp when `channelId` will finalize.",
          "fingerprint": "Unique identifier for the channel's current state, up to hash collisions.",
          "turnNumRecord": "A turnNum that (the adjudicator knows) is supported by a signature from each participant."
        }
      },
      "pushOutcome(bytes32,uint48,uint48,bytes32,address,bytes)": {
        "details": "Allows a finalized channel's outcome to be decoded and one or more AssetOutcomes registered in external Asset Holder contracts.",
        "params": {
          "challengerAddress": "The address of the participant whom registered the challenge, if any.",
          "channelId": "Unique identifier for a state channel",
          "finalizesAt": "The unix timestamp when this channel will finalize",
          "outcomeBytes": "The encoded Outcome of this state channel.",
          "stateHash": "The keccak256 of the abi.encode of the State (struct) stored by the adjudicator",
          "turnNumRecord": "A turnNum that (the adjudicator knows and stores) is supported by a signature from each participant."
        }
      },
      "pushOutcomeAndTransferAll(bytes32,uint48,uint48,bytes32,address,bytes)": {
        "details": "Allows a finalized channel's outcome to be decoded and one or more AssetOutcomes registered in external Asset Holder contracts.",
        "params": {
          "challengerAddress": "The address of the participant whom registered the challenge, if any.",
          "channelId": "Unique identifier for a state channel",
          "finalizesAt": "The unix timestamp when this channel will finalize",
          "outcomeBytes": "The encoded Outcome of this state channel.",
          "stateHash": "The keccak256 of the abi.encode of the State (struct) stored by the adjudicator",
          "turnNumRecord": "A turnNum that (the adjudicator knows and stores) is supported by a signature from each participant."
        }
      },
      "respond(address,bool[2],(uint256,address[],uint48,address,uint48),(bytes,bytes)[2],(uint8,bytes32,bytes32))": {
        "details": "Repsonds to an ongoing challenge registered against a state channel.",
        "params": {
          "challenger": "The address of the participant whom registered the challenge.",
          "fixedPart": "Data describing properties of the state channel that do not change with state updates.",
          "isFinalAB": "An pair of booleans describing if the challenge state and/or the response state have the `isFinal` property set to `true`.",
          "sig": "The responder's signature on the `responseStateHash`.",
          "variablePartAB": "An pair of structs, each decribing the properties of the state channel that may change with each state update (for the challenge state and for the response state)."
        }
      },
      "validTransition(uint256,bool[2],(bytes,bytes)[2],uint48,address)": {
        "details": "Check that the submitted pair of states form a valid transition (public wrapper for internal function _requireValidTransition)",
        "params": {
          "ab": "Variable parts of each of the pair of states",
          "appDefinition": "Address of deployed contract containing application-specific validTransition function.",
          "isFinalAB": "Pair of booleans denoting whether the first and second state (resp.) are final.",
          "nParticipants": "Number of participants in the channel. transition",
          "turnNumB": "turnNum of the later state of the pair."
        },
        "returns": {
          "_0": "true if the later state is a validTransition from its predecessor, reverts otherwise."
        }
      }
    },
    "version": 1
  },
  "userdoc": {
    "kind": "user",
    "methods": {
      "challenge((uint256,address[],uint48,address,uint48),uint48,(bytes,bytes)[],uint8,(uint8,bytes32,bytes32)[],uint8[],(uint8,bytes32,bytes32))": {
        "notice": "Registers a challenge against a state channel. A challenge will either prompt another participant into clearing the challenge (via one of the other methods), or cause the channel to finalize at a specific time."
      },
      "checkpoint((uint256,address[],uint48,address,uint48),uint48,(bytes,bytes)[],uint8,(uint8,bytes32,bytes32)[],uint8[])": {
        "notice": "Overwrites the `turnNumRecord` stored against a channel by providing a state with higher turn number, supported by a signature from each participant."
      },
      "conclude(uint48,(uint256,address[],uint48,address,uint48),bytes32,bytes32,uint8,uint8[],(uint8,bytes32,bytes32)[])": {
        "notice": "Finalizes a channel by providing a finalization proof."
      },
      "concludePushOutcomeAndTransferAll(uint48,(uint256,address[],uint48,address,uint48),bytes32,bytes,uint8,uint8[],(uint8,bytes32,bytes32)[])": {
        "notice": "Finalizes a channel by providing a finalization proof, allows a finalized channel's outcome to be decoded and transferAll to be triggered in external Asset Holder contracts."
      },
      "getChannelStorage(bytes32)": {
        "notice": "Unpacks turnNumRecord, finalizesAt and fingerprint from the channelStorageHash of a particular channel."
      },
      "pushOutcome(bytes32,uint48,uint48,bytes32,address,bytes)": {
        "notice": "Allows a finalized channel's outcome to be decoded and one or more AssetOutcomes registered in external Asset Holder contracts."
      },
      "pushOutcomeAndTransferAll(bytes32,uint48,uint48,bytes32,address,bytes)": {
        "notice": "Allows a finalized channel's outcome to be decoded and transferAll to be triggered in external Asset Holder contracts."
      },
      "respond(address,bool[2],(uint256,address[],uint48,address,uint48),(bytes,bytes)[2],(uint8,bytes32,bytes32))": {
        "notice": "Repsonds to an ongoing challenge registered against a state channel."
      },
      "validTransition(uint256,bool[2],(bytes,bytes)[2],uint48,address)": {
        "notice": "Check that the submitted pair of states form a valid transition (public wrapper for internal function _requireValidTransition)"
      }
    },
    "version": 1
  },
  "storageLayout": {
    "storage": [
      {
        "astId": 2593,
        "contract": "contracts/NitroAdjudicator.sol:NitroAdjudicator",
        "label": "channelStorageHashes",
        "offset": 0,
        "slot": "0",
        "type": "t_mapping(t_bytes32,t_bytes32)"
      }
    ],
    "types": {
      "t_bytes32": {
        "encoding": "inplace",
        "label": "bytes32",
        "numberOfBytes": "32"
      },
      "t_mapping(t_bytes32,t_bytes32)": {
        "encoding": "mapping",
        "key": "t_bytes32",
        "label": "mapping(bytes32 => bytes32)",
        "numberOfBytes": "32",
        "value": "t_bytes32"
      }
    }
  }
}